591	iubes abire: matris imperio obsequor—
592	da quo revertar, regia frater meus
593	habitat superba: parva me abscondat casa?
594	hanc date repulso; liceat exiguo lare
595	pensare regnum? coniugi donum datus 
596	arbitria thalami dura felicis feram
597	humilisque socerum lixa dominantem sequar?
598	in servitutem cadere de regno grave est.
599	ioc. Si regna quaeris nec potest sceptro manus
600	vacare saevo, multa quae possunt peti 
601	in orbe toto quaelibet tellus dabit.
602	hinc nota Baccho Tmolus attollit iuga,
603	qua lata terris spatia frugiferis iacent
604	et qua trahens opulenta Pactolus vada
605	inundat auro rura; nec laetis minus 
606	Maeandros arvis flectit errantis aquas
607	rapidusque campos fertiles Hermus secat;
608	hinc grata Cereri Gargara et dives solum
609	quod Xanthus ambit nivibus Idaeis tumens;
610	hinc qua relinquit nomen Ionii mare 
611	faucesque Abydo Sestos opposita premit,
612	aut quae latus iam propior orienti dedit
613	tutamque crebris portibus Lyciam videt:
614	haec regna ferro quaere, in hos populos ferat
615	socer arma fortis, has tuo sceptro paret 
616	tradatque gentes, hoc adhuc regnum puta
617	tenere patrem, melius exilium est tibi
618	quam reditus iste: crimine alieno exulas,
619	tuo redibis. melius istis viribus
620	nova regna nullo scelere maculata appetes. 
621	quin ipse frater arma comitatus tua
622	tibi militabit. vade et id bellum gere
623	in quo pater materque pugnanti tibi
624	favere possint, regna cum scelere omnibus
625	sunt exilis graviora, nunc belli mala 
626	propone, dubias Martis incerti vices:
627	licet omne tecum Graeciae robur trahas,
628	licet arma longe miles ac late explicet,
629	fortuna belli semper ancipiti in loco est.
630	quodcumque Mars decernit; exaequat duos, 
631	licet impares sint, gladius; et spes et metus
632	Fors caeca versat, praemium incertum petis,
633	certum scelus, favisse fac votis deos
634	omnes tuis: cessere et aversi fugam
635	petiere cives, clade funesta iacens 
636	obtexit agros miles— exultes licet
637	victorque fratris spolia deiecti geras:
638	frangenda palma est. quale tu hoc bellum putas,
639	in quo execrandum victor admittit nefas,
640	si gaudet? hunc quem vincere infelix cupis, 
641	cum viceris, lugebis. infaustas age
642	dimitte pugnas, libera patriam metu,
643	luctu parentes,
643b	Sceleris et fraudis suae
644	poenas nefandus frater ut nullas ferat?
645	Ne metue. poenas et quidem solvet graves: 
646	regnabit, est haec poena, si dubitas, avo
647	patrique crede: Cadmus hoc dicet tibi
648	Cadmique proles, sceptra Thebano fuit
649	impune nulli gerere, nec quisquam fide
650	rupta tenebit illa: iam numeres licet 
651	fratrem inter istos.
651b	Numeret, est tanti mihi
652	cum regibus iacere, te turbae exulum
653	ascribo.
653b	Regna, dummodo invisus tuis.
654	Regnare non vult esse qui invisus timet:
655	simul ista mundi conditor posuit deus, 
656	odium atque regnum: regis hoc magni reor,
657	odia ipsa premere, multa dominantem vetat
658	amor suorum; plus in iratos licet,
659	qui vult amari, languida regnat manu.
660	Invisa numquam imperia retinentur diu. 
661	Praecepta melius imperi reges dabunt;
662	exilia tu dispone, pro regno velim—
663	Patriam penates coniugem flammis dare?
664	Imperia pretio quolibet constant bene.
