1.pr.1	Spero me secutum in libellis meis tale temperamen-
1.pr.2	tum, ut de illis queri non possit quisquis de se bene 
1.pr.3	senserit, cum salva infimarum quoque personarum re-
1.pr.4	verentia ludant; quae adeo antiquis auctoribus defuit, ut 
1.pr.5	nominibus non tantum veris abusi sint, sed et magnis. 
1.pr.6	Mihi fama vilius constet et probetur in me novissimum 
1.pr.7	ingenium. Absit a iocorum nostrorum simplicitate ma-
1.pr.8	lignus interpres nec epigrammata mea scribat: inprobe 
1.pr.9	facit qui in alieno libro ingeniosus est. Lascivam ver-
1.pr.10	borum veritatem, id est epigrammaton linguam, excu-
1.pr.11	sarem, si meum esset exemplum: sic scribit Catullus, sic 
1.pr.12	Marsus, sic Pedo, sic Gaetulicus, sic quicumque perlegi-
1.pr.13	tur. Si quis tamen tam ambitiose tristis est, ut apud 
1.pr.14	illum in nulla pagina latine loqui fas sit, potest epistula 
1.pr.15	vel potius titulo contentus esse. Epigrammata illis scri-
1.pr.16	buntur, qui solent spectare Florales. Non intret Cato 
1.pr.17	theatrum meum, aut si intraverit, spectet. Videor mihi 
1.pr.18	meo iure facturus, si epistulam versibus clusero: 
1.pr.19	Nosses iocosae dulce cum sacrum Florae 
1.pr.20	Festosque lusus et licentiam volgi, 
1.pr.21	Cur in theatrum, Cato severe, venisti? 
1.pr.22	An ideo tantum veneras, ut exires? 
1.1.1	Hic est quem legis ille, quem requiris, 
1.1.2	Toto notus in orbe Martialis 
1.1.3	Argutis epigrammaton libellis: 
1.1.4	Cui, lector studiose, quod dedisti 
1.1.5	Viventi decus atque sentienti, 
1.1.6	Rari post cineres habent poetae. 
1.2.1	Qui tecum cupis esse meos ubicumque libellos 
1.2.2	Et comites longae quaeris habere viae, 
1.2.3	Hos eme, quos artat brevibus membrana tabellis: 
1.2.4	Scrinia da magnis, me manus una capit. 
1.2.5	Ne tamen ignores ubi sim venalis, et erres 
1.2.6	Urbe vagus tota, me duce certus eris: 
1.2.7	Libertum docti Lucensis quaere Secundum 
1.2.8	Limina post Pacis Palladiumque forum. 
1.3.1	Argiletanas mavis habitare tabernas, 
1.3.2	Cum tibi, parve liber, scrinia nostra vacent. 
1.3.3	Nescis, heu, nescis dominae fastidia Romae: 
1.3.4	Crede mihi, nimium Martia turba sapit. 
1.3.5	Maiores nusquam rhonchi: iuvenesque senesque 
1.3.6	Et pueri nasum rhinocerotis habent. 
1.3.7	Audieris cum grande sophos, dum basia iactas, 
1.3.8	Ibis ab excusso missus in astra sago. 
1.3.9	Sed tu ne totiens domini patiare lituras 
1.3.10	Neve notet lusus tristis harundo tuos, 
1.3.11	Aetherias, lascive, cupis volitare per auras: 
1.3.12	I, fuge; sed poteras tutior esse domi. 
1.4.1	Contigeris nostros, Caesar, si forte libellos, 
1.4.2	Terrarum dominum pone supercilium. 
1.4.3	Consuevere iocos vestri quoque ferre triumphi, 
1.4.4	Materiam dictis nec pudet esse ducem. 
1.4.5	Qua Thymelen spectas derisoremque Latinum, 
1.4.6	Illa fronte precor carmina nostra legas. 
1.4.7	Innocuos censura potest permittere lusus: 
1.4.8	Lasciva est nobis pagina, vita proba. 
1.5.1	Do tibi naumachiam, tu das epigrammata nobis: 
1.5.2	Vis, puto, cum libro, Marce, natare tuo. 
1.6.1	Aetherias aquila puerum portante per auras 
1.6.2	Inlaesum timidis unguibus haesit onus: 
1.6.3	Nunc sua Caesareos exorat praeda leones, 
1.6.4	Tutus et ingenti ludit in ore lepus. 
1.6.5	Quae maiora putas miracula? summus utrisque 
1.6.6	Auctor adest: haec sunt Caesaris, illa Iovis. 
1.7.1	Stellae delicium mei Columba, 
1.7.2	Verona licet audiente dicam, 
1.7.3	Vicit, Maxime, Passerem Catulli. 
1.7.4	Tanto Stella meus tuo Catullo 
1.7.5	Quanto passere maior est columba. 
1.8.1	Quod magni Thraseae consummatique Catonis 
1.8.2	Dogmata sic sequeris, salvos ut esse velis, 
1.8.3	Pectore nec nudo strictos incurris in ensis, 
1.8.4	Quod fecisse velim te, Deciane, facis. 
1.8.5	Nolo virum facili redimit qui sanguine famam, 
1.8.6	Hunc volo, laudari qui sine morte potest. 
1.9.1	Bellus homo et magnus vis idem, Cotta, videri: 
1.9.2	Sed qui bellus homo est, Cotta, pusillus homo est. 
1.10.1	Petit Gemellus nuptias Maronillae 
1.10.2	Et cupit et instat et precatur et donat. 
1.10.3	Adeone pulchra est? immo foedius nil est. 
1.10.4	Quid ergo in illa petitur et placet? Tussit. 
1.11.1	Cum data sint equiti bis quina nomismata, quare 
1.11.2	Bis decies solus, Sextiliane, bibis? 
1.11.3	Iam defecisset portantis calda ministros, 
1.11.4	Si non potares, Sextiliane, merum. 
1.12.1	Itur ad Herculeas gelidi qua Tiburis arces 
1.12.2	Canaque sulphureis Albula fumat aquis, 
1.12.3	Rura nemusque sacrum dilectaque iugera Musis 
1.12.4	Signat vicina quartus ab urbe lapis. 
1.12.5	Hic rudis aestivas praestabat porticus umbras, 
1.12.6	Heu quam paene novum porticus ausa nefas! 
1.12.7	Nam subito conlapsa ruit, cum mole sub illa 
1.12.8	Gestatus biiugis Regulus esset equis. 
1.12.9	Nimirum timuit nostras Fortuna querellas, 
1.12.10	Quae par tam magnae non erat invidiae. 
1.12.11	Nunc et damna iuvant; sunt ipsa pericula tanti: 
1.12.12	Stantia non poterant tecta probare deos. 
1.13.1	Casta suo gladium cum traderet Arria Paeto, 
1.13.2	Quem de visceribus strinxerat ipsa suis, 
1.13.3	'Si qua fides, vulnus quod feci non dolet,' inquit, 
1.13.4	'Sed tu quod facies, hoc mihi, Paete, dolet.' 
1.14.1	Delicias, Caesar, lususque iocosque leonum 
1.14.2	Vidimus—hoc etiam praestat harena tibi— 
1.14.3	Cum prensus blando totiens a dente rediret 
1.14.4	Et per aperta vagus curreret ora lepus. 
1.14.5	Unde potest avidus captae leo parcere praedae? 
1.14.6	Sed tamen esse tuus dicitur: ergo potest. 
1.15.1	O mihi post nullos, Iuli, memorande sodales, 
1.15.2	Si quid longa fides canaque iura valent, 
1.15.3	Bis iam paene tibi consul tricensimus instat, 
1.15.4	Et numerat paucos vix tua vita dies. 
1.15.5	Non bene distuleris videas quae posse negari, 
1.15.6	Et solum hoc ducas, quod fuit, esse tuum. 
1.15.7	Expectant curaeque catenatique labores, 
1.15.8	Gaudia non remanent, sed fugitiva volant. 
1.15.9	Haec utraque manu conplexuque adsere toto: 
1.15.10	Saepe fluunt imo sic quoque lapsa sinu. 
1.15.11	Non est, crede mihi, sapientis dicere 'Vivam': 
1.15.12	Sera nimis vita est crastina: vive hodie. 
1.16.1	Sunt bona, sunt quaedam mediocria, sunt mala plura 
1.16.2	Quae legis hic: aliter non fit, Avite, liber. 
1.17.1	Cogit me Titus actitare causas 
1.17.2	Et dicit mihi saepe 'Magna res est.' 
1.17.3	Res magna est, Tite, quam facit colonus. 
1.18.1	Quid te, Tucca, iuvat vetulo miscere Falerno 
1.18.2	In Vaticanis condita musta cadis? 
1.18.3	Quid tantum fecere boni tibi pessima vina? 
1.18.4	Aut quid fecerunt optima vina mali? 
1.18.5	De nobis facile est, scelus est iugulare Falernum 
1.18.6	Et dare Campano toxica saeva mero. 
1.18.7	Convivae meruere tui fortasse perire: 
1.18.8	Amphora non meruit tam pretiosa mori. 
1.19.1	Si memini, fuerant tibi quattuor, Aelia, dentes: 
1.19.2	Expulit una duos tussis et una duos. 
1.19.3	Iam secura potes totis tussire diebus: 
1.19.4	Nil istic quod agat tertia tussis habet. 
1.20.1	Dic mihi, quis furor est? turba spectante vocata 
1.20.2	Solus boletos, Caeciliane, voras. 
1.20.3	Quid dignum tanto tibi ventre gulaque precabor? 
1.20.4	Boletum qualem Claudius edit, edas. 
1.21.1	Cum peteret regem, decepta satellite dextra 
1.21.2	Ingessit sacris se peritura focis. 
1.21.3	Sed tam saeva pius miracula non tulit hostis 
1.21.4	Et raptum flammis iussit abire virum: 
1.21.5	Urere quam potuit contempto Mucius igne, 
1.21.6	Hanc spectare manum Porsena non potuit. 
1.21.7	Maior deceptae fama est et gloria dextrae: 
1.21.8	Si non errasset, fecerat illa minus. 
1.22.1	Quid nunc saeva fugis placidi lepus ora leonis? 
1.22.2	Frangere tam parvas non didicere feras. 
1.22.3	Servantur magnis isti cervicibus ungues 
1.22.4	Nec gaudet tenui sanguine tanta sitis. 
1.22.5	Praeda canum lepus est, vastos non implet hiatus 
1.22.6	Non timeat Dacus Caesaris arma puer. 
1.23.1	Invitas nullum nisi cum quo, Cotta, lavaris 
1.23.2	Et dant convivam balnea sola tibi. 
1.23.3	Mirabar, quare numquam me, Cotta, vocasses: 
1.23.4	Iam scio, me nudum displicuisse tibi. 
1.24.1	Aspicis incomptis illum, Deciane, capillis, 
1.24.2	Cuius et ipse times triste supercilium, 
1.24.3	Qui loquitur Curios adsertoresque Camillos? 
1.24.4	Nolito fronti credere: nupsit heri. 
1.25.1	Ede tuos tandem populo, Faustine, libellos 
1.25.2	Et cultum docto pectore profer opus, 
1.25.3	Quod nec Cecropiae damnent Pandionis arces 
1.25.4	Nec sileant nostri praetereantque senes. 
1.25.5	Ante fores stantem dubitas admittere Famam 
1.25.6	Teque piget curae praemia ferre tuae? 
1.25.7	Post te victurae per te quoque vivere chartae 
1.25.8	Incipiant: cineri gloria sera venit. 
1.26.1	Sextiliane, bibis quantum subsellia quinque 
1.26.2	Solus: aqua totiens ebrius esse potes; 
1.26.3	Nec consessorum vicina nomismata tantum, 
1.26.4	Aera sed a cuneis ulteriora petis. 
1.26.5	Non haec Paelignis agitur vindemia prelis 
1.26.6	Uva nec in Tuscis nascitur ista iugis, 
1.26.7	Testa sed antiqui felix siccatur Opimi, 
1.26.8	Egerit et nigros Massica cella cados. 
1.26.9	A copone tibi faex Laletana petatur, 
1.26.10	Si plus quam decies, Sextiliane, bibis. 
1.27.1	Hesterna tibi nocte dixeramus, 
1.27.2	Quincunces puto post decem peractos, 
1.27.3	Cenares hodie, Procille, mecum. 
1.27.4	Tu factam tibi rem statim putasti 
1.27.5	Et non sobria verba subnotasti 
1.27.6	Exemplo nimium periculoso: 
1.27.7	Μισῶ μνάμονα συμπόταν , Procille. 
1.28.1	Hesterno fetere mero qui credit Acerram, 
1.28.2	Fallitur: in lucem semper Acerra bibit. 
1.29.1	Fama refert nostros te, Fidentine, libellos 
1.29.2	Non aliter populo quam recitare tuos. 
1.29.3	Si mea vis dici, gratis tibi carmina mittam: 
1.29.4	Si dici tua vis, hoc eme, ne mea sint. 
1.30.1	Chirurgus fuerat, nunc est vispillo Diaulus. 
1.30.2	Coepit quo poterat clinicus esse modo. 
1.31.1	Hos tibi, Phoebe, vovet totos a vertice crines 
1.31.2	Encolpos, domini centurionis amor, 
1.31.3	Grata Pudens meriti tulerit cum praemia pili. 
1.31.4	Quam primum longas, Phoebe, recide comas, 
1.31.5	Dum nulla teneri sordent lanugine voltus 
1.31.6	Dumque decent fusae lactea colla iubae; 
1.31.7	Utque tuis longum dominusque puerque fruantur 
1.31.8	Muneribus, tonsum fac cito, sero virum. 
1.32.1	Non amo te, Sabidi, nec possum dicere quare: 
1.32.2	Hoc tantum possum dicere, non amo te. 
1.33.1	Amissum non flet cum sola est Gellia patrem, 
1.33.2	Si quis adest, iussae prosiliunt lacrimae. 
1.33.3	Non luget quisquis laudari, Gellia, quaerit, 
1.33.4	Ille dolet vere, qui sine teste dolet. 
1.34.1	Incustoditis et apertis, Lesbia, semper 
1.34.2	Liminibus peccas nec tua furta tegis, 
1.34.3	Et plus spectator quam te delectat adulter 
1.34.4	Nec sunt grata tibi gaudia si qua latent. 
1.34.5	At meretrix abigit testem veloque seraque 
1.34.6	Raraque Submemmi fornice rima patet. 
1.34.7	A Chione saltem vel ab Iade disce pudorem: 
1.34.8	Abscondunt spurcas et monumenta lupas. 
1.34.9	Numquid dura tibi nimium censura videtur? 
1.34.10	Deprendi veto te, Lesbia, non futui. 
1.35.1	Versus scribere me parum severos 
1.35.2	Nec quos praelegat in schola magister, 
1.35.3	Corneli, quereris: sed hi libelli, 
1.35.4	Tamquam coniugibus suis mariti, 
1.35.5	Non possunt sine mentula placere. 
1.35.6	Quid si me iubeas talassionem 
1.35.7	Verbis dicere non talassionis? 
1.35.8	Quis Floralia vestit et stolatum 
1.35.9	Permittit meretricibus pudorem? 
1.35.10	Lex haec carminibus data est iocosis, 
1.35.11	Ne possint, nisi pruriant, iuvare. 
1.35.12	Quare deposita severitate 
1.35.13	Parcas lusibus et iocis rogamus, 
1.35.14	Nec castrare velis meos libellos. 
1.35.15	Gallo turpius est nihil Priapo. 
1.36.1	Si, Lucane, tibi vel si tibi, Tulle, darentur 
1.36.2	Qualia Ledaei fata Lacones habent, 
1.36.3	Nobilis haec esset pietatis rixa duobus, 
1.36.4	Quod pro fratre mori vellet uterque prior, 
1.36.5	Diceret infernas et qui prior isset ad umbras: 
1.36.6	'Vive tuo, frater, tempore, vive meo.' 
1.37.1	Ventris onus misero, nec te pudet, excipis auro, 
1.37.2	Basse, bibis vitro: carius ergo cacas. 
1.38.1	Quem recitas meus est, o Fidentine, libellus: 
1.38.2	Sed male cum recitas, incipit esse tuus. 
1.39.1	Si quis erit raros inter numerandus amicos, 
1.39.2	Quales prisca fides famaque novit anus, 
1.39.3	Si quis Cecropiae madidus Latiaeque Minervae 
1.39.4	Artibus et vera simplicitate bonus, 
1.39.5	Si quis erit recti custos, mirator honesti 
1.39.6	Et nihil arcano qui roget ore deos, 
1.39.7	Si quis erit magnae subnixus robore mentis: 
1.39.8	Dispeream, si non hic Decianus erit. 
1.40.1	Qui ducis vultus et non legis ista libenter, 
1.40.2	Omnibus invideas, livide, nemo tibi. 
1.41.1	Urbanus tibi, Caecili, videris. 
1.41.2	Non es, crede mihi. Quid ergo? verna, 
1.41.3	Hoc quod transtiberinus ambulator, 
1.41.4	Qui pallentia sulphurata fractis 
1.41.5	Permutat vitreis, quod otiosae 
1.41.6	Vendit qui madidum cicer coronae, 
1.41.7	Quod custos dominusque viperarum, 
1.41.8	Quod viles pueri salariorum, 
1.41.9	Quod fumantia qui tomacla raucus 
1.41.10	Circumfert tepidis cocus popinis, 
1.41.11	Quod non optimus urbicus poeta, 
1.41.12	Quod de Gadibus improbus magister, 
1.41.13	Quod bucca est vetuli dicax cinaedi. 
1.41.14	Quare desine iam tibi videri, 
1.41.15	Quod soli tibi, Caecili, videris, 
1.41.16	Qui Gabbam salibus tuis et ipsum 
1.41.17	Posses vincere Tettium Caballum. 
1.41.18	Non cuicumque datum est habere nasum: 
1.41.19	Ludit qui stolida procacitate, 
1.41.20	Non est Tettius ille, sed caballus. 
1.42.1	Coniugis audisset fatum cum Porcia Bruti 
1.42.2	Et subtracta sibi quaereret arma dolor, 
1.42.3	'Nondum scitis' ait 'mortem non posse negari? 
1.42.4	Credideram, fatis hoc docuisse patrem.' 
1.42.5	Dixit et ardentis avido bibit ore favillas. 
1.42.6	I nunc et ferrum, turba molesta, nega. 
1.43.1	Bis tibi triceni fuimus, Mancine, vocati 
1.43.2	Et positum est nobis nil here praeter aprum, 
1.43.3	Non quae de tardis servantur vitibus uvae 
1.43.4	Dulcibus aut certant quae melimela favis, 
1.43.5	Non pira quae longa pendent religata genesta 
1.43.6	Aut imitata brevis Punica grana rosas, 
1.43.7	Rustica lactantes nec misit Sassina metas 
1.43.8	Nec de Picenis venit oliva cadis: 
1.43.9	Nudus aper, sed et hic minimus qualisque necari 
1.43.10	A non armato pumilione potest. 
1.43.11	Et nihil inde datum est; tantum spectavimus omnes: 
1.43.12	Ponere aprum nobis sic et harena solet. 
1.43.13	Ponatur tibi nullus aper post talia facta, 
1.43.14	Sed tu ponaris cui Charidemus apro. 
1.44.1	Lascivos leporum cursus lususque leonum 
1.44.2	Quod maior nobis charta minorque gerit 
1.44.3	Et bis idem facimus, nimium si, Stella, videtur 
1.44.4	Hoc tibi, bis leporem tu quoque pone mihi. 
1.45.1	Edita ne brevibus pereat mihi cura libellis, 
1.45.2	Dicatur potius Τὸν δ' ἀπαμειβόμενοσ . 
1.46.1	Cum dicis 'Propero, fac si facis,' Hedyle, languet 
1.46.2	Protinus et cessat debilitata Venus. 
1.46.3	Expectare iube: velocius ibo retentus. 
1.46.4	Hedyle, si properas, dic mihi, ne properem. 
1.47.1	Nuper erat medicus, nunc est vispillo Diaulus: 
1.47.2	Quod vispillo facit, fecerat et medicus. 
1.48.1	Rictibus his tauros non eripuere magistri, 
1.48.2	Per quos praeda fugax itque reditque lepus; 
1.48.3	Quodque magis mirum, velocior exit ab hoste 
1.48.4	Nec nihil a tanta nobilitate refert. 
1.48.5	Tutior in sola non est cum currit harena, 
1.48.6	Nec caveae tanta conditur ille fide. 
1.48.7	Si vitare canum morsus, lepus inprobe, quaeris, 
1.48.8	Ad quae confugias ora leonis habes. 
1.49.1	Vir Celtiberis non tacende gentibus 
1.49.2	Nostraeque laus Hispaniae, 
1.49.3	Videbis altam, Liciniane, Bilbilin, 
1.49.4	Equis et armis nobilem, 
1.49.5	Senemque Caium nivibus, et fractis sacrum 
1.49.6	Vadaveronem montibus, 
1.49.7	Et delicati dulce Boterdi nemus, 
1.49.8	Pomona quod felix amat. 
1.49.9	Tepidi natabis lene Congedi vadum 
1.49.10	Mollesque Nympharum lacus, 
1.49.11	Quibus remissum corpus adstringes brevi 
1.49.12	Salone, qui ferrum gelat. 
1.49.13	Praestabit illic ipsa figendas prope 
1.49.14	Voberca prandenti feras. 
1.49.15	Aestus serenos aureo franges Tago 
1.49.16	Obscurus umbris arborum; 
1.49.17	Avidam rigens Derceita placabit sitim 
1.49.18	Et Nutha, quae vincit nives. 
1.49.19	At cum December canus et bruma impotens 
1.49.20	Aquilone rauco mugiet, 
1.49.21	Aprica repetes Tarraconis litora 
1.49.22	Tuamque Laletaniam. 
1.49.23	Ibi inligatas mollibus dammas plagis 
1.49.24	Mactabis et vernas apros 
1.49.25	Leporemque forti callidum rumpes equo, 
1.49.26	Cervos relinques vilico. 
1.49.27	Vicina in ipsum silva descendet focum 
1.49.28	Infante cinctum sordido. 
1.49.29	Vocabitur venator et veniet tibi 
1.49.30	Conviva clamatus prope. 
1.49.31	Lunata nusquam pellis et nusquam toga 
1.49.32	Olidaeque vestes murice; 
1.49.33	Procul horridus Liburnus et querulus cliens, 
1.49.34	Imperia viduarum procul; 
1.49.35	Non rumpet altum pallidus somnum reus, 
1.49.36	Sed mane totum dormies. 
1.49.37	Mereatur alius grande et insanum sophos: 
1.49.38	Miserere tu felicium 
1.49.39	Veroque fruere non superbus gaudio, 
1.49.40	Dum Sura laudatur tuus. 
1.49.41	Non inpudenter vita quod relicum est petit, 
1.49.42	Cum fama quod satis est habet. 
1.50.1	Si tibi Mistyllos cocus, Aemiliane, vocatur, 
1.50.2	Dicatur quare non Taratalla mihi? 
1.51.1	Non facit ad saevos cervix, nisi prima, leones. 
1.51.2	Quid fugis hos dentes, ambitiose lepus? 
1.51.3	Scilicet a magnis ad te descendere tauris 
1.51.4	Et quae non cernunt frangere colla velint. 
1.51.5	Desperanda tibi est ingentis gloria fati: 
1.51.6	Non potes hoc tenuis praeda sub hoste mori. 
1.52.1	Commendo tibi, Quintiane, nostros— 
1.52.2	Nostros dicere si tamen libellos 
1.52.3	Possum, quos recitat tuus poeta—: 
1.52.4	Si de servitio gravi queruntur, 
1.52.5	Adsertor venias satisque praestes, 
1.52.6	Et, cum se dominum vocabit ille, 
1.52.7	Dicas esse meos manuque missos. 
1.52.8	Hoc si terque quaterque clamitaris, 
1.52.9	Inpones plagiario pudorem. 
1.53.1	Una est in nostris tua, Fidentine, libellis 
1.53.2	Pagina, sed certa domini signata figura, 
1.53.3	Quae tua traducit manifesto carmina furto. 
1.53.4	Sic interpositus villo contaminat uncto 
1.53.5	Urbica Lingonicus Tyrianthina bardocucullus, 
1.53.6	Sic Arretinae violant crystallina testae, 
1.53.7	Sic niger in ripis errat cum forte Caystri, 
1.53.8	Inter Ledaeos ridetur corvus olores, 
1.53.9	Sic ubi multisona fervet sacer Atthide lucus, 
1.53.10	Inproba Cecropias offendit pica querellas. 
1.53.11	Indice non opus est nostris nec iudice libris, 
1.53.12	Stat contra dicitque tibi tua pagina 'Fur es.' 
1.54.1	Si quid, Fusce, vacas adhuc amari— 
1.54.2	Nam sunt hinc tibi, sunt et hinc amici—, 
1.54.3	Unum, si superest, locum rogamus, 
1.54.4	Nec me, quod tibi sim novus, recuses: 
1.54.5	Omnes hoc veteres tui fuerunt. 
1.54.6	Tu tantum inspice qui novus paratur 
1.54.7	An possit fieri vetus sodalis. 
1.55.1	Vota tui breviter si vis cognoscere Marci, 
1.55.2	Clarum militiae, Fronto, togaeque decus, 
1.55.3	Hoc petit, esse sui nec magni ruris arator, 
1.55.4	Sordidaque in parvis otia rebus amat. 
1.55.5	Quisquam picta colit Spartani frigora saxi 
1.55.6	Et matutinum portat ineptus Have, 
1.55.7	Cui licet exuviis nemoris rurisque beato 
1.55.8	Ante focum plenas explicuisse plagas 
1.55.9	Et piscem tremula salientem ducere saeta 
1.55.10	Flavaque de rubro promere mella cado? 
1.55.11	Pinguis inaequales onerat cui vilica mensas 
1.55.12	Et sua non emptus praeparat ova cinis? 
1.55.13	Non amet hanc vitam quisquis me non amat, opto, 
1.55.14	Vivat et urbanis albus in officiis. 
1.56.1	Continuis vexata madet vindemia nimbis: 
1.56.2	Non potes, ut cupias, vendere, copo, merum. 
1.57.1	Qualem, Flacce, velim quaeris nolimve puellam? 
1.57.2	Nolo nimis facilem difficilemque nimis. 
1.57.3	Illud quod medium est atque inter utrumque probamus: 
1.57.4	Nec volo quod cruciat, nec volo quod satiat. 
1.58.1	Milia pro puero centum me mango poposcit: 
1.58.2	Risi ego, sed Phoebus protinus illa dedit. 
1.58.3	Hoc dolet et queritur de me mea mentula secum 
1.58.4	Laudaturque meam Phoebus in invidiam. 
1.58.5	Sed sestertiolum donavit mentula Phoebo 
1.58.6	Bis decies: hoc da tu mihi, pluris emam. 
1.59.1	Dat Baiana mihi quadrantes sportula centum. 
1.59.2	Inter delicias quid facit ista fames? 
1.59.3	Redde Lupi nobis tenebrosaque balnea Grylli: 
1.59.4	Tam male cum cenem, cur bene, Flacce, laver? 
1.60.1	Intres ampla licet torvi lepus ora leonis, 
1.60.2	Esse tamen vacuo se leo dente putat. 
1.60.3	Quod ruet in tergum vel quos procumbet in armos, 
1.60.4	Alta iuvencorum volnera figet ubi? 
1.60.5	Quid frustra nemorum dominum regemque fatigas? 
1.60.6	Non nisi delecta pascitur ille fera. 
1.61.1	Verona docti syllabas amat vatis, 
1.61.2	Marone felix Mantua est, 
1.61.3	Censetur Aponi Livio suo tellus 
1.61.4	Stellaque nec Flacco minus, 
1.61.5	Apollodoro plaudit imbrifer Nilus, 
1.61.6	Nasone Paeligni sonant, 
1.61.7	Duosque Senecas unicumque Lucanum 
1.61.8	Facunda loquitur Corduba, 
1.61.9	Gaudent iocosae Canio suo Gades, 
1.61.10	Emerita Deciano meo: 
1.61.11	Te, Liciniane, gloriabitur nostra 
1.61.12	Nec me tacebit Bilbilis. 
1.62.1	Casta nec antiquis cedens Laevina Sabinis 
1.62.2	Et quamvis tetrico tristior ipsa viro 
1.62.3	Dum modo Lucrino, modo se permittit Averno, 
1.62.4	Et dum Baianis saepe fovetur aquis, 
1.62.5	Incidit in flammas: iuvenemque secuta relicto 
1.62.6	Coniuge Penelope venit, abi=t Helene. 
1.63.1	Ut recitem tibi nostra rogas epigrammata. Nolo. 
1.63.2	Non audire, Celer, sed recitare cupis. 
1.64.1	Bella es, novimus, et puella, verum est, 
1.64.2	Et dives, quis enim potest negare? 
1.64.3	Sed cum te nimium, Fabulla, laudas, 
1.64.4	Nec dives neque bella nec puella es. 
1.65.1	Cum dixi ficus, rides quasi barbara verba 
1.65.2	Et dici ficos, Laetiliane, iubes. 
1.65.3	Dicemus ficus, quas scimus in arbore nasci, 
1.65.4	Dicemus ficos, Caeciliane, tuos. 
1.66.1	Erras, meorum fur avare librorum, 
1.66.2	Fieri poetam posse qui putas tanti, 
1.66.3	Scriptura quanti constet et tomus vilis: 
1.66.4	Non sex paratur aut decem sophos nummis. 
1.66.5	Secreta quaere carmina et rudes curas, 
1.66.6	Quas novit unus scrinioque signatas 
1.66.7	Custodit ipse virginis pater chartae, 
1.66.8	Quae trita duro non inhorruit mento. 
1.66.9	Mutare dominum non potest liber notus. 
1.66.10	Sed pumicata fronte si quis est nondum 
1.66.11	Nec umbilicis cultus atque membrana, 
1.66.12	Mercare: tales habeo; nec sciet quisquam. 
1.66.13	Aliena quisquis recitat et petit famam, 
1.66.14	Non emere librum, sed silentium debet. 
1.67.1	'Liber homo es nimium', dicis mihi, Ceryle, semper. 
1.67.2	In te qui dicit, Ceryle, liber homo est? 
1.68.1	Quidquid agit Rufus, nihil est nisi Naevia Rufo. 
1.68.2	Si gaudet, si flet, si tacet, hanc loquitur. 
1.68.3	Cenat, propinat, poscit, negat, innuit: una est 
1.68.4	Naevia; si non sit Naevia, mutus erit. 
1.68.5	Scriberet hesterna patri cum luce salutem, 
1.68.6	'Naevia lux' inquit 'Naevia lumen, have.' 
1.68.7	Haec legit et ridet demisso Naevia voltu. 
1.68.8	Naevia non una est: quid, vir inepte, furis? 
1.69.1	Coepit, Maxime, Pana quae solebat, 
1.69.2	Nunc ostendere Canium Tarentos. 
1.70.1	Vade salutatum pro me, liber: ire iuberis 
1.70.2	Ad Proculi nitidos, officiose, lares. 
1.70.3	Quaeris iter, dicam. Vicinum Castora canae 
1.70.4	Transibis Vestae virgineamque domum; 
1.70.5	Inde sacro veneranda petes Palatia clivo, 
1.70.6	Plurima qua summi fulget imago ducis. 
1.70.7	Nec te detineat miri radiata colossi 
1.70.8	Quae Rhodium moles vincere gaudet opus. 
1.70.9	Flecte vias hac qua madidi sunt tecta Lyaei 
1.70.10	Et Cybeles picto stat Corybante tholus. 
1.70.11	Protinus a laeva clari tibi fronte Penates 
1.70.12	Atriaque excelsae sunt adeunda domus. 
1.70.13	Hanc pete: ne metuas fastus limenque superbum: 
1.70.14	Nulla magis toto ianua poste patet, 
1.70.15	Nec propior quam Phoebus amet doctaeque sorores. 
1.70.16	Si dicet 'Quare non tamen ipse venit?', 
1.70.17	Sic licet excuses 'Quia qualiacumque leguntur 
1.70.18	Ista, salutator scribere non potuit.' 
1.71.1	Laevia sex cyathis, septem Iustina bibatur, 
1.71.2	Quinque Lycas, Lyde quattuor, Ida tribus. 
1.71.3	Omnis ab infuso numeretur amica Falerno, 
1.71.4	Et quia nulla venit, tu mihi, Somne, veni. 
1.72.1	Nostris versibus esse te poetam, 
1.72.2	Fidentine, putas cupisque credi? 
1.72.3	Sic dentata sibi videtur Aegle 
1.72.4	Emptis ossibus Indicoque cornu; 
1.72.5	Sic quae nigrior est cadente moro, 
1.72.6	Cerussata sibi placet Lycoris. 
1.72.7	Hac et tu ratione qua poeta es, 
1.72.8	Calvus cum fueris, eris comatus. 
1.73.1	Nullus in urbe fuit tota qui tangere vellet 
1.73.2	Uxorem gratis, Caeciliane, tuam, 
1.73.3	Dum licuit: sed nunc positis custodibus ingens 
1.73.4	Turba fututorum est: ingeniosus homo es. 
1.74.1	Moechus erat: poteras tamen hoc tu, Paula, negare. 
1.74.2	Ecce vir est: numquid, Paula, negare potes? 
1.75.1	Dimidium donare Lino quam credere totum 
1.75.2	Qui mavolt, mavolt perdere dimidium. 
1.76.1	O mihi curarum pretium non vile mearum, 
1.76.2	Flacce, Antenorei spes et alumne laris, 
1.76.3	Pierios differ cantusque chorosque sororum; 
1.76.4	Aes dabit ex istis nulla puella tibi. 
1.76.5	Quid petis a Phoebo? nummos habet arca Minervae; 
1.76.6	Haec sapit, haec omnes fenerat una deos. 
1.76.7	Quid possunt hederae Bacchi dare? Pallados arbor 
1.76.8	Inclinat varias pondere nigra comas. 
1.76.9	Praeter aquas Helicon et serta lyrasque dearum 
1.76.10	Nil habet et magnum, sed perinane sophos. 
1.76.11	Quid tibi cum Cirrha? quid cum Permesside nuda? 
1.76.12	Romanum propius divitiusque forum est. 
1.76.13	Illic aera sonant: at circum pulpita nostra 
1.76.14	Et steriles cathedras basia sola crepant. 
1.77.1	Pulchre valet Charinus, et tamen pallet. 
1.77.2	Parce bibit Charinus, et tamen pallet. 
1.77.3	Bene concoquit Charinus, et tamen pallet. 
1.77.4	Sole utitur Charinus, et tamen pallet. 
1.77.5	Tingit cutem Charinus, et tamen pallet. 
1.77.6	Cunnum Charinus lingit, et tamen pallet. 
1.78.1	Indignas premeret pestis cum tabida fauces 
1.78.2	Inque ipsos vultus serperet atra lues, 
1.78.3	Siccis ipse genis flentes hortatus amicos 
