4.14.8	Incertis sonat hinc et hinc fritillis 
4.14.9	Et ludit tropa nequiore talo, 
4.14.10	Nostris otia commoda Camenis, 
4.14.11	Nec torva lege fronte, sed remissa 
4.14.12	Lascivis madidos iocis libellos. 
4.14.13	Sic forsan tener ausus est Catullus 
4.14.14	Magno mittere Passerem Maroni. 
4.15.1	Mille tibi nummos hesterna luce roganti 
4.15.2	In sex aut septem, Caeciliane, dies 
4.15.3	'Non habeo' dixi: sed tu causatus amici 
4.15.4	Adventum lancem paucaque vasa rogas. 
4.15.5	Stultus es? an stultum me credis, amice? negavi 
4.15.6	Mille tibi nummos, milia quinque dabo? 
4.16.1	Privignum non esse tuae te, Galle, novercae 
4.16.2	Rumor erat, coniunx dum fuit illa patris. 
4.16.3	Non tamen hoc poterat vivo genitore probari. 
4.16.4	Iam nusquam pater est, Galle, noverca domi est. 
4.16.5	Magnus ab infernis revocetur Tullius umbris 
4.16.6	Et te defendat Regulus ipse licet, 
4.16.7	Non potes absolvi: nam quae non desinit esse 
4.16.8	Post patrem, numquam, Galle, noverca fuit. 
4.17.1	Facere in Lyciscam, Paule, me iubes versus, 
4.17.2	Quibus illa lectis rubeat et sit irata. 
4.17.3	O Paule, malus es: irrumare vis solus. 
4.18.1	Qua vicina pluit Vipsanis porta columnis 
4.18.2	Et madet adsiduo lubricus imbre lapis, 
4.18.3	In iugulum pueri, qui roscida tecta subibat, 
4.18.4	Decidit hiberno praegravis unda gelu: 
4.18.5	Cumque peregisset miseri crudelia fata, 
4.18.6	Tabuit in calido volnere mucro tener. 
4.18.7	Quid non saeva sibi voluit Fortuna licere? 
4.18.8	Aut ubi non mors est, si iugulatis aquae? 
4.19.1	Hanc tibi Sequanicae pinguem textricis alumnam, 
4.19.2	Quae Lacedaemonium barbara nomen habet, 
4.19.3	Sordida, sed gelido non aspernanda Decembri 
4.19.4	Dona, peregrinam mittimus endromida:— 
4.19.5	Seu lentum ceroma teris tepidumve trigona, 
4.19.6	Sive harpasta manu pulverulenta rapis, 
4.19.7	Plumea seu laxi partiris pondera follis, 
4.19.8	Sive levem cursu vincere quaeris Athan— 
4.19.9	Ne madidos intret penetrabile frigus in artus, 
4.19.10	Neve gravis subita te premat Iris aqua. 
4.19.11	Ridebis ventos hoc munere tectus et imbris: 
4.19.12	Nec sic in Tyria sindone tutus eris. 
4.20.1	Dicit se vetulam, cum sit Caerellia pupa: 
4.20.2	Pupam se dicit Gellia, cum sit anus. 
4.20.3	Ferre nec hanc possis, possis, Colline, nec illam: 
4.20.4	Altera ridicula est, altera putidula. 
4.21.1	Nullos esse deos, inane caelum 
4.21.2	Adfirmat Segius: probatque, quod se 
4.21.3	Factum, dum negat haec, videt beatum. 
4.22.1	Primos passa toros et adhuc placanda marito 
4.22.2	Merserat in nitidos se Cleopatra lacus, 
4.22.3	Dum fugit amplexus. Sed prodidit unda latentem; 
4.22.4	Lucebat, totis cum tegeretur aquis: 
4.22.5	Condita sic puro numerantur lilia vitro, 
4.22.6	Sic prohibet tenuis gemma latere rosas. 
4.22.7	Insilui mersusque vadis luctantia carpsi 
4.22.8	Basia: perspicuae plus vetuistis aquae. 
4.23.1	Dum tu lenta nimis diuque quaeris, 
4.23.2	Quis primus tibi quisve sit secundus 
4.23.3	Graium quos epigramma conparavit: 
4.23.4	Palmam Callimachus, Thalia, de se 
4.23.5	Facundo dedit ipse Bruttiano. 
4.23.6	Qui si Cecropio satur lepore 
4.23.7	Romanae sale luserit Minervae, 
4.23.8	Illi me facias, precor, secundum. 
4.24.1	Omnes quas habuit, Fabiane, Lycoris amicas 
4.24.2	Extulit: uxori fiat amica meae. 
4.25.1	Aemula Baianis Altini litora villis 
4.25.2	Et Phaethontei conscia silva rogi, 
4.25.3	Quaeque Antenoreo Dryadum pulcherrima Fauno 
4.25.4	Nupsit ad Euganeos Sola puella lacus, 
4.25.5	Et tu Ledaeo felix Aquileia Timavo, 
4.25.6	Hic ubi septenas Cyllarus hausit aquas: 
4.25.7	Vos eritis nostrae requies portusque senectae, 
4.25.8	Si iuris fuerint otia nostra sui. 
4.26.1	Quod te mane domi toto non vidimus anno, 
4.26.2	Vis dicam, quantum, Postume, perdiderim? 
4.26.3	Tricenos, puto, bis, vicenos ter, puto, nummos. 
4.26.4	Ignosces: togulam, Postume, pluris emo. 
4.27.1	Saepe meos laudare soles, Auguste, libellos. 
4.27.2	Invidus ecce negat: num minus ergo soles? 
4.27.3	Quid, quod honorato non sola voce dedisti, 
4.27.4	Non alius poterat quae dare dona mihi? 
4.27.5	Ecce iterum nigros conrodit lividus ungues. 
4.27.6	Da, Caesar, tanto tu magis, ut doleat. 
4.28.1	Donasti tenero, Chloe, Luperco 
4.28.2	Hispanas Tyriasque coccinasque, 
4.28.3	Et lotam tepido togam Galaeso, 
4.28.4	Indos sardonychas, Scythas zmaragdos, 
4.28.5	Et centum dominos novae monetae: 
4.28.6	Et quidquid petit usque et usque donas. 
4.28.7	Vae glabraria, vae tibi misella: 
4.28.8	Nudam te statuet tuus Lupercus. 
4.29.1	Obstat, care Pudens, nostris sua turba libellis 
4.29.2	Lectoremque frequens lassat et implet opus. 
4.29.3	Rara iuvant: primis sic maior gratia pomis, 
4.29.4	Hibernae pretium sic meruere rosae; 
4.29.5	Sic spoliatricem commendat fastus amicam, 
4.29.6	Ianua nec iuvenem semper aperta tenet. 
4.29.7	Saepius in libro numeratur Persius uno, 
4.29.8	Quam levis in tota Marsus Amazonide. 
4.29.9	Tu quoque de nostris releges quemcumque libellis, 
4.29.10	Esse puta solum: sic tibi pluris erit. 
4.30.1	Baiano procul a lacu, monemus, 
4.30.2	Piscator, fuge, ne nocens recedas. 
4.30.3	Sacris piscibus hae natantur undae, 
4.30.4	Qui norunt dominum manumque lambunt 
4.30.5	Illam, qua nihil est in orbe maius. 
4.30.6	Quid, quod nomen habent et ad magistri 
4.30.7	Vocem quisque sui venit citatus? 
4.30.8	Hoc quondam Libys impius profundo, 
4.30.9	Dum praedam calamo tremente ducit, 
4.30.10	Raptis luminibus repente caecus 
4.30.11	Captum non potuit videre piscem, 
4.30.12	Et nunc sacrilegos perosus hamos 
4.30.13	Baianos sedet ad lacus rogator. 
4.30.14	At tu, dum potes, innocens recede 
4.30.15	Iactis simplicibus cibis in undas, 
4.30.16	Et pisces venerare delicatos. 
4.31.1	Quod cupis in nostris dicique legique libellis 
4.31.2	Et nonnullus honos creditur iste tibi, 
4.31.3	Ne valeam, si non res est gratissima nobis 
4.31.4	Et volo te chartis inseruisse meis. 
4.31.5	Sed tu nomen habes averso fonte sororum 
4.31.6	Inpositum, mater quod tibi dura dedit; 
4.31.7	Quod nec Melpomene, quod nec Polyhymnia possit 
4.31.8	Nec pia cum Phoebo dicere Calliope. 
4.31.9	Ergo aliquod gratum Musis tibi nomen adopta: 
4.31.10	Non semper belle dicitur 'Hippodame.' 
4.32.1	Et latet et lucet Phaethontide condita gutta, 
4.32.2	Ut videatur apis nectare clusa suo. 
4.32.3	Dignum tantorum pretium tulit illa laborum: 
4.32.4	Credibile est ipsam sic voluisse mori. 
4.33.1	Plena laboratis habeas cum scrinia libris, 
4.33.2	Emittis quare, Sosibiane, nihil? 
4.33.3	'Edent heredes' inquis 'mea carmina.' Quando? 
4.33.4	Tempus erat iam te, Sosibiane, legi. 
4.34.1	Sordida cum tibi sit, verum tamen, Attale, dicit, 
4.34.2	Quisquis te niveam dicit habere togam. 
4.35.1	Frontibus adversis molles concurrere dammas 
4.35.2	Vidimus et fati sorte iacere pari. 
4.35.3	Spectavere canes praedam, stupuitque superbus 
4.35.4	Venator, cultro nil superesse suo. 
4.35.5	Unde leves animi tanto caluere furore? 
4.35.6	Sic pugnant tauri, sic cecidere viri. 
4.36.1	Cana est barba tibi, nigra est coma: tinguere barbam 
4.36.2	Non potes—haec causa est—et potes, Ole, comam. 
4.37.1	'Centum Coranus et ducenta Mancinus, 
4.37.2	Trecenta debet Titius, hoc bis Albinus, 
4.37.3	Decies Sabinus alterumque Serranus; 
4.37.4	Ex insulis fundisque tricies soldum, 
4.37.5	Ex pecore redeunt ter ducena Parmensi': 
4.37.6	Totis diebus, Afer, hoc mihi narras 
4.37.7	Et teneo melius ista, quam meum nomen. 
4.37.8	Numeres oportet aliquid, ut pati possim: 
4.37.9	Cotidianam refice nauseam nummis: 
4.37.10	Audire gratis, Afer, ista non possum. 
4.38.1	Galla, nega: satiatur amor, nisi gaudia torquent: 
4.38.2	Sed noli nimium, Galla, negare diu. 
4.39.1	Argenti genus omne comparasti, 
4.39.2	Et solus veteres Myronos artes, 
4.39.3	Solus Praxitelus manum Scopaeque, 
4.39.4	Solus Phidiaci toreuma caeli, 
4.39.5	Solus Mentoreos habes labores. 
4.39.6	Nec desunt tibi vera Gratiana, 
4.39.7	Nec quae Callaico linuntur auro, 
4.39.8	Nec mensis anaglypta de paternis. 
4.39.9	Argentum tamen inter omne miror 
4.39.10	Quare non habeas, Charine, purum. 
4.40.1	Atria Pisonum stabant cum stemmate toto 
4.40.2	Et docti Senecae ter numeranda domus; 
4.40.3	Praetulimus tantis solum te, Postume, regnis: 
4.40.4	Pauper eras et eques, sed mihi consul eras. 
4.40.5	Tecum ter denas numeravi, Postume, brumas: 
4.40.6	Communis nobis lectus et unus erat. 
4.40.7	Iam donare potes, iam perdere, plenus honorum, 
4.40.8	Largus opum: expecto, Postume, quid facias. 
4.40.9	Nil facis, et serumst alium mihi quaerere regem.— 
4.40.10	Hoc, Fortuna, placet? 'Postumus inposuit.' 
4.41.1	Quid recitaturus circumdas vellera collo? 
4.41.2	Conveniunt nostris auribus ista magis. 
4.42.1	Si quis forte mihi possit praestare roganti, 
4.42.2	Audi, quem puerum, Flacce, rogare velim. 
4.42.3	Niliacis primum puer hic nascatur in oris: 
4.42.4	Nequitias tellus scit dare nulla magis. 
4.42.5	Sit nive candidior: namque in Mareotide fusca 
4.42.6	Pulchrior est, quanto rarior, iste color. 
4.42.7	Lumina sideribus certent mollesque flagellent 
4.42.8	Colla comae: tortas non amo, Flacce, comas. 
4.42.9	Frons brevis atque modus leviter sit naribus uncis, 
4.42.10	Paestanis rubeant aemula labra rosis. 
4.42.11	Saepe et nolentem cogat nolitque volentem, 
4.42.12	Liberior domino saepe sit ille suo; 
4.42.13	Et timeat pueros, excludat saepe puellas: 
4.42.14	Vir reliquis, uni sit puer ille mihi. 
4.42.15	'Iam scio, nec fallis: nam me quoque iudice verum est. 
4.42.16	Talis erat' dices 'noster Amazonicus.' 
4.43.1	Non dixi, Coracine, te cinaedum: 
4.43.2	Non sum tam temerarius nec audax 
4.43.3	Nec mendacia qui loquar libenter. 
4.43.4	Si dixi, Coracine, te cinaedum, 
4.43.5	Iratam mihi Pontiae lagonam, 
4.43.6	Iratum calicem mihi Metili: 
4.43.7	Iuro per Syrios tibi tumores, 
4.43.8	Iuro per Berecyntios furores. 
4.43.9	Quid dixi tamen? Hoc leve et pusillum, 
4.43.10	Quod notum est, quod et ipse non negabis, 
4.43.11	Dixi te, Coracine, cunnilingum. 
4.44.1	Hic est pampineis viridis modo Vesbius umbris, 
4.44.2	Presserat hic madidos nobilis uva lacus: 
4.44.3	Haec iuga, quam Nysae colles, plus Bacchus amavit, 
4.44.4	Hoc nuper Satyri monte dedere choros. 
4.44.5	Haec Veneris sedes, Lacedaemone gratior illi, 
4.44.6	Hic locus Herculeo numine clarus erat. 
4.44.7	Cuncta iacent flammis et tristi mersa favilla: 
4.44.8	Nec superi vellent hoc licuisse sibi. 
4.45.1	Haec tibi pro nato plena dat laetus acerra, 
4.45.2	Phoebe, Palatinus munera Parthenius, 
4.45.3	Ut qui prima novo signat quinquennia lustro, 
4.45.4	Impleat innumeras Burrus Olympiadas. 
4.45.5	Fac rata vota patris: sic te tua diligat arbor 
4.45.6	Gaudeat et certa virginitate soror, 
4.45.7	Perpetuo sic flore mices, sic denique non sint 
4.45.8	Tam longae Bromio, quam tibi, Phoebe, comae. 
4.46.1	Saturnalia divitem Sabellum 
4.46.2	Fecerunt: merito tumet Sabellus, 
4.46.3	Nec quemquam putat esse praedicatque 
4.46.4	Inter causidicos beatiorem. 
4.46.5	Hos fastus animosque dat Sabello 
4.46.6	Farris semodius fabaeque fresae, 
4.46.7	Et turis piperisque tres selibrae, 
4.46.8	Et Lucanica ventre cum Falisco, 
4.46.9	Et nigri Syra defruti lagona, 
4.46.10	Et ficus Libyca gelata testa 
4.46.11	Cum bulbis cocleisque caseoque. 
4.46.12	Piceno quoque venit a cliente 
4.46.13	Parcae cistula non capax olivae, 
4.46.14	Et crasso figuli polita caelo 
4.46.15	Septenaria synthesis Sagunti, 
4.46.16	Hispanae luteum rotae toreuma, 
4.46.17	Et lato variata mappa clavo. 
4.46.18	Saturnalia fructuosiora 
4.46.19	Annis non habuit decem Sabellus. 
4.47.1	Encaustus Phaethon tabula tibi pictus in hac est. 
4.47.2	Quid tibi vis, dipyrum qui Phaethonta facis? 
4.48.1	Percidi gaudes, percisus, Papyle, ploras. 
4.48.2	Cur, quae vis fieri, Papyle, facta doles? 
4.48.3	Paenitet obscenae pruriginis? an magis illud 
4.48.4	Fles, quod percidi, Papyle, desieris? 
4.49.1	Nescit, crede mihi, quid sint epigrammata, Flacce, 
4.49.2	Qui tantum lusus ista iocosque vocat. 
4.49.3	Ille magis ludit, qui scribit prandia saevi 
4.49.4	Tereos, aut cenam, crude Thyesta, tuam, 
4.49.5	Aut puero liquidas aptantem Daedalon alas, 
4.49.6	Pascentem Siculas aut Polyphemon ovis. 
4.49.7	A nostris procul est omnis vesica libellis, 
4.49.8	Musa nec insano syrmate nostra tumet. 
4.49.9	'Illa tamen laudant omnes, mirantur, adorant.' 
4.49.10	Confiteor: laudant illa, sed ista legunt. 
4.50.1	Quid me, Thai, senem subinde dicis? 
4.50.2	Nemo est, Thai, senex ad irrumandum. 
4.51.1	Cum tibi non essent sex milia, Caeciliane, 
4.51.2	Ingenti late vectus es hexaphoro: 
4.51.3	Postquam bis decies tribuit dea caeca sinumque 
4.51.4	Ruperunt nummi, factus es, ecce, pedes. 
4.51.5	Quid tibi pro meritis et tantis laudibus optem? 
4.51.6	Di reddant sellam, Caeciliane, tibi. 
4.52.1	Gestari iunctis nisi desinis, Hedyle, capris, 
4.52.2	Qui modo ficus eras, iam caprificus eris. 
4.53.1	Hunc, quem saepe vides intra penetralia nostrae 
4.53.2	Pallados et templi limina, Cosme, novi 
4.53.3	Cum baculo peraque senem, cui cana putrisque 
4.53.4	Stat coma et in pectus sordida barba cadit, 
4.53.5	Cerea quem nudi tegit uxor abolla grabati, 
4.53.6	Cui dat latratos obvia turba cibos, 
4.53.7	Esse putas Cynicum deceptus imagine ficta: 
4.53.8	Non est hic Cynicus, Cosme: quid ergo? Canis. 
4.54.1	O cui Tarpeias licuit contingere quercus 
4.54.2	Et meritas prima cingere fronde comas, 
4.54.3	Si sapis, utaris totis, Colline, diebus 
4.54.4	Extremumque tibi semper adesse putes. 
4.54.5	Lanificas nulli tres exorare puellas 
4.54.6	Contigit: observant quem statuere diem. 
4.54.7	Divitior Crispo, Thrasea constantior ipso 
4.54.8	Lautior et nitido sis Meliore licet: 
4.54.9	Nil adicit penso Lachesis fusosque sororum 
4.54.10	Explicat et semper de tribus una negat. 
4.55.1	Luci, gloria temporum tuorum, 
4.55.2	Qui Caium veterem Tagumque nostrum 
4.55.3	Arpis cedere non sinis disertis: 
4.55.4	Argivas generatus inter urbes 
4.55.5	Thebas carmine cantet aut Mycenas, 
4.55.6	Aut claram Rhodon aut libidinosae 
4.55.7	Ledaeas Lacedaemonos palaestras: 
4.55.8	Nos Celtis genitos et ex Hiberis 
4.55.9	Nostrae nomina duriora terrae 
4.55.10	Grato non pudeat referre versu: 
4.55.11	Saevo Bilbilin optimam metallo, 
4.55.12	Quae vincit Chalybasque Noricosque, 
4.55.13	Et ferro Plateam suo sonantem, 
4.55.14	Quam fluctu tenui, sed inquieto 
4.55.15	Armorum Salo temperator ambit, 
4.55.16	Tutelamque chorosque Rixamarum, 
4.55.17	Et convivia festa Carduarum, 
4.55.18	Et textis Peterin rosis rubentem, 
4.55.19	Atque antiqua patrum theatra Rigas, 
4.55.20	Et certos iaculo levi Silaos, 
4.55.21	Turgontique lacus Turasiaeque, 
4.55.22	Et parvae vada pura Tvetonissae, 
4.55.23	Et sanctum Buradonis ilicetum, 
4.55.24	Per quod vel piger ambulat viator, 
4.55.25	Et quae fortibus excolit iuvencis 
4.55.26	Curvae Manlius arva Vativescae. 
4.55.27	Haec tam rustica, delicate lector, 
4.55.28	Rides nomina? rideas licebit, 
4.55.29	Haec tam rustica malo, quam Butuntos. 
4.56.1	Munera quod senibus viduisque ingentia mittis, 
4.56.2	Vis te munificum, Gargiliane, vocem? 
4.56.3	Sordidius nihil est, nihil est te spurcius uno, 
4.56.4	Qui potes insidias dona vocare tuas: 
4.56.5	Sic avidis fallax indulget piscibus hamus, 
4.56.6	Callida sic stultas decipit esca feras. 
4.56.7	Quid sit largiri, quid sit donare, docebo, 
4.56.8	Si nescis: dona, Gargiliane, mihi. 
4.57.1	Dum nos blanda tenent lascivi stagna Lucrini 
4.57.2	Et quae pumiceis fontibus antra calent, 
4.57.3	Tu colis Argei regnum, Faustine, coloni, 
4.57.4	Quo te bis decimus ducit ab urbe lapis. 
4.57.5	Horrida sed fervent Nemeaei pectora monstri, 
4.57.6	Nec satis est, Baias igne calere suo. 
4.57.7	Ergo sacri fontes et litora grata valete, 
4.57.8	Nympharum pariter Nerei+dumque domus. 
4.57.9	Herculeos colles gelida vos vincite bruma, 
4.57.10	Nunc Tiburtinis cedite frigoribus. 
4.58.1	In tenebris luges amissum, Galla, maritum. 
4.58.2	Iam plorare pudet te, puto, Galla, virum. 
4.59.1	Flentibus Heliadum ramis dum vipera repit, 
4.59.2	Fluxit in obstantem sucina gutta feram: 
4.59.3	Quae dum miratur pingui se rore teneri, 
4.59.4	Concreto riguit vincta repente gelu. 
4.59.5	Ne tibi regali placeas, Cleopatra, sepulchro, 
4.59.6	Vipera si tumulo nobiliore iacet. 
4.60.1	Ardea solstitio Castranaque rura petantur 
4.60.2	Quique Cleonaeo sidere fervet ager, 
4.60.3	Cum Tiburtinas damnet Curiatius auras 
4.60.4	Inter laudatas ad Styga missus aquas. 
4.60.5	Nullo fata loco possis excludere: cum mors 
4.60.6	Venerit, in medio Tibure Sardinia est. 
4.61.1	Donasse amicum tibi ducenta, Mancine, 
4.61.2	Nuper superbo laetus ore iactasti. 
4.61.3	Quartus dies est, in schola poetarum 
4.61.4	Dum fabulamur, milibus decem dixti 
4.61.5	Emptas lacernas munus esse Pompullae, 
4.61.6	Sardonycha verum lineisque ter cinctum 
4.61.7	Duasque similes fluctibus maris gemmas 
4.61.8	Dedisse Bassam Caeliamque iurasti. 
4.61.9	Here de theatro, Pollione cantante, 
4.61.10	Cum subito abires, dum fugis, loquebaris, 
4.61.11	Hereditatis tibi trecenta venisse, 
4.61.12	Et mane centum, et post meridie centum. 
4.61.13	Quid tibi sodales fecimus mali tantum? 
4.61.14	Miserere iam, crudelis, et sile tandem. 
4.61.15	Aut, si tacere lingua non potest ista, 
4.61.16	Aliquando narra, quod velimus audire. 
4.62.1	Tibur in Herculeum migravit nigra Lycoris, 
4.62.2	Omnia dum fieri candida credit ibi. 
4.63.1	Dum petit a Baulis mater Caerellia Baias, 
4.63.2	Occidit insani crimine mersa freti. 
4.63.3	Gloria quanta perit vobis! haec monstra Neroni 
4.63.4	Nec iussae quondam praestiteratis, aquae. 
4.64.1	Iuli iugera pauca Martialis 
4.64.2	Hortis Hesperidum beatiora 
4.64.3	Longo Ianiculi iugo recumbunt: 
4.64.4	Lati collibus eminent recessus, 
4.64.5	Et planus modico tumore vertex 
4.64.6	Caelo perfruitur sereniore 
4.64.7	Et curvas nebula tegente valles 
4.64.8	Solus luce nitet peculiari; 
4.64.9	Puris leniter admoventur astris 
4.64.10	Celsae culmina delicata villae. 
4.64.11	Hinc septem dominos videre montis 
4.64.12	Et totam licet aestimare Romam, 
4.64.13	Albanos quoque Tusculosque colles 
4.64.14	Et quodcumque iacet sub urbe frigus, 
4.64.15	Fidenas veteres brevesque Rubras, 
4.64.16	Et quod virgineo cruore gaudet 
4.64.17	Annae pomiferum nemus Perennae. 
4.64.18	Illinc Flaminiae Salariaeque 
4.64.19	Gestator patet essedo tacente, 
4.64.20	Ne blando rota sit molesta somno, 
4.64.21	Quem nec rumpere nauticum celeuma 
4.64.22	Nec clamor valet helciariorum, 
4.64.23	Cum sit tam prope Mulvius sacrumque 
4.64.24	Lapsae per Tiberim volent carinae. 
4.64.25	Hoc rus, seu potius domus vocanda est, 
4.64.26	Commendat dominus: tuam putabis, 
4.64.27	Tam non invida tamque liberalis, 
4.64.28	Tam comi patet hospitalitate: 
4.64.29	Credas Alcinoi pios Penates 
4.64.30	Aut facti modo divitis Molorchi. 
4.64.31	Vos nunc omnia parva qui putatis, 
4.64.32	Centeno gelidum ligone Tibur 
4.64.33	Vel Praeneste domate pendulamque 
4.64.34	Uni dedite Setiam colono, 
4.64.35	Dum me iudice praeferantur istis 
4.64.36	Iuli iugera pauca Martialis. 
4.65.1	Oculo Philaenis semper altero plorat. 
4.65.2	Quo fiat istud quaeritis modo? lusca est. 
4.66.1	Egisti vitam semper, Line, municipalem, 
4.66.2	Qua nihil omnino vilius esse potest. 
4.66.3	Idibus et raris togula est excussa Kalendis 
4.66.4	Duxit et aestates synthesis una decem. 
4.66.5	Saltus aprum, campus leporem tibi misit inemptum, 
4.66.6	Silva gravis turdos exagitata dedit, 
4.66.7	Captus flumineo venit de gurgite piscis, 
4.66.8	Vina ruber fudit non peregrina cadus. 
4.66.9	Nec tener Argolica missus de gente minister, 
4.66.10	Sed stetit inculti rustica turba foci. 
4.66.11	Vilica vel duri conpressa est nupta coloni, 
4.66.12	Incaluit quotiens saucia vena mero. 
4.66.13	Nec nocuit tectis ignis, nec Sirius agris, 
4.66.14	Nec mersa est pelago nec fuit ulla ratis. 
4.66.15	Subposita est blando numquam tibi tessera talo, 
4.66.16	Alea sed parcae sola fuere nuces. 
4.66.17	Dic, ubi sit decies, mater quod avara reliquit. 
4.66.18	Nusquam est: fecisti rem, Line, difficilem. 
4.67.1	Praetorem pauper centum sestertia Gaurus 
4.67.2	Orabat cana notus amicitia, 
4.67.3	Dicebatque suis haec tantum deesse trecentis, 
4.67.4	Ut posset domino plaudere iustus eques. 
4.67.5	Praetor ait 'Scis me Scorpo Thalloque daturum, 
4.67.6	Atque utinam centum milia sola darem.' 
4.67.7	A pudet ingratae, pudet a male divitis arcae. 
4.67.8	Quod non das equiti, vis dare, praetor, equo? 
4.68.1	Invitas centum quadrantibus et bene cenas. 
4.68.2	Ut cenem invitor, Sexte, an ut invideam? 
4.69.1	Tu Setina quidem semper vel Massica ponis, 
4.69.2	Papyle, sed rumor tam bona vina negat: 
4.69.3	Diceris hac factus caelebs quater esse lagona. 
4.69.4	Nec puto nec credo, Papyle, nec sitio. 
4.70.1	Nihil Ammiano praeter aridam restem 
4.70.2	Moriens reliquit ultimis pater ceris. 
4.70.3	Fieri putaret posse quis, Marulline, 
4.70.4	Ut Ammianus mortuum patrem nollet? 
4.71.1	Quaero diu totam, Safroni Rufe, per urbem, 
4.71.2	Si qua puella neget: nulla puella negat. 
4.71.3	Tamquam fas non sit, tamquam sit turpe negare, 
4.71.4	Tamquam non liceat: nulla puella negat. 
4.71.5	Casta igitur nulla est? sunt castae mille: quid ergo 
4.71.6	Casta facit? non dat, non tamen illa negat. 
4.72.1	Exigis, ut donem nostros tibi, Quinte, libellos. 
4.72.2	Non habeo, sed habet bibliopola Tryphon. 
4.72.3	'Aes dabo pro nugis et emam tua carmina sanus? 
4.72.4	Non' inquis 'faciam tam fatue.' Nec ego. 
4.73.1	Cum gravis extremas Vestinus duceret horas 
4.73.2	Et iam per Stygias esset iturus aquas, 
4.73.3	Ultima volventis oravit pensa sorores, 
4.73.4	Ut traherent parva stamina pulla mora, 
4.73.5	Iam sibi defunctus caris dum vivit amicis. 
4.73.6	Moverunt tetricas tam pia vota deas. 
4.73.7	Tunc largas partitus opes a luce recessit 
4.73.8	Seque mori post hoc credidit ille senem. 
4.74.1	Aspicis, inbelles temptent quam fortia dammae 
4.74.2	Proelia? tam timidis quanta sit ira feris? 
4.74.3	In mortem parvis concurrere frontibus ardent. 
4.74.4	Vis, Caesar, dammis parcere? mitte canes. 
4.75.1	O felix animo, felix, Nigrina, marito 
4.75.2	Atque inter Latias gloria prima nurus: 
4.75.3	Te patrios miscere iuvat cum coniuge census, 
4.75.4	Gaudentem socio participique viro. 
4.75.5	Arserit Euhadne flammis iniecta mariti, 
4.75.6	Nec minor Alcestin fama sub astra ferat: 
4.75.7	Tu melius: certo meruisti pignore vitae, 
4.75.8	Ut tibi non esset morte probandus amor. 
4.76.1	Milia misisti mihi sex bis sena petenti: 
4.76.2	Ut bis sena feram, bis duodena petam. 
4.77.1	Numquam divitias deos rogavi 
4.77.2	Contentus modicis meoque laetus: 
4.77.3	Paupertas, veniam dabis, recede. 
4.77.4	Causast quae subiti novique voti? 
4.77.5	Pendentem volo Zoilum videre. 
4.78.1	Condita cum tibi sit iam sexagensima messis 
4.78.2	Et facies multo splendeat alba pilo, 
4.78.3	Discurris tota vagus urbe, nec ulla cathedra est, 
4.78.4	Cui non mane feras inrequietus Have; 
4.78.5	Et sine te nulli fas est prodire tribuno, 
4.78.6	Nec caret officio consul uterque tuo; 
4.78.7	Et sacro decies repetis Palatia clivo 
4.78.8	Sigerosque meros Partheniosque sonas. 
4.78.9	Haec faciant sane iuvenes: deformius, Afer, 
4.78.10	Omnino nihil est ardalione sene. 
4.79.1	Hospes eras nostri semper, Matho, Tiburtini. 
4.79.2	Hoc emis. Inposui: rus tibi vendo tuum. 
4.80.1	Declamas in febre, Maron: hanc esse phrenesin 
4.80.2	Si nescis, non es sanus, amice Maron. 
4.80.3	Declamas aeger, declamas hemitritaeos: 
4.80.4	Si sudare aliter non potes, est ratio. 
4.80.5	'Magna tamen res est.' Erras; cum viscera febris 
4.80.6	Exurit, res est magna tacere, Maron. 
4.81.1	Epigramma nostrum cum Fabulla legisset, 
4.81.2	Negare nullam quo queror puellarum, 
4.81.3	Semel rogata bisque terque neglexit 
4.81.4	Preces amantis. Iam, Fabulla, promitte: 
4.81.5	Negare iussi, pernegare non iussi. 
4.82.1	Hos quoque commenda Venuleio, Rufe, libellos, 
4.82.2	Inputet et nobis otia parva roga, 
4.82.3	Immemor et paulum curarum operumque suorum 
4.82.4	Non tetrica nugas exigat aure meas. 
4.82.5	Sed nec post primum legat haec summumve trientem, 
4.82.6	Sed sua cum medius proelia Bacchus amat. 
4.82.7	Si nimis est legisse duos, tibi charta plicetur 
4.82.8	Altera: divisum sic breve fiet opus. 
4.83.1	Securo nihil est te, Naevole, peius: eodem 
4.83.2	Sollicito nihil est, Naevole, te melius. 
4.83.3	Securus nullum resalutas, despicis omnes, 
4.83.4	Nec quisquam liber nec tibi natus homo est: 
4.83.5	Sollicitus donas, dominum regemque salutas, 
4.83.6	Invitas. Esto, Naevole, sollicitus. 
4.84.1	Non est in populo nec urbe tota, 
4.84.2	A se Thaida qui probet fututam, 
4.84.3	Cum multi cupiant rogentque multi. 
4.84.4	Tam casta est, rogo, Thais? Immo fellat. 
4.85.1	Nos bibimus vitro, tu murra, Pontice. Quare? 
4.85.2	Prodat perspicuus ne duo vina calix. 
4.86.1	Si vis auribus Atticis probari, 
4.86.2	Exhortor moneoque te, libelle, 
4.86.3	Ut docto placeas Apollinari. 
4.86.4	Nil exactius eruditiusque est, 
4.86.5	Sed nec candidius benigniusque: 
4.86.6	Si te pectore, si tenebit ore, 
4.86.7	Nec rhonchos metues maligniorum, 
4.86.8	Nec scombris tunicas dabis molestas. 
4.86.9	Si damnaverit, ad salariorum 
4.86.10	Curras scrinia protinus licebit, 
4.86.11	Inversa pueris arande charta. 
4.87.1	Infantem secum semper tua Bassa, Fabulle, 
4.87.2	Conlocat et lusus deliciasque vocat, 
4.87.3	Et, quo mireris magis, infantaria non est. 
4.87.4	Ergo quid in causa est? Pedere Bassa solet. 
4.88.1	Nulla remisisti parvo pro munere dona, 
4.88.2	Et iam Saturni quinque fuere dies. 
4.88.3	Ergo nec argenti sex scripula Septiciani 
4.88.4	Missa nec a querulo mappa cliente fuit, 
4.88.5	Antipolitani nec quae de sanguine thynni 
4.88.6	Testa rubet, nec quae cottana parva gerit, 
4.88.7	Nec rugosarum vimen breve Picenarum, 
4.88.8	Dicere te posses ut meminisse mei? 
4.88.9	Decipies alios verbis voltuque benigno, 
4.88.10	Nam mihi iam notus dissimulator eris. 
4.89.1	Ohe, iam satis est, ohe, libelle, 
4.89.2	Iam pervenimus usque ad umbilicos. 
4.89.3	Tu procedere adhuc et ire quaeris, 
4.89.4	Nec summa potes in schida teneri, 
4.89.5	Sic tamquam tibi res peracta non sit, 
