7.50.3	Cum tua tot niveis ornetur ripa ministris 
7.50.4	Et Ganymedeo luceat unda choro: 
7.50.5	Quid facit Alcides silva sacratus in ista? 
7.50.6	Tam vicina tibi cur tenet antra deus? 
7.50.7	Numquid Nympharum notos observat amores, 
7.50.8	Tam multi pariter ne rapiantur Hylae? 
7.51.1	Mercari nostras si te piget, Urbice, nugas 
7.51.2	Et lasciva tamen carmina nosse libet, 
7.51.3	Pompeium quaeres—et nosti forsitan—Auctum; 
7.51.4	Ultoris prima Martis in aede sedet: 
7.51.5	Iure madens varioque togae limatus in usu, 
7.51.6	Non lector meus hic, Urbice, sed liber est. 
7.51.7	Sic tenet absentes nostros cantatque libellos, 
7.51.8	Ut pereat chartis littera nulla meis: 
7.51.9	Denique, si vellet, poterat scripsisse videri; 
7.51.10	Sed famae mavult ille favere meae. 
7.51.11	Hunc licet a decuma—neque enim satis ante vacabit— 
7.51.12	Sollicites; capiet cenula parva duos; 
7.51.13	Ille leget, bibe tu; nolis licet, ille sonabit; 
7.51.14	Et cum 'Iam satis est' dixeris, ille leget. 
7.52.1	Gratum est, quod Celeri nostros legis, Aucte, libellos, 
7.52.2	Si tamen et Celerem, quod legis, Aucte, iuvat. 
7.52.3	Ille meas gentes et Celtas rexit Hiberos, 
7.52.4	Nec fuit in nostro certior orbe fides. 
7.52.5	Maior me tanto reverentia turbat, et aures 
7.52.6	Non auditoris, iudicis esse puto. 
7.53.1	Omnia misisti mihi Saturnalibus, Umber, 
7.53.2	Munera, contulerant quae tibi quinque dies: 
7.53.3	Bis senos triplices et dentiscalpia septem; 
7.53.4	His comes accessit spongia, mappa, calix, 
7.53.5	Semodiusque fabae cum vimine Picenarum, 
7.53.6	Et Laletanae nigra lagona sapae; 
7.53.7	Parvaque cum canis venerunt cottana prunis 
7.53.8	Et Libycae fici pondere testa gravis. 
7.53.9	Vix puto triginta nummorum tota fuisse 
7.53.10	Munera, quae grandes octo tulere Syri. 
7.53.11	Quanto commodius nullo mihi ferre labore 
7.53.12	Argenti potuit pondera quinque puer! 
7.54.1	Semper mane mihi de me mera somnia narras, 
7.54.2	Quae moveant animum sollicitentque meum. 
7.54.3	Iam prior ad faecem, sed et haec vindemia venit, 
7.54.4	Exorat noctes dum mihi saga tuas; 
7.54.5	Consumpsi salsasque molas et turis acervos; 
7.54.6	Decrevere greges, dum cadit agna frequens; 
7.54.7	Non porcus, non chortis aves, non ova supersunt. 
7.54.8	Aut vigila aut dormi, Nasidiane, tibi. 
7.55.1	Nulli munera, Chreste, si remittis, 
7.55.2	Nec nobis dederis remiserisque: 
7.55.3	Credam te satis esse liberalem. 
7.55.4	Sed si reddis Apicio Lupoque 
7.55.5	Et Gallo Titioque Caesioque, 
7.55.6	Linges non mihi—nam proba et pusilla est—, 
7.55.7	Sed quae de Solymis venit perustis 
7.55.8	Damnatam modo mentulam tributis. 
7.56.1	Astra polumque pia cepisti mente, Rabiri, 
7.56.2	Parrhasiam mira qui struis arte domum. 
7.56.3	Phidiaco si digna Iovi dare templa parabit, 
7.56.4	Has petet a nostro Pisa Tonante manus. 
7.57.1	Castora de Polluce Gabinia fecit Achillan: 
7.57.2	Πὺξ ἀγαθὸσ fuerat, nunc erit ἱππόδαμος. 
7.58.1	Iam sex aut septem nupsisti, Galla, cinaedis, 
7.58.2	Dum coma te nimium pexaque barba iuvat. 
7.58.3	Deinde experta latus madidoque simillima loro 
7.58.4	Inguina nec lassa stare coacta manu, 
7.58.5	Deseris inbelles thalamos mollemque maritum; 
7.58.6	Rursus et in similes decidis usque toros. 
7.58.7	Quaere aliquem Curios semper Fabiosque loquentem, 
7.58.8	Hirsutum et dura rusticitate trucem: 
7.58.9	Invenies: sed habet tristis quoque turba cinaedos. 
7.58.10	Difficile est vero nubere, Galla, viro. 
7.59.1	Non cenat sine apro noster, Tite, Caecilianus. 
7.59.2	Bellum convivam Caecilianus habet. 
7.60.1	Tarpeiae venerande rector aulae, 
7.60.2	Quem salvo duce credimus Tonantem, 
7.60.3	Cum votis sibi quisque te fatiget 
7.60.4	Et poscat dare, quae dei potestis: 
7.60.5	Nil pro me mihi, Iuppiter, petenti 
7.60.6	Ne suscensueris velut superbo. 
7.60.7	Te pro Caesare debeo rogare: 
7.60.8	Pro me debeo Caesarem rogare. 
7.61.1	Abstulerat totam temerarius institor urbem, 
7.61.2	Inque suo nullum limine limen erat. 
7.61.3	Iussisti tenuis, Germanice, crescere vicos, 
7.61.4	Et modo quae fuerat semita, facta via est. 
7.61.5	Nulla catenatis pila est praecincta lagonis, 
7.61.6	Nec praetor medio cogitur ire luto, 
7.61.7	Stringitur in densa nec caeca novacula turba, 
7.61.8	Occupat aut totas nigra popina vias. 
7.61.9	Tonsor, copo, cocus, lanius sua limina servant. 
7.61.10	Nunc Roma est, nuper magna taberna fuit. 
7.62.1	Reclusis foribus grandes percidis, Amille, 
7.62.2	Et te deprendi, cum facis ista, cupis, 
7.62.3	Ne quid liberti narrent servique paterni 
7.62.4	Et niger obliqua garrulitate cliens. 
7.62.5	Non pedicari se qui testatur, Amille, 
7.62.6	Illud saepe facit, quod sine teste facit. 
7.63.1	Perpetui numquam moritura volumina Sili 
7.63.2	Qui legis et Latia carmina digna toga, 
7.63.3	Pierios tantum vati placuisse recessus 
7.63.4	Credis et Aoniae Bacchica serta comae? 
7.63.5	Sacra coturnati non attigit ante Maronis, 
7.63.6	Implevit magni quam Ciceronis opus: 
7.63.7	Hunc miratur adhuc centum gravis hasta virorum, 
7.63.8	Hunc loquitur grato plurimus ore cliens. 
7.63.9	Postquam bis senis ingentem fascibus annum 
7.63.10	Rexerat, adserto qui sacer orbe fuit, 
7.63.11	Emeritos Musis et Phoebo tradidit annos, 
7.63.12	Proque suo celebrat nunc Helicona foro. 
7.64.1	Qui tonsor fueras tota notissimus urbe, 
7.64.2	Et post hoc dominae munere factus eques, 
7.64.3	Sicanias urbes Aetnaeaque regna petisti, 
7.64.4	Cinname, cum fugeres tristia iura fori. 
7.64.5	Qua nunc arte graves tolerabis inutilis annos? 
7.64.6	Quid facit infelix et fugitiva quies? 
7.64.7	Non rhetor, non grammaticus ludive magister, 
7.64.8	Non Cynicus, non tu Stoicus esse potes, 
7.64.9	Vendere nec vocem Siculis plausumque theatris: 
7.64.10	Quod superest, iterum, Cinname, tonsor eris. 
7.65.1	Lis te bis decumae numerantem frigora brumae 
7.65.2	Conterit una tribus, Gargiliane, foris. 
7.65.3	A miser et demens! viginti litigat annis 
7.65.4	Quisquam, cui vinci, Gargiliane, licet? 
7.66.1	Heredem Fabius Labienum ex asse reliquit: 
7.66.2	Plus meruisse tamen se Labienus ait. 
7.67.1	Pedicat pueros tribas Philaenis 
7.67.2	Et tentigine saevior mariti 
7.67.3	Undenas dolat in die puellas. 
7.67.4	Harpasto quoque subligata ludit, 
7.67.5	Et flavescit haphe, gravesque draucis 
7.67.6	Halteras facili rotat lacerto, 
7.67.7	Et putri lutulenta de palaestra 
7.67.8	Uncti verbere vapulat magistri: 
7.67.9	Nec cenat prius aut recumbit ante, 
7.67.10	Quam septem vomuit meros deunces; 
7.67.11	Ad quos fas sibi tunc putat redire, 
7.67.12	Cum coloephia sedecim comedit. 
7.67.13	Post haec omnia cum libidinatur, 
7.67.14	Non fellat—putat hoc parum virile—, 
7.67.15	Sed plane medias vorat puellas. 
7.67.16	Di mentem tibi dent tuam, Philaeni, 
7.67.17	Cunnum lingere quae putas virile. 
7.68.1	Commendare meas, Instanti Rufe, Camenas 
7.68.2	Parce precor socero: seria forsan amat. 
7.68.3	Quod si lascivos admittit et ille libellos, 
7.68.4	Haec ego vel Curio Fabricioque legam. 
7.69.1	Haec est illa tibi promissa Theophila, Cani, 
7.69.2	Cuius Cecropia pectora dote madent: 
7.69.3	Hanc sibi iure petat magni senis Atticus hortus, 
7.69.4	Nec minus esse suam Stoica turba velit. 
7.69.5	Vivet opus quodcumque per has emiseris aures: 
7.69.6	Tam non femineum nec populare sapit. 
7.69.7	Non tua Pantaenis nimium se praeferat illi, 
7.69.8	Quamvis Pierio sit bene nota choro. 
7.69.9	Carmina fingentem Sappho laudabat amatrix: 
7.69.10	Castior haec, et non doctior illa fuit. 
7.70.1	Ipsarum tribadum tribas, Philaeni, 
7.70.2	Recte, quam futuis, vocas amicam. 
7.71.1	Ficosa est uxor, ficosus et ipse maritus, 
7.71.2	Filia ficosa est et gener atque nepos, 
7.71.3	Nec dispensator nec vilicus ulcere turpi 
7.71.4	Nec rigidus fossor, sed nec arator eget. 
7.71.5	Cum sint ficosi pariter iuvenesque senesque, 
7.71.6	Res mira est, ficos non habet unus ager. 
7.72.1	Gratus sic tibi, Paule, sit December, 
7.72.2	Nec vani triplices brevesque mappae 
7.72.3	Nec turis veniant leves selibrae, 
7.72.4	Sed lances ferat et scyphos avorum 
7.72.5	Aut grandis reus aut potens amicus, 
7.72.6	Seu quod te potius iuvat capitque; 
7.72.7	Sic vincas Noviumque Publiumque 
7.72.8	Mandris et vitreo latrone clusos; 
7.72.9	Sic palmam tibi de trigone nudo 
7.72.10	Unctae det favor arbiter coronae, 
7.72.11	Nec laudet Polybi magis sinistras: 
7.72.12	Si quisquam mea dixerit malignus 
7.72.13	Atro carmina quae madent veneno, 
7.72.14	Ut vocem mihi commodes patronam 
7.72.15	Et quantum poteris, sed usque, clames: 
7.72.16	'Non scripsit meus ista Martialis.' 
7.73.1	Esquiliis domus est, domus est tibi colle Dianae, 
7.73.2	Et tua patricius culmina vicus habet; 
7.73.3	Hinc viduae Cybeles, illinc sacraria Vestae, 
7.73.4	Inde novum, veterem prospicis inde Iovem. 
7.73.5	Dic, ubi conveniam, dic, qua te parte requiram: 
7.73.6	Quisquis ubique habitat, Maxime, nusquam habitat. 
7.74.1	Cyllenes caelique decus, facunde minister, 
7.74.2	Aurea cui torto virga dracone viret: 
7.74.3	Sic tibi lascivi non desit copia furti, 
7.74.4	Sive cupis Paphien, seu Ganymede cales, 
7.74.5	Maternaeque sacris ornentur frondibus Idus, 
7.74.6	Et senior parca mole prematur avus: 
7.74.7	Hunc semper Norbana diem cum coniuge Carpo 
7.74.8	Laeta colat, primis quo coiere toris. 
7.74.9	Hic pius antistes sophiae sua dona ministrat, 
7.74.10	Hic te ture vocat, fidus et ipse Iovi. 
7.75.1	Vis futui gratis, cum sis deformis anusque. 
7.75.2	Res perridicula est: vis dare, nec dare vis. 
7.76.1	Quod te diripiunt potentiores 
7.76.2	Per convivia, porticus, theatra, 
7.76.3	Et tecum, quotiens ita incidisti, 
7.76.4	Gestari iuvat et iuvat lavari: 
7.76.5	Nolito nimium tibi placere. 
7.76.6	Delectas, Philomuse, non amaris. 
7.77.1	Exigis, ut nostros donem tibi, Tucca, libellos. 
7.77.2	Non faciam: nam vis vendere, non legere. 
7.78.1	Cum Saxetani ponatur coda lacerti 
7.78.2	Et, bene si cenas, conchis inuncta tibi: 
7.78.3	Sumen, aprum, leporem, boletos, ostrea, mullos 
7.78.4	Mittis: habes nec cor, Papyle, nec genium. 
7.79.1	Potavi modo consulare vinum. 
7.79.2	Quaeris, quam vetus atque liberale? 
7.79.3	Prisco consule conditum: sed ipse, 
7.79.4	Qui ponebat, erat, Severe, consul. 
7.80.1	Quatenus Odrysios iam pax Romana triones 
7.80.2	Temperat et tetricae conticuere tubae, 
7.80.3	Hunc Marcellino poteris, Faustine, libellum 
7.80.4	Mittere: iam chartis, iam vacat ille iocis. 
7.80.5	Sed si parva tui munuscula quaeris amici 
7.80.6	Commendare, ferat carmina nostra puer: 
7.80.7	Non qualis Geticae satiatus lacte iuvencae 
7.80.8	Sarmatica rigido ludit in amne rota, 
7.80.9	Sed Mitylenaei roseus mangonis ephebus, 
7.80.10	Vel non caesus adhuc matre iubente Lacon. 
7.80.11	At tibi captivo famulus mittetur ab Histro, 
7.80.12	Qui Tiburtinas pascere possit oves. 
7.81.1	'Triginta toto mala sunt epigrammata libro.' 
7.81.2	Si totidem bona sunt, Lause, bonus liber est. 
7.82.1	Menophili penem tam grandis fibula vestit, 
7.82.2	Ut sit comoedis omnibus una satis. 
7.82.3	Hunc ego credideram—nam saepe lavamur in unum— 
7.82.4	Sollicitum voci parcere, Flacce, suae: 
7.82.5	Dum ludit media populo spectante palaestra, 
7.82.6	Delapsa est misero fibula: verpus erat. 
7.83.1	Eutrapelus tonsor dum circuit ora Luperci 
7.83.2	Expingitque genas, altera barba subit. 
7.84.1	Dum mea Caecilio formatur imago Secundo 
7.84.2	Spirat et arguta picta tabella manu, 
7.84.3	I, liber, ad Geticam Peucen Histrumque iacentem: 
7.84.4	Haec loca perdomitis gentibus ille tenet. 
7.84.5	Parva dabis caro, sed dulcia dona, sodali: 
7.84.6	Certior in nostro carmine vultus erit; 
7.84.7	Casibus hic nullis, nullis delebilis annis 
7.84.8	Vivet, Apelleum cum morietur opus. 
7.85.1	Quod non insulse scribis tetrasticha quaedam, 
7.85.2	Disticha quod belle pauca, Sabelle, facis, 
7.85.3	Laudo, nec admiror. Facile est epigrammata belle 
7.85.4	Scribere, sed librum scribere difficile est. 
7.86.1	Ad natalicias dapes vocabar, 
7.86.2	Essem cum tibi, Sexte, non amicus: 
7.86.3	Quid factum est, rogo, quid repente factum est, 
7.86.4	Post tot pignora nostra, post tot annos 
7.86.5	Quod sum praeteritus vetus sodalis? 
7.86.6	Sed causam scio: nulla venit a me 
7.86.7	Hispani tibi libra pustulati 
7.86.8	Nec levis toga nec rudes lacernae. 
7.86.9	Non est sportula, quae negotiatur; 
7.86.10	Pascis munera, Sexte, non amicos. 
7.86.11	Iam dices mihi 'Vapulet vocator.' 
7.87.1	Si meus aurita gaudet lagalopece Flaccus, 
7.87.2	Si fruitur tristi Canius Aethiope; 
7.87.3	Publius exiguae si flagrat amore catellae, 
7.87.4	Si Cronius similem cercopithecon amat; 
7.87.5	Delectat Marium si perniciosus ichneumon, 
7.87.6	Pica salutatrix si tibi, Lause, placet; 
7.87.7	Si gelidum collo nectit Cadilla draconem, 
7.87.8	Luscinio tumulum si Telesilla dedit: 
7.87.9	Blanda Cupidinei cur non amet ora Labyrtae, 
7.87.10	Qui videt haec dominis monstra placere suis? 
7.88.1	Fertur habere meos, si vera est fama, libellos 
7.88.2	Inter delicias pulchra Vienna suas: 
7.88.3	Me legit omnis ibi senior iuvenisque puerque, 
7.88.4	Et coram tetrico casta puella viro. 
7.88.5	Hoc ego maluerim, quam si mea carmina cantent 
7.88.6	Qui Nilum ex ipso protinus ore bibunt; 
7.88.7	Quam meus Hispano si me Tagus impleat auro, 
7.88.8	Pascat et Hybla meas, pascat Hymettos apes. 
7.88.9	Non nihil ergo sumus, nec blandae munere linguae 
7.88.10	Decipimur: credam iam, puto, Lause, tibi. 
7.89.1	I, felix rosa, mollibusque sertis 
7.89.2	Nostri cinge comas Apollinaris. 
7.89.3	Quas tu nectere candidas, sed olim— 
7.89.4	Sic te semper amet Venus—memento. 
7.90.1	Iactat inaequalem Matho me fecisse libellum: 
7.90.2	Si verum est, laudat carmina nostra Matho. 
7.90.3	Aequales scribit libros Calvinus et Umber: 
7.90.4	Aequalis liber est, Cretice, qui malus est. 
7.91.1	De nostro, facunde, tibi, Iuvenalis, agello 
7.91.2	Saturnalicias mittimus, ecce, nuces. 
7.91.3	Cetera lascivis donavit poma puellis 
7.91.4	Mentula custodis luxuriosa dei. 
7.92.1	'Si quid opus fuerit, scis me non esse rogandum' 
7.92.2	Uno bis dicis, Baccara, terque die. 
7.92.3	Appellat rigida tristis me voce Secundus: 
7.92.4	Audis, et nescis, Baccara, quid sit opus. 
7.92.5	Pensio te coram petitur clareque palamque: 
7.92.6	Audis, et nescis, Baccara, quid sit opus. 
7.92.7	Esse queror gelidasque mihi tritasque lacernas: 
7.92.8	Audis, et nescis, Baccara, quid sit opus. 
7.92.9	Hoc opus est, subito fias ut sidere mutus, 
7.92.10	Dicere ne possis, Baccara: 'Si quid opus'. 
7.93.1	Narnia, sulphureo quam gurgite candidus amnis 
7.93.2	Circuit, ancipiti vix adeunda iugo, 
7.93.3	Quid tam saepe meum nobis abducere Quintum 
7.93.4	Te iuvat et lenta detinuisse mora? 
7.93.5	Quid Nomentani causam mihi perdis agelli, 
7.93.6	Propter vicinum qui pretiosus erat? 
7.93.7	Sed iam parce mihi nec abutere, Narnia, Quinto: 
7.93.8	Perpetuo liceat sic tibi ponte frui. 
7.94.1	Unguentum fuerat, quod onyx modo parva gerebat: 
7.94.2	Olfecit postquam Papylus, ecce, garum est. 
7.95.1	Bruma est et riget horridus December, 
7.95.2	Audes tu tamen osculo nivali 
7.95.3	Omnes obvius hinc et hinc tenere 
7.95.4	Et totam, Line, basiare Romam. 
7.95.5	Quid posses graviusque saeviusque 
7.95.6	Percussus facere atque verberatus? 
7.95.7	Hoc me frigore basiet nec uxor, 
7.95.8	Blandis filia nec rudis labellis. 
7.95.9	Sed tu dulcior elegantiorque, 
7.95.10	Cuius livida naribus caninis 
7.95.11	Dependet glacies rigetque barba, 
7.95.12	Qualem forficibus metit supinis 
7.95.13	Tonsor Cinyphio Cilix marito. 
7.95.14	Centum occurrere malo cunnilingis, 
7.95.15	Et Gallum timeo minus recentem. 
7.95.16	Quare si tibi sensus est pudorque, 
7.95.17	Hibernas, Line, basiationes, 
7.95.18	In mensem rogo differas Aprilem. 
7.96.1	Conditus hic ego sum, Bassi dolor, Urbicus infans, 
7.96.2	Cui genus et nomen maxima Roma dedit. 
7.96.3	Sex mihi de prima deerant trieteride menses, 
7.96.4	Ruperunt tetricae cum male pensa deae. 
7.96.5	Quid species, quid lingua mihi, quid profuit aetas? 
7.96.6	Da lacrimas tumulo, qui legis ista, meo: 
7.96.7	Sic ad Lethaeas, nisi Nestore serior, undas 
7.96.8	Non eat, optabis quem superesse tibi. 
7.97.1	Nosti si bene Caesium, libelle, 
7.97.2	Montanae decus Umbriae Sabinum, 
7.97.3	Auli municipem mei Pudentis, 
7.97.4	Illi tu dabis haec vel occupato: 
7.97.5	Instent mille licet premantque curae, 
7.97.6	Nostris carminibus tamen vacabit: 
7.97.7	Nam me diligit ille proximumque 
7.97.8	Turni nobilibus legit libellis. 
7.97.9	O quantum tibi nominis paratur! 
7.97.10	O quae gloria! quam frequens amator! 
7.97.11	Te convivia, te forum sonabit, 
7.97.12	Aedes, compita, porticus, tabernae. 
7.97.13	Uni mitteris, omnibus legeris. 
7.98.1	Omnia, Castor, emis: sic fiet, ut omnia vendas. 
7.99.1	Sic placidum videas semper, Crispine, Tonantem, 
7.99.2	Nec te Roma minus, quam tua Memphis amet: 
7.99.3	Carmina Parrhasia si nostra legentur in aula 
7.99.4	—Namque solent sacra Caesaris aure frui—, 
7.99.5	Dicere de nobis, ut lector candidus, aude: 
7.99.6	'Temporibus praestat non nihil iste tuis, 
7.99.7	Nec Marso nimium minor est doctoque Catullo.' 
7.99.8	Hoc satis est: ipsi cetera mando deo. 
8.pr.1	Omnes quidem libelli mei, domine, quibus tu fa-
8.pr.2	mam, id est vitam, dedisti, tibi supplicant; et, puto, 
8.pr.3	propter hoc legentur. Hic tamen, qui operis nostri octa-
8.pr.4	vus inscribitur, occasione pietatis frequentius fruitur. 
8.pr.5	Minus itaque ingenio laborandum fuit, in cuius locum 
8.pr.6	materia successerat: quam quidem subinde aliqua ioco-
8.pr.7	rum mixtura variare temptavimus, ne caelesti verecun-
8.pr.8	diae tuae laudes suas, quae facilius te fatigare possint, 
8.pr.9	quam nos satiare, omnis versus ingereret. Quamvis 
8.pr.10	autem epigrammata a severissimis quoque et summae 
8.pr.11	fortunae viris ita scripta sint, ut mimicam verborum 
8.pr.12	licentiam adfectasse videantur, ego tamen illis non per-
8.pr.13	misi tam lascive loqui quam solent. Cum pars libri et 
8.pr.14	maior et melior ad maiestatem sacri nominis tui alli-
8.pr.15	gata sit, meminerit non nisi religiosa purificatione 
8.pr.16	lustratos accedere ad templa debere. Quod ut custo-
8.pr.17	diturum me lecturi sciant, in ipso libelli huius limine 
8.pr.18	profiteri brevissimo placuit epigrammate. 
8.1.1	Laurigeros domini, liber, intrature penates 
8.1.2	Disce verecundo sanctius ore loqui. 
8.1.3	Nuda recede Venus; non est tuus iste libellus: 
8.1.4	Tu mihi, tu Pallas Caesariana, veni. 
8.2.1	Fastorum genitor parensque Ianus 
8.2.2	Victorem modo cum videret Histri, 
8.2.3	Tot vultus sibi non satis putavit 
8.2.4	Optavitque oculos habere plures: 
8.2.5	Et lingua pariter locutus omni 
8.2.6	Terrarum domino deoque rerum 
8.2.7	Promisit Pyliam quater senectam. 
8.2.8	Addas, Iane pater, tuam rogamus. 
8.3.1	'Quinque satis fuerant: nam sex septemve libelli 
8.3.2	Est nimium: quid adhuc ludere, Musa, iuvat? 
8.3.3	Sit pudor et finis: iam plus nihil addere nobis 
8.3.4	Fama potest: teritur noster ubique liber; 
8.3.5	Et cum rupta situ Messalae saxa iacebunt 
8.3.6	Altaque cum Licini marmora pulvis erunt, 
8.3.7	Me tamen ora legent et secum plurimus hospes 
8.3.8	Ad patrias sedes carmina nostra feret.' 
8.3.9	Finieram, cum sic respondit nona sororum, 
8.3.10	Cui coma et unguento sordida vestis erat: 
8.3.11	'Tune potes dulcis, ingrate, relinquere nugas? 
8.3.12	Dic mihi, quid melius desidiosus ages? 
8.3.13	An iuvat ad tragicos soccum transferre coturnos, 
8.3.14	Aspera vel paribus bella tonare modis, 
8.3.15	Praelegat ut tumidus rauca te voce magister 
8.3.16	Oderit et grandis virgo bonusque puer? 
8.3.17	Scribant ista graves nimium nimiumque severi, 
8.3.18	Quos media miseros nocte lucerna videt. 
8.3.19	At tu Romano lepidos sale tinge libellos: 
8.3.20	Agnoscat mores vita legatque suos. 
8.3.21	Angusta cantare licet videaris avena, 
8.3.22	Dum tua multorum vincat avena tubas.' 
8.4.1	Quantus, io, Latias mundi conventus ad aras 
8.4.2	Suscipit et solvit pro duce vota suo! 
8.4.3	Non sunt haec hominum, Germanice, gaudia tantum, 
8.4.4	Sed faciunt ipsi nunc, puto, sacra dei. 
8.5.1	Dum donas, Macer, anulos puellis, 
8.5.2	Desisti, Macer, anulos habere. 
8.6.1	Archetypis vetuli nihil est odiosius Eucti 
8.6.2	—Ficta Saguntino cymbia malo luto—, 
8.6.3	Argenti furiosa sui cum stemmata narrat 
8.6.4	Garrulus et verbis mucida vina facit. 
8.6.5	'Laomedonteae fuerant haec pocula mensae: 
8.6.6	Ferret ut haec, muros struxit Apollo lyra. 
8.6.7	Hoc cratere ferox commisit proelia Rhoetus 
8.6.8	Cum Lapithis: pugna debile cernis opus. 
8.6.9	Hi duo longaevo censentur Nestore fundi: 
8.6.10	Pollice de Pylio trita columba nitet. 
8.6.11	Hic scyphus est, in quo misceri iussit amicis 
8.6.12	Largius Aeacides vividiusque merum. 
8.6.13	Hac propinavit Bitiae pulcherrima Dido 
8.6.14	In patera, Phrygio cum data cena viro est.' 
8.6.15	Miratus fueris cum prisca toreumata multum, 
8.6.16	In Priami calathis Astyanacta bibes. 
8.7.1	Hoc agere est causas, hoc dicere, Cinna, diserte, 
8.7.2	Horis, Cinna, decem dicere verba novem? 
8.7.3	Sed modo clepsydras ingenti voce petisti 
8.7.4	Quattuor. O quantum, Cinna, tacere potes! 
8.8.1	Principium des, Iane, licet velocibus annis, 
8.8.2	Et renoves voltu saecula longa tuo, 
8.8.3	Te primum pia tura rogent, te vota salutent, 
8.8.4	Purpura te felix, te colat omnis honos: 
8.8.5	Tu tamen hoc mavis, Latiae quod contigit urbi 
8.8.6	Mense tuo reducem, Iane, videre deum. 
8.9.1	Solvere dodrantem nuper tibi, Quinte, volebat 
8.9.2	Lippus Hylas, luscus vult dare dimidium. 
8.9.3	Accipe quam primum; brevis est occasio lucri: 
8.9.4	Si fuerit caecus, nil tibi solvet Hylas. 
8.10.1	Emit lacernas milibus decem Bassus 
8.10.2	Tyrias coloris optimi. Lucri fecit. 
8.10.3	'Adeo bene emit?' inquis. Immo non solvet. 
8.11.1	Pervenisse tuam iam te scit Rhenus in urbem; 
8.11.2	Nam populi voces audit et ille tui: 
8.11.3	Sarmaticas etiam gentes Histrumque Getasque 
8.11.4	Laetitiae clamor terruit ipse novae. 
8.11.5	Dum te longa sacro venerantur gaudia Circo, 
8.11.6	Nemo quater missos currere sensit equos. 
8.11.7	Nullum Roma ducem, nec te sic, Caesar, amavit: 
8.11.8	Te quoque iam non plus, ut velit ipsa, potest. 
8.12.1	Uxorem quare locupletem ducere nolim, 
8.12.2	Quaeritis? Uxori nubere nolo meae. 
8.12.3	Inferior matrona suo sit, Prisce, marito: 
8.12.4	Non aliter fiunt femina virque pares. 
8.13.1	Morio dictus erat: viginti milibus emi. 
8.13.2	Redde mihi nummos, Gargiliane: sapit. 
8.14.1	Pallida ne Cilicum timeant pomaria brumam 
8.14.2	Mordeat et tenerum fortior aura nemus, 
8.14.3	Hibernis obiecta notis specularia puros 
8.14.4	Admittunt soles et sine faece diem. 
8.14.5	At mihi cella datur, non tota clusa fenestra, 
8.14.6	In qua nec Boreas ipse manere velit. 
8.14.7	Sic habitare iubes veterem crudelis amicum 
8.14.8	Arboris ergo tuae tutior hospes ero. 
8.15.1	Dum nova Pannonici numeratur gloria belli, 
8.15.2	Omnis et ad reducem dum litat ara Iovem, 
8.15.3	Dat populus, dat gratus eques, dat tura senatus, 
8.15.4	Et ditant Latias tertia dona tribus: 
8.15.5	Hos quoque secretos memoravit Roma triumphos, 
8.15.6	Nec minor ista tuae laurea pacis erat, 
8.15.7	Quod tibi de sancta credis pietate tuorum. 
8.15.8	Principis est virtus maxima, nosse suos. 
8.16.1	Pistor qui fueras diu, Cypere, 
8.16.2	Causas nunc agis et ducena quaeris: 
8.16.3	Sed consumis et usque mutuaris. 
8.16.4	A pistore, Cypere, non recedis: 
8.16.5	Et panem facis et facis farinam. 
8.17.1	Egi, Sexte, tuam, pactus duo milia, causam: 
8.17.2	Misisti nummos quod mihi mille, quid est? 
8.17.3	'Narrasti nihil' inquis 'et a te perdita causa est.' 
8.17.4	Tanto plus debes, Sexte, quod erubui. 
8.18.1	Si tua, Cerrini, promas epigrammata vulgo, 
8.18.2	Vel mecum possis vel prior ipse legi: 
8.18.3	Sed tibi tantus inest veteris respectus amici, 
8.18.4	Carior ut mea sit quam tua fama tibi. 
8.18.5	Sic Maro nec Calabri temptavit carmina Flacci, 
8.18.6	Pindaricos nosset cum superare modos, 
8.18.7	Et Vario cessit Romani laude coturni, 
8.18.8	Cum posset tragico fortius ore loqui. 
8.18.9	Aurum et opes et rura frequens donabit amicus: 
8.18.10	Qui velit ingenio cedere, rarus erit. 
8.19.1	Pauper videri Cinna vult; et est pauper. 
8.20.1	Cum facias versus nulla non luce ducenos, 
8.20.2	Vare, nihil recitas. Non sapis, atque sapis. 
8.21.1	Phosphore, redde diem: quid gaudia nostra moraris? 
8.21.2	Caesare venturo, Phosphore, redde diem. 
8.21.3	Roma rogat. Placidi numquid te pigra Bootae 
8.21.4	Plaustra vehunt, lento quod nimis axe venis? 
8.21.5	Ledaeo poteras abducere Cyllaron astro: 
8.21.6	Ipse suo cedet nunc tibi Castor equo. 
8.21.7	Quid cupidum Titana tenes? Iam Xanthus et Aethon 
8.21.8	Frena volunt, vigilat Memnonis alma parens. 
8.21.9	Tarda tamen nitidae non cedunt sidera luci, 
8.21.10	Et cupit Ausonium luna videre ducem. 
8.21.11	Iam, Caesar, vel nocte veni: stent astra licebit, 
8.21.12	Non deerit populo te veniente dies. 
8.22.1	Invitas ad aprum, ponis mihi, Gallice, porcum. 
8.22.2	Hybrida sum, si das, Gallice, verba mihi. 
8.23.1	Esse tibi videor saevus nimiumque gulosus, 
8.23.2	Qui propter cenam, Rustice, caedo cocum. 
8.23.3	Si levis ista tibi flagrorum causa videtur, 
8.23.4	Ex qua vis causa vapulet ergo cocus? 
8.24.1	Si quid forte petam timido gracilique libello, 
8.24.2	Inproba non fuerit si mea charta, dato. 
8.24.3	Et si non dederis, Caesar, permitte rogari: 
8.24.4	Offendunt numquam tura precesque Iovem. 
8.24.5	Qui fingit sacros auro vel marmore vultus, 
8.24.6	Non facit ille deos: qui rogat, ille facit. 
8.25.1	Vidisti semel, Oppiane, tantum 
8.25.2	Aegrum me, male, saepe te videbo. 
8.26.1	Non tot in Eois timuit Gangeticus arvis 
8.26.2	Raptor, in Hyrcano qui fugit albus equo, 
8.26.3	Quot tua Roma novas vidit, Germanice, tigres: 
8.26.4	Delicias potuit nec numerare suas. 
8.26.5	Vincit Erythraeos tua, Caesar, harena triumphos 
8.26.6	Et victoris opes divitiasque dei: 
8.26.7	Nam cum captivos ageret sub curribus Indos, 
8.26.8	Contentus gemina tigride Bacchus erat. 
8.27.1	Munera qui tibi dat locupleti, Gaure, senique, 
8.27.2	Si sapis et sentis, hoc tibi ait 'Morere.' 
