10.92.10	Martem mearum principem Kalendarum, 
10.92.11	Et delicatae laureum nemus Florae, 
10.92.12	In quod Priapo persequente confugit. 
10.92.13	Hoc omne agelli mite parvuli numen 
10.92.14	Seu tu cruore sive ture placabis: 
10.92.15	'Ubicumque vester Martialis est,' dices, 
10.92.16	'Hac, ecce, mecum dextera litat vobis 
10.92.17	Absens sacerdos; vos putate praesentem 
10.92.18	Et date duobus quidquid alter optabit.' 
10.93.1	Si prior Euganeas, Clemens, Helicaonis oras 
10.93.2	Pictaque pampineis videris arva iugis, 
10.93.3	Perfer Atestinae nondum vulgata Sabinae 
10.93.4	Carmina, purpurea sed modo culta toga. 
10.93.5	Ut rosa delectat, metitur quae pollice primo, 
10.93.6	Sic nova nec mento sordida charta iuvat. 
10.94.1	Non mea Massylus servat pomaria serpens, 
10.94.2	Regius Alcinoi nec mihi servit ager, 
10.94.3	Sed Nomentana securus germinat hortus 
10.94.4	Arbore, nec furem plumbea mala timent. 
10.94.5	Haec igitur media quae sunt modo nata Subura 
10.94.6	Mittimus autumni cerea poma mei. 
10.95.1	Infantem tibi vir, tibi, Galla, remisit adulter. 
10.95.2	Hi, puto, non dubie se futuisse negant. 
10.96.1	Saepe loquar nimium gentes quod, Avite, remotas, 
10.96.2	Miraris, Latia factus in urbe senex, 
10.96.3	Auriferumque Tagum sitiam patriumque Salonem 
10.96.4	Et repetam saturae sordida rura casae. 
10.96.5	Illa placet tellus, in qua res parva beatum 
10.96.6	Me facit et tenues luxuriantur opes: 
10.96.7	Pascitur hic, ibi pascit ager; tepet igne maligno 
10.96.8	Hic focus, ingenti lumine lucet ibi; 
10.96.9	Hic pretiosa fames conturbatorque macellus, 
10.96.10	Mensa ibi divitiis ruris operta sui; 
10.96.11	Quattuor hic aestate togae pluresve teruntur, 
10.96.12	Autumnis ibi me quattuor una tegit. 
10.96.13	I, cole nunc reges, quidquid non praestat amicus 
10.96.14	Cum praestare tibi possit, Avite, locus. 
10.97.1	Dum levis arsura struitur Libitina papyro, 
10.97.2	Dum murram et casias flebilis uxor emit, 
10.97.3	Iam scrobe, iam lecto, iam pollinctore parato 
10.97.4	Heredem scripsit me Numa: convaluit. 
10.98.1	Addat cum mihi Caecubum minister 
10.98.2	Idaeo resolutior cinaedo, 
10.98.3	Quo nec filia cultior nec uxor 
10.98.4	Nec mater tua nec soror recumbit, 
10.98.5	Vis spectem potius tuas lucernas 
10.98.6	Aut citrum vetus Indicosque dentes? 
10.98.7	Suspectus tibi ne tamen recumbam, 
10.98.8	Praesta de grege sordidaque villa 
10.98.9	Tonsos, horridulos, rudes, pusillos 
10.98.10	Hircosi mihi filios subulci. 
10.98.11	Perdet te dolor hic: habere, Publi, 
10.98.12	Mores non potes hos et hos ministros. 
10.99.1	Si Romana forent haec Socratis ora, fuissent 
10.99.2	Iulius in Saturis qualia Rufus habet. 
10.100.1	Quid, stulte, nostris versibus tuos misces? 
10.100.2	Cum litigante quid tibi, miser, libro? 
10.100.3	Quid congregare cum leonibus volpes 
10.100.4	Aquilisque similes facere noctuas quaeris? 
10.100.5	Habeas licebit alterum pedem Ladae, 
10.100.6	Inepte, frustra crure ligneo curres. 
10.101.1	Elysio redeat si forte remissus ab agro 
10.101.2	Ille suo felix Caesare Gabba vetus, 
10.101.3	Qui Capitolinum pariter Gabbamque iocantes 
10.101.4	Audierit, dicet: 'Rustice Gabba, tace.' 
10.102.1	Qua factus ratione sit requiris, 
10.102.2	Qui numquam futuit, pater Philinus? 
10.102.3	Gaditanus, Avite, dicat istud, 
10.102.4	Qui scribit nihil et tamen poeta est. 
10.103.1	Municipes Augusta mihi quos Bilbilis acri 
10.103.2	Monte creat, rapidis quem Salo cingit aquis, 
10.103.3	Ecquid laeta iuvat vestri vos gloria vatis? 
10.103.4	Nam decus et nomen famaque vestra sumus, 
10.103.5	Nec sua plus debet tenui Verona Catullo 
10.103.6	Meque velit dici non minus illa suum. 
10.103.7	Quattuor accessit tricesima messibus aestas, 
10.103.8	Ut sine me Cereri rustica liba datis, 
10.103.9	Moenia dum colimus dominae pulcherrima Romae: 
10.103.10	Mutavere meas Itala regna comas. 
10.103.11	Excipitis placida reducem si mente, venimus; 
10.103.12	Aspera si geritis corda, redire licet. 
10.104.1	I nostro comes, i, libelle, Flavo 
10.104.2	Longum per mare, sed faventis undae, 
10.104.3	Et cursu facili tuisque ventis 
10.104.4	Hispanae pete Tarraconis arces: 
10.104.5	Illinc te rota tollet et citatus 
10.104.6	Altam Bilbilin et tuum Salonem 
10.104.7	Quinto forsitan essedo videbis. 
10.104.8	Quid mandem tibi, quaeris? Ut sodales 
10.104.9	Paucos, sed veteres et ante brumas 
10.104.10	Triginta mihi quattuorque visos 
10.104.11	Ipsa protinus a via salutes 
10.104.12	Et nostrum admoneas subinde Flavum, 
10.104.13	Iucundos mihi nec laboriosos 
10.104.14	Secessus pretio paret salubri, 
10.104.15	Qui pigrum faciant tuum parentem. 
10.104.16	Haec sunt. Iam tumidus vocat magister 
10.104.17	Castigatque moras, et aura portum 
10.104.18	Laxavit melior: vale, libelle: 
10.104.19	Navem, scis puto, non moratur unus. 
11.1.1	Quo tu, quo, liber otiose, tendis 
11.1.2	Cultus Sidone non cotidiana? 
11.1.3	Numquid Parthenium videre? Certe: 
11.1.4	Vadas et redeas inevolutus: 
11.1.5	Libros non legit ille, sed libellos; 
11.1.6	Nec Musis vacat, aut suis vacaret. 
11.1.7	Ecquid te satis aestimas beatum, 
11.1.8	Contingunt tibi si manus minores? 
11.1.9	Vicini pete porticum Quirini: 
11.1.10	Turbam non habet otiosiorem 
11.1.11	Pompeius vel Agenoris puella, 
11.1.12	Vel primae dominus levis carinae. 
11.1.13	Sunt illic duo tresve, qui revolvant 
11.1.14	Nostrarum tineas ineptiarum, 
11.1.15	Sed cum sponsio fabulaeque lassae 
11.1.16	De Scorpo fuerint et Incitato. 
11.2.1	Triste supercilium durique severa Catonis 
11.2.2	Frons et aratoris filia Fabricii 
11.2.3	Et personati fastus et regula morum 
11.2.4	Quidquid et in tenebris non sumus, ite foras. 
11.2.5	Clamant ecce mei 'Io Saturnalia' versus: 
11.2.6	Et licet et sub te praeside, Nerva, libet. 
11.2.7	Lectores tetrici salebrosum ediscite Santram: 
11.2.8	Nil mihi vobiscum est: iste liber meus est. 
11.3.1	Non urbana mea tantum Piplei+de gaudent 
11.3.2	Otia, nec vacuis auribus ista damus, 
11.3.3	Sed meus in Geticis ad Martia signa pruinis 
11.3.4	A rigido teritur centurione liber, 
11.3.5	Dicitur et nostros cantare Britannia versus. 
11.3.6	Quid prodest? Nescit sacculus ista meus. 
11.3.7	At quam victuras poteramus pangere chartas 
11.3.8	Quantaque Pieria proelia flare tuba, 
11.3.9	Cum pia reddiderint Augustum numina terris, 
11.3.10	Et Maecenatem si tibi, Roma, darent! 
11.4.1	Sacra laresque Phrygum, quos Troiae maluit heres 
11.4.2	Quam rapere arsuras Laomedontis opes, 
11.4.3	Scriptus et aeterno nunc primum Iuppiter auro 
11.4.4	Et soror et summi filia tota patris, 
11.4.5	Et qui purpureis iam tertia nomina fastis, 
11.4.6	Iane, refers Nervae; vos precor ore pio: 
11.4.7	Hunc omnes servate ducem, servate senatum; 
11.4.8	Moribus hic vivat principis, ille suis. 
11.5.1	Tanta tibi est recti reverentia, Caesar, et aequi, 
11.5.2	Quanta Numae fuerat: sed Numa pauper erat. 
11.5.3	Ardua res haec est, opibus non tradere mores 
11.5.4	Et, cum tot Croesos viceris, esse Numam. 
11.5.5	Si redeant veteres, ingentia nomina, patres, 
11.5.6	Elysium liceat si vacuare nemus: 
11.5.7	Te colet invictus pro libertate Camillus, 
11.5.8	Aurum Fabricius, te tribuente, volet; 
11.5.9	Te duce gaudebit Brutus, tibi Sulla cruentus 
11.5.10	Imperium tradet, cum positurus erit; 
11.5.11	Et te privato cum Caesare Magnus amabit, 
11.5.12	Donabit totas et tibi Crassus opes. 
11.5.13	Ipse quoque infernis revocatus Ditis ab umbris 
11.5.14	Si Cato reddatur, Caesarianus erit. 
11.6.1	Unctis falciferi senis diebus, 
11.6.2	Regnator quibus imperat fritillus, 
11.6.3	Versu ludere non laborioso 
11.6.4	Permittis, puto, pilleata Roma. 
11.6.5	Risisti; licet ergo, non vetamur. 
11.6.6	Pallentes procul hinc abite curae; 
11.6.7	Quidquid venerit obvium, loquamur 
11.6.8	Morosa sine cogitatione. 
11.6.9	Misce dimidios, puer, trientes, 
11.6.10	Quales Pythagoras dabat Neroni, 
11.6.11	Misce, Dindyme, sed frequentiores: 
11.6.12	Possum nil ego sobrius; bibenti 
11.6.13	Succurrent mihi quindecim poetae. 
11.6.14	Da nunc basia, sed Catulliana: 
11.6.15	Quae si tot fuerint, quot ille dixit, 
11.6.16	Donabo tibi Passerem Catulli. 
11.7.1	Iam certe stupido non dices, Paula, marito, 
11.7.2	Ad moechum quotiens longius ire voles, 
11.7.3	'Caesar in Albanum iussit me mane venire, 
11.7.4	Caesar Circeios.' Iam stropha talis abi=t. 
11.7.5	Penelopae licet esse tibi sub principe Nerva: 
11.7.6	Sed prohibet scabies ingeniumque vetus. 
11.7.7	Infelix, quid ages? aegram simulabis amicam? 
11.7.8	Haerebit dominae vir comes ipse suae, 
11.7.9	Ibit et ad fratrem tecum matremque patremque. 
11.7.10	Quas igitur fraudes ingeniosa paras? 
11.7.11	Diceret hystericam se forsitan altera moecha 
11.7.12	In Sinuessano velle sedere lacu. 
11.7.13	Quanto tu melius, quotiens placet ire fututum, 
11.7.14	Quae verum mavis dicere, Paula, viro! 
11.8.1	Lassa quod hesterni spirant opobalsama dracti, 
11.8.2	Ultima quod curvo quae cadit aura croco; 
11.8.3	Poma quod hiberna maturescentia capsa, 
11.8.4	Arbore quod verna luxuriosus ager; 
11.8.5	De Palatinis dominae quod Serica prelis, 
11.8.6	Sucina virginea quod regelata manu; 
11.8.7	Amphora quod nigri, sed longe, fracta Falerni, 
11.8.8	Quod qui Sicanias detinet hortus apes; 
11.8.9	Quod Cosmi redolent alabastra focique deorum, 
11.8.10	Quod modo divitibus lapsa corona comis: 
11.8.11	Singula quid dicam? non sunt satis; omnia misce: 
11.8.12	Hoc fragrant pueri basia mane mei. 
11.8.13	Scire cupis nomen? si propter basia, dicam. 
11.8.14	Iurasti: nimium scire, Sabine, cupis. 
11.9.1	Clarus fronde Iovis, Romani fama coturni, 
11.9.2	Spirat Apellea redditus arte Memor. 
11.10.1	Contulit ad saturas ingentia pectora Turnus. 
11.10.2	Cur non ad Memoris carmina? Frater erat. 
11.11.1	Tolle, puer, calices tepidique toreumata Nili 
11.11.2	Et mihi secura pocula trade manu 
11.11.3	Trita patrum labris et tonso pura ministro; 
11.11.4	Anticus mensis restituatur honor. 
11.11.5	Te potare decet gemma, qui Mentora frangis 
11.11.6	In scaphium moechae, Sardanapalle, tuae. 
11.12.1	Ius tibi natorum vel septem, Zoile, detur, 
11.12.2	Dum matrem nemo det tibi, nemo patrem. 
11.13.1	Quisquis Flaminiam teris, viator, 
11.13.2	Noli nobile praeterire marmor. 
11.13.3	Urbis deliciae salesque Nili, 
11.13.4	Ars et gratia, lusus et voluptas, 
11.13.5	Romani decus et dolor theatri 
11.13.6	Atque omnes Veneres Cupidinesque 
11.13.7	Hoc sunt condita, quo Paris, sepulchro. 
11.14.1	Heredes, nolite brevem sepelire colonum: 
11.14.2	Nam terra est illi quantulacumque gravis. 
11.15.1	Sunt chartae mihi, quas Catonis uxor 
11.15.2	Et quas horribiles legant Sabinae: 
11.15.3	Hic totus volo rideat libellus 
11.15.4	Et sit nequior omnibus libellis. 
11.15.5	Qui vino madeat nec erubescat 
11.15.6	Pingui sordidus esse Cosmiano, 
11.15.7	Ludat cum pueris, amet puellas, 
11.15.8	Nec per circuitus loquatur illam, 
11.15.9	Ex qua nascimur, omnium parentem, 
11.15.10	Quam sanctus Numa mentulam vocabat. 
11.15.11	Versus hos tamen esse tu memento 
11.15.12	Saturnalicios, Apollinaris: 
11.15.13	Mores non habet hic meos libellus. 
11.16.1	Qui gravis es nimium, potes hinc iam, lector, abire 
11.16.2	Quo libet: urbanae scripsimus ista togae; 
11.16.3	Iam mea Lampsacio lascivit pagina versu 
11.16.4	Et Tartesiaca concrepat aera manu. 
11.16.5	O quotiens rigida pulsabis pallia vena, 
11.16.6	Sis gravior Curio Fabricioque licet! 
11.16.7	Tu quoque nequitias nostri lususque libelli 
11.16.8	Uda, puella, leges, sis Patavina licet. 
11.16.9	Erubuit posuitque meum Lucretia librum, 
11.16.10	Sed coram Bruto; Brute, recede: leget. 
11.17.1	Non omnis nostri nocturna est pagina libri: 
11.17.2	Invenies et quod mane, Sabine, legas. 
11.18.1	Donasti, Lupe, rus sub urbe nobis; 
11.18.2	Sed rus est mihi maius in fenestra. 
11.18.3	Rus hoc dicere, rus potes vocare? 
11.18.4	In quo ruta facit nemus Dianae, 
11.18.5	Argutae tegit ala quod cicadae, 
11.18.6	Quod formica die comedit uno, 
11.18.7	Clusae cui folium rosae corona est; 
11.18.8	In quo non magis invenitur herba, 
11.18.9	Quam Cosmi folium piperve crudum; 
11.18.10	In quo nec cucumis iacere rectus 
11.18.11	Nec serpens habitare tota possit. 
11.18.12	Urucam male pascit hortus unam, 
11.18.13	Consumpto moritur culex salicto, 
11.18.14	Et talpa est mihi fossor atque arator. 
11.18.15	Non boletus hiare, non mariscae 
11.18.16	Ridere aut violae patere possunt. 
11.18.17	Finis mus populatur et colono 
11.18.18	Tamquam sus Calydonius timetur, 
11.18.19	Et sublata volantis ungue Procnes 
11.18.20	In nido seges est hirundinino; 
11.18.21	Et cum stet sine falce mentulaque, 
11.18.22	Non est dimidio locus Priapo. 
11.18.23	Vix implet cocleam peracta messis, 
11.18.24	Et mustum nuce condimus picata. 
11.18.25	Errasti, Lupe, littera sed una: 
11.18.26	Nam quo tempore praedium dedisti, 
11.18.27	Mallem tu mihi prandium dedisses. 
11.19.1	Quaeris, cur nolim te ducere, Galla? Diserta es. 
11.19.2	Saepe soloecismum mentula nostra facit. 
11.20.1	Caesaris Augusti lascivos, livide, versus 
11.20.2	Sex lege, qui tristis verba latina legis: 
11.20.3	'Quod futuit Glaphyran Antonius, hanc mihi poenam 
11.20.4	Fulvia constituit, se quoque uti futuam. 
11.20.5	Fulviam ego ut futuam? quid si me Manius oret 
11.20.6	Pedicem, faciam? non puto, si sapiam. 
11.20.7	"Aut futue, aut pugnemus" ait. Quid, quod mihi vita 
11.20.8	Carior est ipsa mentula? Signa canant!' 
11.20.9	Absolvis lepidos nimirum, Auguste, libellos, 
11.20.10	Qui scis Romana simplicitate loqui. 
11.21.1	Lydia tam laxa est, equitis quam culus aheni, 
11.21.2	Quam celer arguto qui sonat aere trochus, 
11.21.3	Quam rota transmisso totiens inpacta petauro, 
11.21.4	Quam vetus a crassa calceus udus aqua, 
11.21.5	Quam quae rara vagos expectant retia turdos, 
11.21.6	Quam Pompeiano vela negata noto, 
11.21.7	Quam quae de pthisico lapsa est armilla cinaedo, 
11.21.8	Culcita Leuconico quam viduata suo, 
11.21.9	Quam veteres bracae Brittonis pauperis, et quam 
11.21.10	Turpe Ravennatis guttur onocrotali. 
11.21.11	Hanc in piscina dicor futuisse marina. 
11.21.12	Nescio; piscinam me futuisse puto. 
11.22.1	Mollia quod nivei duro teris ore Galaesi 
11.22.2	Basia, quod nudo cum Ganymede iaces, 
11.22.3	(Quis negat?) hoc nimium est. Sed sit satis; inguina saltem 
11.22.4	Parce fututrici sollicitare manu. 
11.22.5	Levibus in pueris plus haec, quam mentula, peccat, 
11.22.6	Et faciunt digiti praecipitantque virum: 
11.22.7	Inde tragus celeresque pili mirandaque matri 
11.22.8	Barba, nec in clara balnea luce placent. 
11.22.9	Divisit natura marem: pars una puellis, 
11.22.10	Una viris genita est. Utere parte tua. 
11.23.1	Nubere Sila mihi nulla non lege parata est; 
11.23.2	Sed Silam nulla ducere lege volo. 
11.23.3	Cum tamen instaret, 'deciens mihi dotis in auro 
11.23.4	Sponsa dabis' dixi; 'quid minus esse potest? 
11.23.5	Nec futuam quamvis prima te nocte maritus, 
11.23.6	Communis tecum nec mihi lectus erit; 
11.23.7	Complectarque meam, nec tu prohibebis, amicam, 
11.23.8	Ancillam mittes et mihi iussa tuam. 
11.23.9	Te spectante dabit nobis lasciva minister 
11.23.10	Basia, sive meus sive erit ille tuus. 
11.23.11	Ad cenam venies, sed sic divisa recumbes, 
11.23.12	Ut non tangantur pallia nostra tuis. 
11.23.13	Oscula rara dabis nobis et non dabis ultro, 
11.23.14	Nec quasi nupta dabis, sed quasi mater anus. 
11.23.15	Si potes ista pati, si nil perferre recusas, 
11.23.16	Invenies qui te ducere, Sila, velit.' 
11.24.1	Dum te prosequor et domum reduco, 
11.24.2	Aurem dum tibi praesto garrienti, 
11.24.3	Et quidquid loqueris facisque laudo, 
11.24.4	Quot versus poterant, Labulle, nasci! 
11.24.5	Hoc damnum tibi non videtur esse, 
11.24.6	Si quod Roma legit, requirit hospes, 
11.24.7	Non deridet eques, tenet senator, 
11.24.8	Laudat causidicus, poeta carpit, 
11.24.9	Propter te perit? hoc Labulle, verum est? 
11.24.10	Hoc quisquam ferat? ut tibi tuorum 
11.24.11	Sit maior numerus togatulorum, 
11.24.12	Librorum mihi sit minor meorum? 
11.24.13	Triginta prope iam diebus una est 
11.24.14	Nobis pagina vix peracta. Sic fit, 
11.24.15	Cum cenare domi poeta non vult. 
11.25.1	Illa salax nimium nec paucis nota puellis 
11.25.2	Stare Lino desi=t mentula. Lingua, cave. 
11.26.1	O mihi grata quies, o blanda, Telesphore, cura, 
11.26.2	Qualis in amplexu non fuit ante meo: 
11.26.3	Basia da nobis vetulo, puer, uda Falerno, 
11.26.4	Pocula da labris facta minora tuis. 
11.26.5	Addideris super haec Veneris si gaudia vera, 
11.26.6	Esse negem melius cum Ganymede Iovi. 
11.27.1	Ferreus es, si stare potest tibi mentula, Flacce, 
11.27.2	Cum te sex cyathos orat amica gari, 
11.27.3	Vel duo frusta rogat cybii tenuemve lacertum, 
11.27.4	Nec dignam toto se botryone putat; 
11.27.5	Cui portat gaudens ancilla paropside rubra 
11.27.6	Hallecem, sed quam protinus illa voret; 
11.27.7	Aut cum perfricuit frontem posuitque pudorem, 
11.27.8	Sucida palliolo vellera quinque petit. 
11.27.9	At mea me libram foliati poscat amica, 
11.27.10	Aut virides gemmas sardonychasve pares, 
11.27.11	Nec nisi prima velit de Tusco Serica vico, 
11.27.12	Aut centum aureolos sic velut aera roget. 
11.27.13	Nunc tu velle putas haec me donare puellae? 
11.27.14	Nolo, sed his ut sit digna puella volo. 
11.28.1	Invasit medici Nasica phreneticus Eucti 
11.28.2	Et percidit Hylan. Hic, puto, sanus erat. 
11.29.1	Languida cum vetula tractare virilia dextra 
11.29.2	Coepisti, iugulor pollice, Phylli, tuo: 
11.29.3	Nam cum me murem, cum me tua lumina dicis, 
11.29.4	Horis me refici vix puto posse decem. 
11.29.5	Blanditias nescis: 'dabo' dic 'tibi milia centum 
11.29.6	Et dabo Setini iugera culta soli; 
11.29.7	Accipe vina, domum, pueros, chrysendeta, mensas.' 
11.29.8	Nil opus est digitis: sic mihi, Phylli, frica. 
11.30.1	Os male causidicis et dicis olere poetis. 
11.30.2	Sed fellatori, Zoile, peius olet. 
11.31.1	Atreus Caecilius cucurbitarum 
11.31.2	Sic illas quasi filios Thyestae 
11.31.3	In partes lacerat secatque mille. 
11.31.4	Gustu protinus has edes in ipso, 
11.31.5	Has prima feret alterave cena, 
11.31.6	Has cena tibi tertia reponet, 
11.31.7	Hinc seras epidipnidas parabit. 
11.31.8	Hinc pistor fatuas facit placentas, 
11.31.9	Hinc et multiplices struit tabellas 
11.31.10	Et notas caryotidas theatris. 
11.31.11	Hinc exit varium coco minutal, 
11.31.12	Ut lentem positam fabamque credas; 
11.31.13	Boletos imitatur et botellos, 
11.31.14	Et caudam cybii brevesque maenas. 
11.31.15	Hinc cellarius experitur artes, 
11.31.16	Ut condat vario vafer sapore 
11.31.17	In rutae folium Capelliana. 
11.31.18	Sic inplet gabatas paropsidesque 
11.31.19	Et leves scutulas cavasque lances. 
11.31.20	Hoc lautum vocat, hoc putat venustum, 
11.31.21	Unum ponere ferculis tot assem. 
11.32.1	Nec toga nec focus est nec tritus cimice lectus 
11.32.2	Nec tibi de bibula sarta palude teges, 
11.32.3	Nec puer aut senior, nulla est ancilla nec infans, 
11.32.4	Nec sera nec clavis nec canis atque calix. 
11.32.5	Tu tamen adfectas, Nestor, dici atque videri 
11.32.6	Pauper, et in populo quaeris habere locum. 
11.32.7	Mentiris vanoque tibi blandiris honore. 
11.32.8	Non est paupertas, Nestor, habere nihil. 
11.33.1	Saepius ad palmam prasinus post fata Neronis 
11.33.2	Pervenit et victor praemia plura refert. 
11.33.3	I nunc, livor edax, dic te cessisse Neroni: 
11.33.4	Vicit nimirum non Nero, sed prasinus 
11.34.1	Aedes emit Aper, sed quas nec noctua vellet 
11.34.2	Esse suas: adeo nigra vetusque casa est. 
11.34.3	Vicinos illi nitidus Maro possidet hortos. 
11.34.4	Cenabit belle, non habitabit Aper. 
11.35.1	Ignotos mihi cum voces trecentos, 
11.35.2	Quare non veniam vocatus ad te, 
11.35.3	Miraris quererisque litigasque. 
11.35.4	Solus ceno, Fabulle, non libenter. 
11.36.1	Gaius hanc lucem gemma mihi Iulius alba 
11.36.2	Signat, io, votis redditus, ecce, meis: 
11.36.3	Desperasse iuvat veluti iam rupta sororum 
11.36.4	Fila; minus gaudent qui timuere nihil. 
11.36.5	Hypne, quid expectas, piger? inmortale Falernum 
11.36.6	Funde, senem poscunt talia vota cadum: 
11.36.7	Quincunces et sex cyathos besemque bibamus, 
11.36.8	Gaius ut fiat Iulius et Proculus . 
11.37.1	Zoile, quid tota gemmam praecingere libra 
11.37.2	Te iuvat et miserum perdere sardonycha? 
11.37.3	Anulus iste tuis fuerat modo cruribus aptus: 
11.37.4	Non eadem digitis pondera conveniunt. 
11.38.1	Mulio viginti veni=t modo milibus, Aule. 
11.38.2	Miraris pretium tam grave? surdus erat. 
11.39.1	Cunarum fueras motor, Charideme, mearum 
11.39.2	Et pueri custos adsiduusque comes. 
11.39.3	Iam mihi nigrescunt tonsa sudaria barba 
11.39.4	Et queritur labris puncta puella meis; 
11.39.5	Sed tibi non crevi: te noster vilicus horret, 
11.39.6	Te dispensator, te domus ipsa pavet. 
11.39.7	Ludere nec nobis, nec tu permittis amare; 
11.39.8	Nil mihi vis et vis cuncta licere tibi. 
11.39.9	Corripis, observas, quereris, suspiria ducis, 
11.39.10	Et vix a ferulis temperat ira tua. 
11.39.11	Si Tyrios sumpsi cultus unxive capillos, 
11.39.12	Exclamas 'Numquam fecerat ista pater'; 
11.39.13	Et numeras nostros adstricta fronte trientes, 
11.39.14	Tamquam de cella sit cadus ille tua. 
11.39.15	Desine; non possum libertum ferre Catonem. 
11.39.16	Esse virum iam me dicet amica tibi. 
11.40.1	Formosam Glyceran amat Lupercus 
11.40.2	Et solus tenet imperatque solus. 
11.40.3	Quam toto sibi mense non fututam 
11.40.4	Cum tristis quereretur et roganti 
11.40.5	Causam reddere vellet Aeliano, 
11.40.6	Respondit, Glycerae dolere dentes. 
11.41.1	Indulget pecori nimium dum pastor Amyntas 
11.41.2	Et gaudet fama luxuriaque gregis, 
11.41.3	Cedentes oneri ramos silvamque fluentem 
11.41.4	Vicit, concussas ipse secutus opes. 
11.41.5	Triste nemus dirae vetuit superesse rapinae 
11.41.6	Damnavitque rogis noxia ligna pater. 
11.41.7	Pingues, Lygde, sues habeat vicinus Iollas: 
11.41.8	Te satis est nobis adnumerare pecus. 
11.42.1	Vivida cum poscas epigrammata, mortua ponis 
11.42.2	Lemmata. Quid fieri, Caeciliane, potest? 
11.42.3	Mella iubes Hyblaea tibi vel Hymettia nasci, 
11.42.4	Et thyma Cecropiae Corsica ponis api! 
11.43.1	Deprensum in puero tetricis me vocibus, uxor, 
11.43.2	Corripis et culum te quoque habere refers. 
11.43.3	Dixit idem quotiens lascivo Iuno Tonanti! 
11.43.4	Ille tamen grandi cum Ganymede iacet. 
11.43.5	Incurvabat Hylan posito Tirynthius arcu: 
11.43.6	Tu Megaran credis non habuisse natis? 
11.43.7	Torquebat Phoebum Daphne fugitiva: sed illas 
11.43.8	Oebalius flammas iussit abire puer. 
11.43.9	Brisei+s multum quamvis aversa iaceret, 
11.43.10	Aeacidae propior levis amicus erat. 
11.43.11	Parce tuis igitur dare mascula nomina rebus, 
11.43.12	Teque puta cunnos, uxor, habere duos. 
11.44.1	Orbus es et locuples et Bruto consule natus: 
11.44.2	Esse tibi veras credis amicitias? 
11.44.3	Sunt verae, sed quas iuvenis, quas pauper habebas. 
11.44.4	Qui novus est, mortem diligit ille tuam. 
11.45.1	Intrasti quotiens inscriptae limina cellae, 
11.45.2	Seu puer arrisit sive puella tibi, 
11.45.3	Contentus non es foribus veloque seraque, 
11.45.4	Secretumque iubes grandius esse tibi: 
11.45.5	Oblinitur minimae si qua est suspicio rimae 
11.45.6	Punctaque lasciva quae terebrantur acu. 
11.45.7	Nemo est tam teneri tam sollicitique pudoris, 
11.45.8	Qui vel pedicat, Canthare, vel futuit. 
11.46.1	Iam nisi per somnum non arrigis et tibi, Mevi, 
11.46.2	Incipit in medios meiere verpa pedes, 
11.46.3	Truditur et digitis pannucea mentula lassis 
11.46.4	Nec levat extinctum sollicitata caput. 
11.46.5	Quid miseros frustra cunnos culosque lacessis? 
11.46.6	Summa petas: illic mentula vivit anus. 
11.47.1	Omnia femineis quare dilecta catervis 
11.47.2	Balnea devitat Lattara? Ne futuat. 
11.47.3	Cur nec Pompeia lentus spatiatur in umbra, 
11.47.4	Nec petit Inachidos limina? Ne futuat. 
11.47.5	Cur Lacedaemonio luteum ceromate corpus 
11.47.6	Perfundit gelida Virgine? Ne futuat. 
11.47.7	Cum sic feminei generis contagia vitet, 
11.47.8	Cur lingit cunnum Lattara? Ne futuat. 
11.48.1	Silius haec magni celebrat monimenta Maronis, 
11.48.2	Iugera facundi qui Ciceronis habet. 
11.48.3	Heredem dominumque sui tumulive larisve 
11.48.4	Non alium mallet nec Maro nec Cicero. 
11.49.1	Nulla est hora tibi qua non me, Phylli, furentem 
11.49.2	Despolies: tanta calliditate rapis. 
11.49.3	Nunc plorat speculo fallax ancilla relicto, 
11.49.4	Gemma vel a digito vel cadit aure lapis; 
11.49.5	Nunc furtiva lucri fieri bombycina possunt, 
11.49.6	Profertur Cosmi nunc mihi siccus onyx; 
11.49.7	Amphora nunc petitur nigri cariosa Falerni, 
11.49.8	Expiet ut somnos garrula saga tuos; 
11.49.9	Nunc ut emam grandemve lupum mullumve bilibrem, 
11.49.10	Indixit cenam dives amica tibi. 
11.49.11	Sit pudor et tandem veri respectus et aequi: 
11.49.12	Nil tibi, Phylli, nego; nil mihi, Phylli, nega. 
11.50.1	Iam prope desertos cineres et sancta Maronis 
11.50.2	Nomina qui coleret, pauper et unus erat. 
11.50.3	Silius optatae succurrere censuit umbrae, 
11.50.4	Silius et vatem, non minor ipse, colit. 
11.51.1	Tanta est quae Titio columna pendet, 
11.51.2	Quantam Lampsaciae colunt puellae. 
11.51.3	Hic nullo comitante nec molesto 
11.51.4	Thermis grandibus et suis lavatur. 
11.51.5	Anguste Titius tamen lavatur. 
11.52.1	Cenabis belle, Iuli Cerialis, apud me; 
11.52.2	Condicio est melior si tibi nulla, veni. 
11.52.3	Octavam poteris servare; lavabimur una: 
11.52.4	Scis, quam sint Stephani balnea iuncta mihi. 
11.52.5	Prima tibi dabitur ventri lactuca movendo 
11.52.6	Utilis, et porris fila resecta suis, 
11.52.7	Mox vetus et tenui maior cordyla lacerto, 
11.52.8	Sed quam cum rutae frondibus ova tegant; 
11.52.9	Altera non deerunt tenui versata favilla, 
11.52.10	Et Velabrensi massa coacta foco, 
11.52.11	Et quae Picenum senserunt frigus olivae. 
11.52.12	Haec satis in gustu. Cetera nosse cupis? 
11.52.13	Mentiar, ut venias: pisces, conchylia, sumen 
11.52.14	Et chortis saturas atque paludis aves, 
11.52.15	Quae nec Stella solet rara nisi ponere cena. 
11.52.16	Plus ego polliceor: nil recitabo tibi, 
11.52.17	Ipse tuos nobis relegas licet usque Gigantas, 
11.52.18	Rura vel aeterno proxima Vergilio. 
