1	Quis inferorum sede ab infausta extrahit
2	avido fugaces ore captantem cibos,
3	quis male deorum Tantalo visas domos
4	ostendit iterum? peius inventum est siti
5	arente in undis aliquid et peius fame 
6	hiante semper? Sisyphi numquid lapis
7	gestandus umeris lubricus nostris venit
8	aut membra celeri differens cursu rota,
9	aut poena Tityi qui specu vasto patens
10	visceribus atras pascit effossis aves 
11	et nocte reparans quicquid amisit die
12	plenum recenti pabulum monstro iacet?
13	in quod malum transcribor? o quisquis nova
14	supplicia functis durus umbrarum arbiter
15	disponis, addi si quid ad poenas potest 
16	quod ipse custos carceris diri horreat,
17	quod maestus Acheron paveat, ad cuius metum
18	nos quoque tremamus, quaere: iam nostra subit
19	e stirpe turba quae suum vincat genus
20	ac me innocentem faciat et inausa audeat. 
21	regione quicquid impia cessat loci
22	complebo— numquam stante Pelopea domo
23	Minos vacabit.
23b	Perge, detestabilis
24	umbra, et penates impios furiis age.
25	certetur omni scelere et alterna vice 
26	stringatur ensis; ne sit irarum modus
27	pudorve, mentes caecus instiget furor,
28	rabies parentum duret et longum nefas
29	eat in nepotes; nec vacet cuiquam vetus
30	odisse crimen: semper oriatur novum, 
31	nec unum in uno, dumque punitur scelus,
32	crescat, superbis fratribus regna excidant
33	repetantque profugos; dubia violentae domus
34	fortuna reges inter incertos labet:
35	miser ex potente fiat, ex misero potens 
36	fluctuque regnum casus assiduo ferat,
37	ob scelera pulsi, cum dabit patriam deus
38	in scelera redeant, sintque tam invisi omnibus,
39	quam sibi; nihil sit ira quod vetitum putet:
40	fratrem expavescat frater et gnatum parens 
41	gnatusque patrem, liberi pereant male,
42	peius tamen nascantur; immineat viro
43	infesta coniunx, bella trans pontum vehant,-
44	effusus omnis irriget terras cruor,
45	supraque magnos gentium exultet duces 
46	Libido victrix: impia stuprum in domo
47	levissimum sit facinus; et fas et fides
48	iusque omne pereat, non sit a vestris malis
49	immune caelum, cur micant stellae polo
50	flammaeque .servant debitum mundo decus? 
51	nox alia fiat, excidat caelo dies. s
52	misce penates, odia caedes funera
53	accerse et imple Tantalo totam domum.
54	ornetur altum columen et lauro fores
55	laetae virescant, dignus adventu tuo 
56	splendescat ignis— Thracium fiat nefas
57	maiore numero, dextra cur patrui vacat?
58	nondum Thyestes liberos deflet suos—
59	et quando tollet? ignibus iam subditis
60	spument aena, membra per partes eant 
61	discerpta, patruos polluat sanguis focos,
62	epulae instruantur— non novi sceleris tibi
63	conviva venies, liberum dedimus diem
64	tuamque ad istas solvimus mensas famem:
65	ieiunia exple, mixtus in Bacchum cruor 
66	spectante te potetur; inveni dapes
67	quas ipse fugeres— siste, quo praeceps ruis?
68	Ad stagna et amnes et recedentes aquas
69	labrisque ab ipsis arboris plenae fugas.
70	abire in atrum carceris liceat mei 
71	cubile, liceat, si parum videor miser,
72	mutare ripas: alveo medius tuo,
73	Phlegethon, relinquar igneo cinctus freto.
74	quicumque poenas lege fatorum datas
75	pati iuberis, quisquis exeso iaces 
76	pavidus sub antro iamque venturi times
77	montis ruinam, quisquis avidorum feros
78	rictus leonum et dira Furiarum agmina
79	implicitus horres, quisquis immissas faces
80	semiustus abigis, Tantali vocem excipe 
81	properantis ad vos: credite experto mihi,
82	amate poenas, quando continget mihi
83	effugere superos?
83b	Ante perturba domum
84	inferque tecum proelia et ferri malum
85	regibus amorem, concute insano ferum 
86	pectus tumultu,
86b	Me pati poenas decet,
87	non esse poenam, mittor ut dirus vapor
88	tellure rupta vel gravem populis luem
89	sparsum pestis, ducam in horrendum nefas
90	avus nepotes— magne divorum parens 
91	nosterque, quamvis pudeat, ingenti licet
92	taxata poena lingua crucietur loquax,
93	nec hoc tacebo: moneo, ne sacras manus
94	violate caede neve furiali malo
95	aspergite aras. stabo et arcebo scelus— 
96	quid ora ferres verbere et tortos ferox
97	minaris angues? quid famem infixam intimis
98	agitas medullis? flagrat incensum siti
99	cor et perustis flamma visceribus micat—
100	sequor.
101	Hunc, hunc furorem divide in totam domum!
102	sic, sic ferantur et suum infensi invicem
103	sitiant cruorem, sentit introitus tuos
104	domus et nefando tota contactu horruit.
105	actum est abunde, gradere ad infernos specus 
106	amnemque notum; iam tuum maestae pedem
107	terrae gravantur: cernis ut fontis liquor
108	introrsus actus linquat, ut ripae vacent
109	ventusque raras igneus nubes ferat?
110	pallescit omnis arbor ac nudus sitit 
111	fugiente pomo ramus, et qui fluctibus
112	illinc propinquis Isthmos atque illinc fremit
113	vicina gracili dividens terra vada,
114	longe remotos tutus exaudit sonos.
115	iam Lerna retro cessit et Phoronides 
116	latuere venae nec suas profert sacer
117	Alpheos undas et Cithaeronis iuga
118	stant parte nulla cana deposita nive
119	timentque veterem nobiles Argi sitim.
120	en ipse Titan dubitat an iubeat sequi 
121	cogatque habenis ire periturum diem.
122	Argos de superis si quis Achaicum
123	Pisaeasque domos curribus inclitas,
124	Isthmi si quis amat regna Corinthii
125	et portus geminos et mare dissidens, 
126	si quis Taygeti conspicuas nives,
127	quas cum Sarmaticus tempore frigido
128	in summis Boreas composuit iugis,
129	aestas veliferis solvit Etesiis,
130	quem tangit gelido flumine lucidus 
131	Alpheos, stadio notus Olympico,
132	advertat placidum numen et arceat,
133	alternae scelerum no redeant vices
134	nec succedat avo deterior nepos
135	et maior placeat culpa minoribus. 
136	tandem lassa feros exuat impetus
137	eieci progenies impia Tantali.
138	Peccatum satis est; fas valuit nihil
139	aut commune nefas, proditus occidit
140	deceptor domini Myrtilus, et fide 
141	vectus qua fuerat nobile reddidit
142	mutato pelagus nomine: notior
143	nulla est Ioniis fabula navibus.
144	exceptus gladio parvulus impio
145	dum currit patrium natus ad osculum, 
146	immatura focis victima concidit
147	divisusque tua est, Tantale, dextera,
148	mensas ut strueres hospitibus deis.
149	hos aeterna fames persequitur cibos,
150	hos aeterna sitis; nec dapibus feris 
151	decerni potuit poena decentior.
152	Stat lassus vacuo gutture Tantalus:
153	impendet capiti plurima noxio
154	Phineis avibus praeda fugacior;
155	hinc illinc gravidis frondibus incubat 
156	et curvata suis fetibus ac tremens
157	alludit patulis arbor hiatibus.
158	haec, quamvis avidus nec patiens morae,
159	deceptus totiens tangere neglegit
160	obliquatque oculos oraque comprimit 
161	inclusisque famem dentibus alligat
162	sed tunc divitias omne nemus suas
163	demittit propius pomaque desuper
164	insultant foliis mitia languidis
165	accenduntque famem, quae iubet irritas 
166	exercere manus— has ubi protulit
167	et falli libuit, totus in arduum
168	autumnus rapitur silvaque mobilis,
169	instat deinde sitis non levior fame;
170	qua cum percaluit sanguis et igneis 
171	exarsit facibus, stat miser obvios
172	fluctus ore petens, quos profugus latex
173	avertit sterili deficiens vado
174	conantem que sequi deserit; hic bibit
175	altum de rapido gurgite pulverem. 
176	Ignave, iners, enervis et (quod maximum
177	probrum tyranno rebus in summis reor)
178	inulte, post tot scelera, post fratris dolos
179	fasque omne raptum questibus vanis agis
180	iratus Atreus? fremere iam totus tuis 
181	debebat armis orbis et geminum mare
182	utrimque classes agere, iam flammis agros
183	lucere et urbes decuit ac strictum undique
184	micare ferrum, tota sub nostro sonet
185	Argolica tellus equite; non silvae tegant 
186	hostem nec altis montium structae iugis
187	arces; relictis bellicum totus canat
188	populus My cenis, quisquis invisum caput
189	tegit ac tuetur, clade funesta occidat,
190	haec ipsa pollens incliti Pelopis domus 
191	ruat vel in me, dummodo in fratrem ruat.
192	age, anime, fac quod nulla posteritas probet,
193	sed nulla taceat, aliquod audendum est nefas
194	atrox, cruentum, tale quod frater meus
195	suum esse mallet— scelera non ulciscens, 
196	nisi vineis, et quid esse tam saevum potest
197	quod superet illum? numquid abiectus iacet?
198	numquid secundis patitur in rebus modum,
199	fessis quietem? novi ego ingenium viri
200	indocile: flecti non potest— frangi potest. 
201	proinde antequam se firmat aut vires parat,
202	petatur ultro, ne quiescentem petat.
203	aut perdet aut peribit: in medio est scelus s
204	positum occupanti.
204b	Fama te populi nihil
205	adversa terret?
205b	Maximum hoc regni bonum est, 
206	quod facta domini cogitur populus sui
207	tam ferre quam laudare.
207b	Quos cogit metus
208	laudare, eosdem reddit inimicos metus,
209	at qui favoris gloriam veri petit,
210	animo magis quam. voce laudari volet. 
211	Laus vera et humili saepe contingit viro,
212	non nisi potenti falsa, quod nolunt velint.
213	Rex velit honesta: nemo non eadem volet.
214	Vbicumque tantum honesta dominanti licent,
215	precario regnatur.
215b	Vbi non est pudor 
216	nec cura iuris sanctitas pietas fides,
217	instabile regnum est.
217b	Sanctitas pietas fides
218	privata bona sunt, qua iuvat reges eant.
219	Nefas nocere vel malo fratri puta.
220	Fas est in illo quicquid in fratre est nefas. 
221	quid enim reliquit crimine intactum aut ubi
222	sceleri pepercit? coniugem stupro abstulit
223	regnumque furto: specimen antiquum imperi
224	fraude est adeptus, fraude turbavit domum,
225	est Pelopis altis nobile in stabulis pecus, 
226	arcanus aries, ductor opulenti gregis,
227	huius per omne corpus effuso coma
228	dependet auro, cuius e tergo novi
229	aurata reges sceptra Tantalici gerunt;
230	possessor huius regnat, hunc tantae domus 
231	fortuna sequitur, tuta seposita sacer
232	in parte carpit prata, quae cludit lapis
233	fatale saxeo pascuum muro tegens.
234	hunc facinus ingens ausus assumpta in scelus
235	consorte nostri perfidus thalami avehit. 
236	hinc omne cladis mutuae fluxit malum:
237	per regna trepidus exul erravi mea,
238	pars nulla generis tuta ab insidiis vacat,
239	corrupta coniunx, imperi quassa est fides,
240	domus aegra, dubius sanguis est— certi nihil 
241	nisi frater hostis, quid stupes? tandem incipe
242	animosque sume: Tantalum et Pelopem aspice;
243	ad haec manus exempla poscuntur meae.
244	profare, dirum qua caput mactem via.
245	Ferro peremptus spiritum inimicum expuat. 
246	De fine poenae .loqueris; ego poenam volo.
247	perimat tyrannus lenis: in regno meo
248	mors impetratur.
248b	Nulla te pietas movet?
249	Excede, Pietas, si modo in nostra domo
250	umquam fuisti, dira Furiarum cohors 
251	discorsque Erinys veniat et geminas faces
252	Megaera quatiens: non satis magno meum
253	ardet furore pectus, impleri iuvat
254	maiore monstro.
254b	Quid novi rabidus struis?
255	Nil quod doloris capiat assueti modus; 
256	nullum relinquam facinus et nullum est satis.
257	Ferrum?
257b	Parum est
275c	Quid ignis?
257d	Etiamnunc parum est.
258	Quonam ergo telo tantus utetur dolor?
259	Ipso Thyeste.
259b	Maius hoc ira est malum.
260	Fateor, tumultus pectora attonitus quatit 
261	penitusque volvit; rapior et quo nescio,
262	sed rapior. imo mugit e fundo solum,
263	tonat dies serenus ac totis domus
264	ut fracta tectis crepuit et. moti lares
265	vertere voltum: fiat hoc, fiat nefas 
266	quod. di. timebis,
266b	Facere quid tandem paras?
267	Nescio quid animo maius et solito amplius
268	supraque fines moris humani tumet
269	instatque pigris manibus— haud quid sit scio,
270	sed grando quiddam est. ita sit. hoc, anime, occupa. 
271	dignum est Thyeste facinus et dignum Atreo:
272	quod uterque faciat, vidit infandae domus
273	Odrysia mensas— fateor, immane est scelus,
274	sed occupatum: maius hoc aliquid dolor
275	inveniat, animum Baulis inspira parens 
276	sororque; causa est similis: assiste et manum
277	impelle nostram, liberos avidus pater
278	gaudetque Iaceret et suos artus edat.
279	bene est, abunde est. hic placet poenae modus
280	tantisper, ubinam est? tam diu cur innocens 
281	versatur Atreus? tota iam ante oculos meos
282	imago caedis errat, ingesta orbitas
283	in ora patris— anime, quid rursus times
284	et ante rem subsidis? audendum est, age:
285	quod est in isto scelere praecipuum nefas, 
286	hoc ipse faciet,
286b	Sed quibus captus dolis
287	nostros dabit perductus in laqueos pedem?
288	inimica credit cuncta,
288b	Non poterat capi,
289	nisi capere vellet, regna nune sperat mea:
290	hac spe minanti fulmen occurret Iovi, 
291	hac spe subibit gurgitis tumidi minas
292	dubiumque Libycae Syrtis intrabit fretum,
293	hac spe, quod esse maximum retur malum,
294	fratrem videbit.
294b	Quis fidem pacis dabit?
295	cui tanta credet?
295b	Credula est spes improba. 
296	gnatis tamen mandata quae patruo ferant
297	dabimus: relictis exul hospitiis vagus
298	regno ut miserias mutet atque Argos regat
299	ex parte dominus, si nimis durus preces
300	spernet Thyestes, liberos eius rudes
301	malisque fessos gravibus et faciles capi
302	prece commovebunt: hinc vetus regni furor,
303	illinc egestas tristis ac durus labor
304	quamvis rigentem tot malis subigent virum.
305	Iam tempus illi fecit aerumnas leves. 
306	Erras: malorum sensus accrescit die.
307	leve est miserias ferre, perferre est grave
308	Alios ministros consili tristis lege.
309	Peiora iuvenes facile praecepta audiunt.
310	In patre facient quicquid in patruo doces: 
311	saepe in magistrum scelera redierunt sua.
312	Vt nemo doceat fraudis et sceleris vias,
313	regnum docebit, ne mali fiant times?
314	nascuntur, istud quod vocas saevum asperum
315	agique dure credis et nimium impie, 
316	fortasse et illic agitur,
316b	Hanc fraudem scient
317	nati parari?
317b	Tacita tam rudibus fides
318	non est in annis; detegent forsan dolos:
319	tacere multis discitur vitae malis.
320	SAT,. Ipsosque per quos fallere alium cogitas 
321	falles?
321b	Vt ipsi crimine et culpa vacent,
322	quid enim necesse est liberos sceleri meos
323	inserere? per nos odia se nostra explicent.—
324	male agis, recedis, anime: si parcis tuis,
325	parces et illis, consili Agamemnon mei 
326	sciens minister fiat et fratri sciens
327	Menelaus adsit, prolis incertae fides
328	ex hoc petatur scelere: si bella abnuunt
329	et gerere nolunt odia. si patruum vocant.
330	pater est, eatur.—— multa sed trepidus solet 
331	detegere vultus, magna nolentem quoque
332	consilia produnt: nesciant quantae rei
333	fiant ministri, nostra tu coepta occides.
334	Haud sum monendus: ista nostro in pectore
335	fides timorque, sed magis claudet fides. 
336	Tandem regia nobilis,
337	antiqui genus Inachi,
338	fratrum composuit minas.
339	Quis vos exagitat furor,
340	alternis dare sanguinem 
341	et sceptrum scelere aggredi?
342	nescitis, cupidi arcium,
343	regnum qua iaceat loco.
344	regem non faciunt opes,
345	non vestis Tyriae color, 
346	non frontis nota regiae,
347	non auro nitidae trabes:
348	rex est qui posuit metus
349	et diri mala pectoris,
350	quem non ambitio inpotens 
351	et numquam stabilis favor
352	vulgi praecipitis movet,
353	non quicquid fodit Occideris
354	ant unda Tagus aurea
355	claro devenit alveo, 
356	non quicquid Libycis terit
357	fervens area messibus,
358	quem non concutiet cadens
359	obliqui via fulminis,
360	non Eurus rapiens mare 
361	aut saevo rabidus freto
362	ventosi tumor Hadriae,
363	quem non lancea militis,
364	non strictas domuit chalybs,
365	qui tuto positus loco 
366	infra se videt omnia
367	occurritque suo libens
368	fato nec queritur mori.
369	Reges conveniant licet
370	qui sparsos agitant Dabas, 
371	qui rubri vada litoris
372	et gemmis mare lucidis
373	late sanguineum tenent,
374	aut qui Caspia fortibus
375	recludunt iuga Sarmatis, 
376	certet Danuvii vadum
377	audet qui pedes ingredi
378	et (quocumque loco iacent)
379	Seres vellere nobiles: 
381	nil ullis opus est equis, 
382	nil armis et inertibus
383	telis quae procul ingerit
384	Parthus, cum simulat fugas,
385	admotis nihil est opus 
386	urbes sternere machinis,
387	longe saxa rotantibus. 
380	mens regnum bona possidet. 
388	rex est qui metuit nihil, 
389	rex est qui cupiet nihil.
390	hoc regnum sibi quisque dat. 
391	Stet quicumque volet potens
392	aulae culmine lubrico:
393	me dulcis saturet quies;
394	obscuro positus loco
395	leni perfruar otio, 
396	nullis nota Quiritibus
397	aetas per tacitum fluat.
398	sic cum transierint mei
399	nullo cum strepitu dies.
400	plebeius moriar senex. 
401	illi mors gravis incubat
402	qui, notus nimis omnibus,
403	ignotus moritur sibi.
404	Optata patriae tecta et Argolicas opes
405	miserisque summum ac maxime exulibus bonum,
406	tractum soli natalis et patrios deos
407	(si sunt tamen di) cerno, Cyclopum sacras
408	turres, labore maius humano decus,
409	celebrata iuveni stadia, per quae nobilis
410	palmam paterno non semel curru tuli. 
411	occurret Argos, populus occurret frequens—
412	sed nempe et Atreus. repete silvestres fugas
413	saltusque densos potius et mixtam feris
414	similemque vitam; clarus hic regni nitor
415	fulgore non est quod oculos falso auferat: 
416	cum quod datur spectabis, et dantem aspice.
417	modo inter illa, quae putant cuncti aspera,
418	fortis fui laetusque; nunc contra in metus
419	revolvor: animus haeret ac retro cupit
420	corpus referre, moveo nolentem gradum. 
421	Pigro (quid hoc est?) genitor incessu stupet
422	vultumque versat seque in incerto tenet.
423	Quid, anime, pendes quidve consilium diu
424	tam facile torques? rebus incertissimis,
425	fratri atque regno, credis ac metuis mala 
426	iam victa, iam mansueta et aerumnas fugis
427	bene collocatas? esse iam miserum iuvat,
428	reflecte gressum, dum licet, teque eripe.
429	T AN T. Quae causa cogit, genitor, a patria gradum
430	referre visa? cur bonis tantis sinum 
431	subducis? ira frater abiecta redit
432	partemque regni reddit et lacerae domus
433	componit artus teque restituit tibi.
434	Causam timoris ipse quam ignoro exigis.
435	nihil timendum video, sed timeo tamen. 
436	placet ire, pigris membra sed genibus labant
437	alioque quam quo nitor abductus feror,
438	sic concitatam remige et velo ratem
439	aestus resistens remigi et velo refert.
440	Evince quicquid obstat et mentem impedit 
441	reducemque quanta praemia expectent vide.
442	pater, potes regnare,
442b	Cum possim mori.
443	Summa est potestas—
443b	Nulla: si cupias nihil.
444	Gnatis relinques,
444b	Non capit regnum duos.
445	Miser esse mavult esse qui felix potest? 
446	Mihi crede, falsis magna nominibus placent,
447	frustra timentur dura. dum excelsus steti,
448	numquam pavere destiti atque ipsum mei
449	ferrum timere lateris, o quantum bonum est
450	obstare nulli, capere securas dapes 
451	humi iacentem! scelera non intrant casas,
452	totusque mensa capitur angusta cibus;
453	venenum in auro bibitur— expertus loquor:
454	malam bonae praeferre fortunam licet.
455	non vertice alti montis impositam domum 
456	et eminentem civitas humilis tremit
457	nec fulget altis splendidum tectis ebur
458	somnosque non defendit excubitor meos;
459	non classibus piscamur et retro mare
460	iacta fugamus mole nec ventrem improbum 
461	alimus tributo gentium, nullus mihi
462	ultra Getas metatur et Parthos ager;
463	non ture colimur nec meae excluso Iove
464	ornantur arae; nulla culminibus meis
465	imposita nutat silva nec fumant manu 
466	succensa multa stagna nec somno dies
467	Bacchoque nox iungenda pervigil! datur:
468	sed non timemur, tuta sine telo est domus
469	rebusque parvis magna praestatur quies—
470	immane regnum est posse sine regno pati. 
471	Nec abnuendum, si dat imperium deus,
472	nec appetendum est: frater ut regnes rogat.
473	Rogat? timendum est. errat hic aliquis dolus.
474	Redire pietas unde submota est solet
475	reparatque vires iustus amissas amor. 
476	Amat Thyesten frater? aetherias prius
477	perfundet Arctos pontus et Siculi rapax
478	consistet aestus unda et Ionio seges
479	matura pelago surget et lucem dabit
480	nox atra terris, ante cum flammis aquae. 
481	cum morte vita. cum mari ventus fidem
482	foedusque iungent.
482b	Quam tamen fraudem times?
483	Omnem: timori quem meo statuam modum?
484	tantum potest quantum odit.
484b	In te quid potest?
485	Pro me nihil iam metuo: vos facitis mihi 
486	Atrea timendum,
486b	Decipi cautus times?
487	Serum est cavendi tempus in mediis malis:
488	eatur. unum genitor hoc testor tamen:
489	ego vos sequor, non duco.
489b	Respiciet deus
490	bene cogitata, perge non dubio gradu. 
491	Plagis tenetur clausa dispositis fera:
492	et ipsum et una generis invisi indolem
493	iunctam parenti cerno, iam tuto in loco
494	vorsantur odia. venit in nostras manus
495	tandem Thyestes, venit, et totus quidem. 
496	vix tempero animo, vix dolor frenos capit
497	sic, cum feras vestigat et longo sagax
498	loro tenetur Vmber ac presso vias
499	scrutatur ore, dum procul lento suem
500	odore sentit, paret et tacito locum 
501	rostro pererrat; praeda cum propior fuit,
502	cervice tota pugnat et gemitu vocat
503	dominum morantem seque retinenti eripit:
504	cum sperat ira sanguinem, nescit tegi;
505	tamen tegatur. aspice, ut multo gravis 
506	squalore vultus obruat maestos coma,
507	quam foeda iaceat barba, praestetur fides—
508	fratrem iuvat videre, complexus mihi
509	redde expetitos. quicquid irarum fuit
510	transierit; ex hoc sanguis ac pietas die 
511	colantur, animis odia damnata excidant.
512	Diluere possem cuncta, nisi talis fores.
513	sed fateor, Atreu, fateor, admisi omnia
514	quae credidisti, pessimam causam meam
515	hodierna, pietas fecit, est prorsus nocens 
516	quicumque visus tam bono fratri est nocens.
517	lacrimis agendum est: supplicem primus vides;
518	hae te precantur pedibus intactae manus:
519	ponatur omnis ira et ex animo tumor
520	erasus abeat. obsides fidei accipe 
521	hos innocentes, frater,
521b	A genibus manum
522	aufer meosque potius amplexus pete.
523	vos quoque, senum praesidia, tot iuvenes, meo
524	pendete collo, squalidam vestem exue
525	oculisque nostris parce et ornatus cape 
526	pares meis. laetusque fraterni imperi
527	capesse partem, maior haec laus est mea,
528	fratri paternum reddere incolumi decus:
529	habere regnum casus est, virtus dare.
530	Di paria, frater, pretia pro tantis tibi 
531	meritis rependant. regiam capitis notam
532	squalor recusat noster et sceptrum manus
533	infausta refugit, liceat in media mihi
534	latere turba,
534b	Recipit hoc regnum duos.
535	Meum esse credo quicquid est, frater, tuum. 
536	Quis influentis dona fortunae abnuit?
537	Expertus est quicumque quam facile effluant.
538	Fratrem potiri gloria ingenti vetas?
539	Tua iam peracta gloria est, restat mea:
540	respuere certum est regna consilium mihi. 
541	Meam relinquam, nisi tuam partem accipis.
542	Accipio: regni nomen impositi feram,
543	sed iura et arma servient mecum tibi.
544	Imposita capiti vincla venerando gere;
545	ego destinatas victimas superis dabo. 
546	Credat hoc quisquam? ferus ille et acer
547	nec potens mentis truculentus Atreus
548	fratris aspectu stupefactus haesit,
549	nulla vis maior pietate vera est:
550	iurgia externis inimica durant, 
551	quos amor verus tenuit, tenebit
552	ira cum magnis agitata causis
553	gratiam rupit cocinitque bellum,
554	cum leves frenis sonuere turmae,
555	fulsit hinc illinc agitatus ensis 
556	quem movet crebro furibundus ictu
557	sanguinem Mavors cupiens recentem:
558	opprimit ferrum manibusque iunctis
559	ducit ad pacem Pietas negantes.
560	Otium tanto subitum e tumultu 
561	quis deus fecit? modo per Mycenas
562	arma civilis' crepuere belli:
563	pallidae natos tenuere matres;
564	uxor armato timuit marito,
565	cum manum invitus sequeretur ensis, 
566	sordidus pacis vitio quietae;
567	ille labentes renovare muros,
568	hic situ quassas stabilire turres,
569	ferreis portas cohibere claustris
570	ille certabat, pavidusque pinnis 
571	anxiae noctis vigil incubabat:
572	peior est bello timor ipse belli.
573	Iam minae saevi cecidere ferri,
574	iam silet murmur grave classicorum,
575	iam tacet stridor litui strepentis: 
576	alta pax urbi revocata, laetae est.
577	sic, ubi ex alto tumuere fluctus
578	Bruttium Coro feriente pontum,
579	Scylla pulsati s resonat cavernis
580	ac mare in portu timuere nautae 
581	quod rapax haustum revomit Charybdis,
582	et ferus Cyclops metuit parentem
583	rupe ferventis residens in Aetnae,
584	ne superfusis violator undis
585	ignis aeternis resonans caminis, 
586	et putat mergi sua posse pauper
587	regna Laertes Ithaca tremente:
588	si suae ventis cecidere vires,
589	mitius stagno pelagus recumbit;
590	alta, quae navis timuit secare, 
591	hinc et hinc fusis speciosa velis
592	strata ludenti patuere cumbae,
593	et vacat mersos numerare pisces
594	hic ubi ingenti modo sub procella
595	Cycladas pontum timuere motae. 
596	Nulla sors longa est: dolor ac voluptas
597	invicem cedunt; brevior voluptas,
598	ima permutat levis hora summis:
599	ille qui donat diadema fronti,
600	quem genu nixae tremuere gentes, 
601	cuius ad nutum posuere bella
602	Medus et Phoebi propioris Indus
603	et Dahae-Parthis equitem minati,
604	anxius sceptrum tenet et moventes
605	cuncta divinat metuitque casus 
606	mobiles rerum dubiumque tempus.
607	Vos quibus rector maris atque terrae
608	ius dedit magnum necis atque vitae,
609	ponite inflatos tumidosque vultus:
610	quicquid a vobis minor expavescit, 
611	maior hoc vobis dominus minatur;
612	omne sub regno graviore regnum est.
613	quem dies vidit veniens superbum,
614	hunc dies vidit fugiens iacentem.
615	Nemo confidat nimium secundis, 
616	nemo desperet meliora lassis:
617	miscet haec illis prohibetque Clotho
618	stare Fortunam, rotat omne fatum,
619	nemo tam divos habuit faventes,
620	crastinum ut posset sibi polliceri: 
621	res deus nostras celeri citatas
622	turbine versat.
623	Quis me per auras turbo praecipitem vehet-
624	atraque nube involvet, ut tantum nefas
625	eripiat oculis? o domus Pelopi quoque 
626	et Tantalo pudenda!
626b	Quid portas novi?
627	Quaenam ista regio est? Argos et Sparte, pios
628	sortita fratres, et maris gemini premens
