629	fauces Corinthos, an feris Hister fugam
630	praebens Alanis, an sub aeterna nive 
631	Hyrcana tellus an vagi passim Scythae?
632	quis hic nefandi est conscius monstri locus?
633	Effare et istud pande, quodcumque est, malum.
634	Si steterit animus, si metu corpus rigens
635	remittet artus, haeret in vultu trucis 
636	imago facti, ferte me insanae procul,
637	illo, procellae, ferte quo fertur dies
638	hinc raptus,
638b	Animos gravius incertos tenes,
639	quid sit quod horres ede et auctorem indica:
640	non quaero quis sit, sed uter. effare ocius. 
641	In arce summa Pelopiae pars est domus
642	conversa ad austros, cuius extremum latus
643	aequale monti crescit atque urbem premit
644	et contumacem regibus populum suis
645	habet sub ictu; fulget hic turbae capax 
646	immane. tectum-, cuius auratas trabes
647	variis columnae nobiles maculis ferunt,
648	post ista vulgo nota, quae populi colunt,
649	in multa dives spatia discedit domus;
650	arcana in imo regio secessu iacet, 
651	alta vetustum valle compescens nemus,
652	penetrale regni, nulla qua laetos solet
653	praebere ramos arbor aut ferro coli,
654	sed taxus et cupressus et nigra ilice
655	obscura natat silva, quam supra eminens 
656	despectat alte quercus et vincit nemus.
657	hinc suspicari regna Tantalidae solent,
658	hinc petere lassis rebus ac dubiis opem.
659	affixa inhaerent dona: vocales tubae
661	victaeque falsis axibus pendent rotae 
660	fractique currus", spolia Myrtoi maris 
662	et omne gentis facinus; hoc Phrygius loco
663	fixus tiaras Pelopis, hic praeda hostium
664	et de triumpho picta barbarico chlamys.
665	fons stat sub umbra tristis et nigra piger 
666	haeret palude: talis est dirae Stygis 
667	deformis unda quae facit caelo fidem.
668	hinc nocte caeca gemere feralis deos
669	fama est, catenis lucus excussis sonat
670	ululantque manes, quicquid - audire est metus 
671	illic videtur: errat antiquis vetus
672	emissa bustis turba et insultent loco
673	maiora notis monstra; quin tecta solet
674	micare silva flamma, et excelsae trabes
675	ardent sine igne. saepe latratu nemus 
676	trino remugit, saepe simulacris domus
677	attonita magnis, nec dies sedat metum:
678	nox propria luco est et superstitio inferum
679	in luce media regnat, hinc orantibus
680	responsa dantur certa, cum ingenti sono 
681	laxantur adyto fata et inmugit specus
682	vocem deo solvente. quo postquam furens
683	intravit Atreus liberos fratris trahens,
684	ornantur arae— quis queat digne eloqui?
685	post terga iuvenum nobiles religat manus 
686	et maesta vitta capita purpurea ligat;
687	non tura desunt, non sacer Bacchi liquor
688	tangensque salsa victimam culter mola.
689	servatur omnis ordo, ne tantum nefas
690	non rite fiat.
690b	Quis manum ferro admovet? 
691	Ipse est sacerdos, ipse funesta prece
692	letale carmen ore violento canit,
693	stat ipse ad aras, ipse devotos neci
694	contrectat et componit et † ferro admovet;
695	attendit ipse: nulla pars sacri perit 
696	lucus tremescit, tota succusso solo
697	nutavit aula, dubia quo pondus daret
698	ac fluctuanti similis; e laevo aethere
699	atrum cucurrit limitem sidus trahens.
700	libata in ignes vina mutato fluunt 
701	cruenta Baccho., regium capiti decus
702	bis terque lapsum est, flevit in templis ebur.
703	movere cunctos monstra, sed solus sibi
704	immotus Atreus constat atque ultro deos
705	terret minantes, iamque dimissa mora 
706	adsistit aris, torvum et obliquum intuens.
707	ieiuna silvis qualis in Gangeticis
708	inter iuvencos tigris erravit duos,
709	utriusque praedae cupida quo primum ferat
710	incerta morsus (flectit hoc rictus suos, 
711	illo reflectit et famem dubiam tenet),
712	sic dirus Atreus capita devota impiae
713	speculatur irae: quem prius mactet sibi
714	dubitat, secunda deinde quem caede immolet.
715	nec interest, sed dubitat et saevum scelus 
716	iuvat ordinare.
716b	Quem tamen ferro occupat?
717	Primus locus (ne desse pietatem putes)
718	aro dicatur: Tantalus prima hostia est.
719	Quo iuvenis animo, quo tulit vultu necem?
720	Stetit sui securus et non est preces 
721	perire frustra passus; ast illi ferus
722	in vulnere ensem abscondit et penitus premens
723	iugulo manum commisit: educto stetit
724	ferro cadaver, cumque dubitasset diu,
725	hac parte an illa caderet, in patruum cadit. 
726	tunc ille ad aras Plisthenem saevus trahit
727	adicitque fratri; colla percussa amputat;
728	cervice caesa truncus in pronum ruit,
729	querulum cucurrit murmure incerto caput.
730	Quid deinde gemina caede perfunctus facit? 
731	puerone parcit an scelus sceleri ingerit?
732	Silva iubatus qualis Armenia leo
733	in caede multa victor armento incubat
734	(cruore rictus madidus et pulsa fame
735	non ponit iras: hinc et hinc tauros premens 
736	vitulis minatur dente iam lasso piger),
737	non aliter Atreus saevit atque ira tumet,
738	ferrumque gemina caede perfusum tenens,
739	oblitus in quem fureret, infesta manu
740	exegit ultra corpus— ut pueri statim 
741	pectore receptus ensis in tergo extitit;
742	cadit ille et aras sanguine extinguens suo
743	per utrumque vulnus moritur.
743b	O saevum scelus!
744	Exhorruistis? hactenus si stat nefas,
745	pius est.
745b	An ultra maius aut atrocius 
746	natura recipit?
746b	Sceleris hunc finem putas?
747	gradus est.
747b	Quid ultra potuit? obiecit feris
748	lanianda forsan corpora atque igne arcuit?
749	Vtinam arcuisset! ne tegat functos humus
750	nec solvat ignis! avibus epulandos licet 
751	ferisque triste pabulum saevis trahat—
752	votum est sub hoc quod esse supplicium solet:
753	pater insepultos spectet! o nullo scelus
754	credibile in aevo quodque posteritas neget—
755	erepta vivis exta pectoribus tremunt 
756	spirantque venae corque adhuc pavidum salit;
757	at ille libras tractat ac fata inspicit
758	et adhuc calentes viscerum venas notat.
759	postquam hostiae placuere, securus vacat
760	iam fratris epulis: ipse divisum secat 
761	in membra corpus, amputat trunco tenus
762	umeros patentis et lacertorum. moras,
763	denudat artus durus atque ossa amputat;
764	tantum ora servat et datas fidei manus.
765	haec veribus' haerent viscera et lentis data 
766	stillant caminis, illa flammatus latex
767	querente aeno iactat, impositas dapes
768	transiluit ignis inque trepidantes focos
769	bis ter regestus et pati iussus moram
770	invitus ardet, stridet in veribus iecur; 
771	nec facile dicam, corpora an flammae magis
772	gemuere. piceos ignis in fumos abit;
773	et ipse fumus, tristis ac nebula gravis,
774	non rectus exit seque in excelsum levat:
775	ipsos penates nube deformi obsidet. 
776	O Phoebe patiens, fugeris retro licet
777	medioque ruptum merseris caelo diem.
778	sero occidisti. lancinat gnatos pater
779	artusque mandit ore funesto suos;
780	nitet fluente madidus unguento comam 
781	gravisque vino; saepe praeclusae cibum
782	tenuere fauces— in malis unum hoc tuis
783	bonum est, Thyesta, quod mala ignoras tua.
784	sed et hoc peribit, verterit currus licet
785	sibi ipse Titan obvium ducens iter 
786	tenebrisque facinus obruat tetrum novis
787	nox missa ab ortu tempore alieno gravis,
788	tamen videndum est. tota patefient mala.
789	Quo terrarum superumque parem,
790	cuius ad ortus noctis opacae 
791	decus omne fugit, quo vertis iter
792	medioque diem perdis Olympo?
793	cur, Phoebe, tuos rapis aspectus?
794	nondum serae nuntius horae
795	nocturna vocat lumina Vesper; 
796	nondum Hesperiae flexura rotae
797	iubet emeritos solvere currus;
798	nondum in noctem vergente die
799	tertia misit bucina signum:
800	stupet ad subitae tempora cenae 
801	nondum fessis bubus arator,
802	quid te aetherio pepulit cursu?
803	quae causa tuos
804	limite certo deiecit equos?
805	numquid aperto carcere Ditis 
806	victi temptant bella Gigantes?
807	numquid Tityos pectore fesso
808	renovat veteres saucius iras?
808b	num reiecto
809	latus explicuit monte Typhoeus?
810	numquid struitur via Phlegraeos 
811	alta per hostes et Thessalicum
812	Thressa premitur Pelion Ossa?
813	solitae mundi periere vices?
814	nihil occasus, nihil ortus erit?
815	stupet Eoos 
816	assueta deo tradere frenos
817	genetrix primae roscida lucis
818	perversa sui limina regni;
818b	nescit fessos
819	tinguere currus nec fumantes
820	sudore iubas mergere ponto. 
821	ipse insueto novus hospitio
822	Sol Auroram videt occiduus,
823	tenebrasque iubet surgere nondum
824	nocte parata: non succedunt
825	astra nec ullo micat igne polus, 
826	non Luna gravis digerit umbras.
827	Sed quicquid id est, utinam nox sit!
828	trepidant, trepidant
829	pectora magno percussa metu:
830	ne fatali cuncta ruina 
831	quassata labent iterumque, deos
832	hominesque premat deforme chaos,
833	iterum terras et mare cingens
834	et vaga picti sidera mundi
835	natura tegat. 
836	non aeternae facis exortu
837	dux astrorum saecula ducens
838	dabit aestatis brumaeque notas,
839	non Phoebeis obvia flammis
840	dement nocti Luna timores 
841	vincetque sui fratris habenas,
842	curro brevius limite currens;
842b	ibit in unum
843	congesta sinum turba deorum,
844	hic qui sacris pervius astris
845	secat obliquo tramite zonas 
846	flectens longos signifer annos,
847	lapsa videbit sidera labens;
848	hic qui nondum vere benigno
849	reddit Zephyro- vela tepenti,
850	Aries praeceps ibit in undas, 
851	per quas pavidam vexerat Hellen;
852	hic qui nitido Taurus cornu
853	praefert Hyadas, secum Geminos
854	trahet et curvi bracchia Cancri;
855	Leo flammiferis aestibus ardens 
856	iterum e caelo cadet Herculens,
857	cadet in terras Virgo relictas
858	iustaeqne cadent pondera Librae
859	secumque trahent Scorpion acrem;
860	et qui nervo tenet Haemonio 
861	pinnata senex spicula Chiron,
862	rupto perdet spicula nervo;
863	pigram referens hiemem gelidus
864	cadet Aegoceros frangetque tuam,
865	quisquis es, urnam; tecum excedent 
866	ultima caeli sidera Pisces,
867	Plostraque numquam perfusa mari
868	merget condens omnia gurges;
869	et qui medias dividit Vrsas,
870	fluminis instar lubricus Anguis 
871	magnoque minor iuncta Draconi
872	frigida duro. Cynosura gelu,
873	custosque sui tardus plaustri
874	iam non stabilis ruet Arctophylax.
875	Nos e tanto visi populo 
876	digni premeret quos everso
877	cardine mundus?
878	in nos aetas ultima venit?
879	o nos dura sorte creatos,
880	seu perdidimus solem miseri, 
881	sive expulimus!
882	abeant questus, discedo, timor:
883	vitae est avidus quisquis non vult
884	mundo secum pereunte mori.
885	Aequalis astris gradior et cunctos super 
886	altum superbo vertice attingens polum.
887	nunc decora regni teneo, nunc solium patris,
888	dimitto superos: summa votorum attigi,
889	bene est, abunde est. iam sat est etiam mihi.
890	sed cur satis sit? pergam et impleto patre 
891	funere suorum, ne quid obstaret pudor,
892	dies recessit: perge dum caelum vacat,
893	utinam quidem tenere fugientes deos
894	possem et coaetos trahere, ut ultricem dapem
895	omnes viderent— quod sat est, videat pater. 
896	etiam die nolente discutiam tibi
897	tenebras, miseriae sub quibus latitant tuae.
898	nimis diu conviva securo iaces
899	hilarique vultu, iam satis mensis datum est
900	satisque Baccho: sobrio tanta ad mala 
901	opus est Thyeste. turba familiaris, fores
902	templi relaxa, festa patefiat domus.
903	libet videre, capita natorum intuens
904	quos det colores, verba quae primus dolor
905	effundat aut ut spiritu expulso stupens 
906	corpus rigescat. fructus hic operis mei est.
907	miserum videre nolo, sed dum fit miser.
908	aperta multa tecta conlucent face.
909	resupinus ipse purpurae atque auro incubat,
910	vino gravatum fulciens laeva caput. 
911	eructat. o me caelitum excelsissimum,
912	regumque regem! vota transcendi mea.
913	satur est, capaci ducit argento merum—
914	ne parce potu: restat etiamnunc cruor
915	tot hostiarum; veteris hunc Bacchi color 
916	abscondet— hoc, hoc mensa cludatur scypho
917	mixtum suorum sanguinem genitor bibat:
918	meum bibisset. ecce, iam cantus ciet
919	festasque voces nec satis menti imperat.
920	Pectora longis hebetata malis, 
921	iam sollicitae ponite curas.
922	fugiat maeror fugiatque pavor,
923	fugiat trepidi comes exilii
924	tristis egestas
925	rebusque gravis pudor afflictis: 
926	magis unde cadas quam quo refert.
927	Magnum, ex alto culmine lapsum
928	stabilem in plano figere gressum;
929	magnum, ingenti strage malorum
930	pressum fracti pondera regni 
931	non inflexa cervice pati
932	nec degenerem victumque malis
933	rectum impositas ferre ruinas.
934	Sed iam saevi nubila fati
934b	pelle ac miseri 
935	temporis omnis dimitte notas; 
936	redeant vultus ad laeta boni,
937	veterem ex animo mitte Thyesten.
938	Proprium hoc miseros sequitur vitium,
939	numquam rebus credere laetis:
940	redeat felix fortuna licet, 
941	tamen afflictos gaudere piget,
942	quid me revocas festumque vetas
943	celebrare diem. quid flere iubes,
944	nulla surgens dolor ex causa?
945	quid me prohibes flore decenti 
946	vincire comam? prohibet, prohibet!
947	Vernae capiti Auxere rosae,
948	pingui madidus crinis amomo
949	inter subitos stetit horrores,
950	imber vultu nolente cadit, 
951	venit in medias voces gemitus,
952	maeror lacrimas amat assuetas,
953	flendi miseris dira cupido est.
954	libet infaustos mittere questus,
955	libet et Tyrio saturas ostro 
956	rumpere vestes, ululare libet.
957	Mittit luctus signa futuri
958	mens, ante sui praesaga mali:
959	instat nautis fera tempestas,
960	cum sine vento tranquilla tument. 
961	Quos tibi luctus quosve tumultus
962	fingis, demens? credula praesta
963	pectora fratri: iam, quicquid id est,
964	vel sine causa vel sero times.
965	Nolo infelix, sed vagus intra 
966	terror oberrat, subitos fundunt
967	oculi fletus, nec causa subest,
968	dolor an metus est?
969	an habet lacrimas magna voluptas?
970	Festum diem, germane, consensu pari 
971	celebremus: hic est, sceptra qui firmet mea
972	solidamque pacis alliget certae fidem.
973	Satias dapis me nec minus Bacchi tenet,
974	augere cumulus hic voluptatem potest,
975	si cum meis gaudere felici datur. 
976	Hic esse natos crede in amplexu patris,
977	hic sunt eruntque; nulla pars prolis tuae
978	tibi subtrahetur. ora quae exoptas dabo
979	totumque turba iam sua implebo patrem,
980	satiaberis, ne metue. nunc mixti meis 
981	iucunda mensae sacra iuvenilis colunt;
982	sed accientur. poculum infuso cape
983	gentile Baccho,
983b	Capio fraternae dapis
984	donum, paternis vina libentur deis.
985	tunc hauriantur. sed quid hoc? nolunt manus 
986	parere, crescit pondus et dextram gravat;
987	admotus ipsis Bacchus a labris fugit
988	circaque rictus ore decepto fluit
989	et ipsa trepido mensa subsiluit solo.
990	vix lucet ignis; ipse quin aether gravis 
991	inter diem noctemque desertus stupet,
992	quid hoc? magis magisque concussi labant
993	convexa caeli; spissior densis coit
994	caligo tenebris noxque se in noctem abdidit;
995	fugit omne sidus, quicquid est, fratri precor 
996	gnatisque parcat, omnis in vile hoc caput
997	abeat procella, redde iam gnatos mihi!
998	Reddam, et tibi illos nullus eripiet dies.
999	Quis hic tumultus viscera exagitat mea?
1000	quid tremuit intus? sentio impatiens onus 
1001	meumque gemitu non meo pectus gemit,
1002	adeste, nati, genitor infelix vocat,
1003	adeste. visis fugiet hic vobis dolor—
1004	unde obloquuntur?
1004b	Expedi amplexus pater:
1005	«venere, gnatos ecquid agnoscis tuos? 
1006	Agnosco fratrem, sustines tantum nefas
1007	gestare, Tellus? non ad infernam Styga
1008	tenebrasque mergis rupta et ingenti via
1009	ad chaos inane regna cum rege abripis?
1010	non tota ab imo tecta convellens solo 
1011	verti» Mycenas? stare circa Tantalum
1012	uterque iam debuimus: hinc compagibus
1013	et hinc revulsis, si quid infra Tartara est
1014	avesque nostros, hoc tuam, inmani sinu
1015	demitte vallem nosque defossos tege 
1016	Acheronte toto. noxiae supra, caput
1017	animae vagentur nostrum et ardenti freto
1018	Phlegethon harenas igneus totas agens
1019	exilia supra nostra violentus fluat—
1020	immota tellus pondus ignavum iaces? 
1021	fugere superi,
1021b	Iam accipe hos potius libens
1022	diu expetitos— nulla per fratrem est mora:
1023	fruere, osculare, divide amplexus tribus.
1024	Hoc foedus? haec est gratia, haec fratris fides?
1025	sic odia ponis? non peto. incolumis pater 
1026	natos ut habeam; scelere quod salvo dari
1027	odioque possit, frater hoc fratrem rogo:
1028	sepelire liceat, redde quod cernas statim
1029	uri; nihil te genitor habiturus rogo.
1030	sed perditurus.
1030b	Quicquid e natis tuis 
1031	superest habes, quodcumque non superest habes.
1032	Vtrumne saevis pabulum alitibus iacent,
1033	an beluis servantur, an pascunt feras?
1034	Epulatus ipse es impia natos dape.
1035	Hoc est deos quod puduit, hoc egit diem 
1036	aversum in ortus, quas miser voces dabo
1037	qnestusque quos? quae verba sufficient mihi?
1038	abscisa cerno capita et avulsas manus
1039	et rupta fractis cruribus vestigia—
1040	hoc est quod avidus capere non potuit pater. 
1041	volvuntur intus viscera et clusum nefas
1042	sine exitu luctatur et quaerit fugam.
1043	da, frater, ensem (sanguinis multum mei
1044	habet ille): ferro liberis detur via.
1045	negatur ensis? pectora inliso sonent 
1046	contusa planctu— sustine, infelix, manum,
1047	pareamus umbris, tale quis vidit nefas?
1048	quis inhospitalis Caucasi rupem asperam
1049	Heniochus habitans quisve Cecropiis metus
1050	terris Procrustes? genitor en natos premo 
1051	premorque natis— sceleris est aliquis modus.
1052	Sceleri modus debetur ubi facias scelus,
1053	non ubi reponas. hoc quoque exiguum est mihi.
1054	ex vulnere ipso sanguinem calidum in tua
1055	defundere ora debui, ut viventium 
1056	biberes cruorem— verba sunt irae data
1057	dum propero, ferro vulnera impresso dedi,
1058	cecidi ad aras, caede votiva focos
1059	placavi et artus, corpora exanima amputans,
1060	in parva carpsi frusta et haec ferventibus 
1061	demersi aenis, illa lentis ignibus
1062	stillare iussi; membra nervosque abscidi
1063	viventibus, gracilique traiectas veru
1064	mugire fibras vidi et aggessi manu
1065	mea ipse flammas— omnia haec melius pater 
1066	fecisse potuit, cecidit in cassum dolor:
1067	scidit ore natos impio, sed nesciens,
1068	sed nescientes,
1068b	Clausa litoribus vagis
1069	audite maria, vos quoque audite hoc scelus,
1070	quocumque, di, fugistis, audite inferi, 
1071	audite terrae, Noxque Tartarea gravis
1072	et atra nube, vocibus nostris vaca
1073	(tibi sum relictus, sola tu miserum vides,
1074	tu quoque sine astris), vota non faciam improba,
1075	pro me nihil precabor— et quid iam potest 
1076	pro me esse? vobis vota prospicient mea.
1077	tu, summe caeli rector, aetheriae potens
1078	dominator aulae, nubibus totum horridis
1079	convolve mundum, bella ventorum undique
1080	committe et omni parte violentum intona, 
1081	manuque non qua tecta et immeritas domos
1082	telo petis minore, sed qua montium
1083	tergemina moles cecidit et qui montibus
1084	stabant pares Gigantes, hac arma expedi
1085	ignesque torque, vindica amissum diem, 
1086	iaculare flammas, lumen ereptum polo
1087	fulminibus exple. causa, ne dubites diu,
1088	utriusque mala sit; si minus, mala sit mea:
1089	me pete, trisulco flammeam telo facem
1090	per pectus hoc transmitte— si gnatos pater 
1091	humare et igni tradere extremo volo,
1092	ego sum cremandus. si nihil superos movet
1093	nullumque telis impios numen petit,
1094	aeterna nox permaneat et tenebris tegat
1095	inmensa longis scelera, nil, Titan, queror, 
1096	si perseveras.
1096b	Nunc meas laudo manus,
1097	nunc parta vera est palma, perdideram scelus,
1098	nisi sic doleres. liberos nasci mihi
1099	nunc credo, castis nunc fidem reddi toris.
1100	Quid liberi meruere?
1100b	Quod fuerant tui. 
1101	Natos parenti
1101b	Fateor et, quod me iuvat,
1102	 certos.
1102b	Piorum praesides testor deos.
1103	Quin coniugales?
1103b	Scelere quis pensat scelus?
1104	Scio quid queraris: scelere praerepto doles,
1105	nec quod nefandas hauseris angit dapes — 
1106	quod non parans! fuerat hic animus tibi
1107	instruere similes inscio fratri cibos
1108	et adiuvante liberos matre aggredi
1109	similique leto sternere — hoc unum obstitit:
1110	tuos putasti.
1110b	Vindices aderunt dei; 
1111	his puniendum vota te tradunt mea.
1112	Te puniendum liberis trado tuis.
