18	 Facta igitur pace cum Persis ad Thracias rediit et centum milia Bastarnarum in solo Romano For a similar policy, see Alex., lviii. 4. From Nubia; see note to Aur., xxxiii. 4. Undaunted by the defeat administered under Aurelian they had broken forth again and had overrun all Upper Egypt. According to Zosimus, i. 71, 1, they were now defeated by Probus' generals; because of this statement it has been questioned whether Probus himself was in Egypt at all. i.e., the Persians, against whom the present eastern expedition was directed in resumption of the war which had been cut short by the murder of Aurelian; see Aur., xxxv. 4-5. constituit, qui omnes fidem servarunt. sed cum et ex aliis gentibus plerosque pariter transtulisset, id est ex Gepedis, Greuthungis et Vandalis, illi omnes fidem fregerunt et occupato bellis tyrannicis Probo per totum paene orbem pedibus et navigando vagati sunt nec parum molestiae Romanae gloriae intulerunt. quos quidem ille diversis vicibus variisque victoriis oppressit, paucis domum cum gloria redeuntibus, quod Probi evasissent manus, haec Probus cum barbaris gessit. Sed habuit etiam non leves tyrannicos motus, nam et Saturninum, qui orientis imperium arripuerat, variis proeliorum generibus et nota virtute superavit, quo victo tanta in oriente quies fuit, ut, quemadmodum vulgo loquebantur, mures rebelles nullus audiret. deinde cum Proculus et Bonosus apud Agrippinam in Gallia imperium arripuissent omnesque sibi iam Britannias, Hispanias et bracatae Galliae provincias vindicarent, barbaris semet iuvantibus vicit. Ac ne requiras plura vel de Saturnino vel de Proculo vel de Bonoso, suo eosdem inseram libro, North of the mouth of the Danube. Like the Getae, they may have been driven southward by the pressure of the Goths, and now they were admitted to Roman territory. Both Gothic tribes; see Claud., vi. 2 and note. Nothing is known of any of these settlers, but Zosimus (i. 71, 2) tells of a colony of Franks settled by Probus near the mouth of the Danube, who, as soon as the Emperor had left the region, built ships and, after plundering the coasts of Greece, Sicily and northern Africa, sailed off to their home, near the mouth of the Rhine. The biographer may have generalised this incident. See Firm., vii.-xi. See Firm., xii.-xiii. See Firm., xiv-xv. pauca de iisdem, ut decet, immo ut poscit necessitas, locuturus. unum sane sciendum est, quod Germani omnes, cum ad auxilium essent rogati a Proculo, Probo servire maluerunt quam cum Bonoso et Proculo imperare. Gallis omnibus et Hispanis ac Britannis hinc permisit, ut vites haberent vinumque conficerent. ipse Almam montem in Illyrico circa Sirmium militari manu fossum lecta vite conseruit. 
19	 Dedit Romanis etiam voluptates, et quidem insignes, delatis etiam congiariis. triumphavit de Germanis et Blemmyis, omnium gentium drungos usque ad quinquagenos homines ante triumphum duxit, venationem in Circo amplissimam dedit, ita ut populus cuncta diriperet. genus autem spectaculi fuit tale : arbores validae per milites radicitus vulsae conexis late longeque trabibus ad rixae sunt, terra deinde superiecta totusque Circus ad silvae consitus speciem gratia novi viroris effronduit. missi deinde per omnes ut om. in P. imperare ins. by Peter ; om. in P. aditus struthiones mille, mille cervi, mille apri; iam damae, ibices, oves ferae et cetera herbatica animalia quanta vel ali potuerunt vel inveniri, inmissi deinde populares, rapuit quisque quod voluit, edidit alia die in Amphitheatro una missione centum iubatos leones, qui rugitibus suis tonitrus excitabant. qui omnes e posticis interempti sunt, non magnum praebentes spectaculum, quo occidebantur. neque enim erat bestiarum impetus ille qui esse e caveis egredientibus solet; occisi sunt praeterea multi, qui dirigere nolebant, sagittis, editi deinde centum leopardi Libyci, centum deinde Syri ; editae centum leaenae et ursi simul trecenti; quarum omnium ferarum magnum magis constat spectaculum fuisse quam gratum. edita praeterea gladiatorum paria trecenta Blemmyis plerisque pugnantibus, qui per triumphum erant ducti, plerisque Germanis et Sarmatis, nonnullis etiam latronibus Isauris. 
20	 Quibus peractis bellum Persicum parans, cum per Illyricum iter faceret, a militibus suis per insidias interemptus est. causae occidendi eius haec fuerunt: primum quod numquam militem otiosum esse perpessus est, si quidem multa opera militari manu perfecit, dicens annonam gratuitam militem comedere non debere, his addidit dictum eis grave, si umquam eveniat, salutare rei publicae, brevi milites necessarios non futuros, quid ille conceperat animo qui hoc e ins. by Salm., who explains posticis ; om. in P. dicebat? nonne omnes barbaras gentes subegerat pedibus totumque mundum fecerat iam Romanum? Brevi, " inquit, " milites necessarios non habebimus. quid est aliud dicere : Romanus iam miles erit nullus? ubique regnabit, omnia possidebit secura res publica. orbis terrarum non arma fabricabitur, non annonam praebebit, boves habebuntur aratro, equus nascetur ad pacem, nulla erunt bella, nulla captivitas, ubique pax, ubique Romanae leges, ubique iudices nostri. 
21	 Longius amore imperatoris optimi progredior quam pedestris sermo desiderat, quare addam illud quod praecipue tanto viro fatalem properavit necessitatem. nam cum Sirmium venisset ac solum patrium effecundari cuperet et dilatari, ad siccandam quandam paludem multa simul milia militum posuit, ingentem parans fossam, qua deiectis in Savum naribus loca Sirmiensibus profutura siccaret. hoc permoti milites confugientem eum in turrem ferratam, quam ipse speculae causa elatissimam exaedificaverat, interemerunt anno imperii sui quinto, postea tamen ingens ei sepulchrum elatis aggeribus omnes pariter milites subegerat Editor (cf. c. xv. 2 ; xvii. 2) ; subierat P ; subiecerat *s , Peter, Hohl. pedibus totumque *s , Peter 1; pedibusque totum P; penitusque totum Kellerbauer, Peter 2, Hohl. possidebit Salm., Peter; possidebimus P, *s . boues Salm.; uobis P. Sauum Closs, Peter ; saltum P. so *s , Petschenig, Hohl; hac permoti P ; hac re moti Salm., Peter. fecerunt cum titulo huius modi inciso marmori: Hic Probus imperator et vere probus situs est, victor omnium gentium barbararum, victor etiam tyrannorum. 
22	 Conferenti mihi cum aliis imperatoribus principem Probum omnibus prope Romanis ducibus, qua fortes, qua clementes, qua prudentes, qua mirabiles exstiterunt, intellego hunc virum aut parem fuisse aut, si non repugnat invidia furiosa, meliorem, quinquennio enim imperii sui per totum orbem terrarum tot bella gessit, et quidem per se, ut mirabile sit quemadmodum omnibus occurrerit proeliis, multa manu sua fecit, duces praeclarissimos instituit, nam ex eius disciplina Carus, Diocletianus, Constantius, Asclepiodotus, Hannibalianus, Leonides, Cecropius, Pisonianus, Herennianus, Gaudiosus, Ursinianus et ceteri, quos patres nostri mirati sunt et de quibus nonnulli boni principes exstiterunt. conferat nunc, cui placet, viginti Traiani Hadrianique annos, conferat prope totidem Antoninorum. nam quid de Augusto loquar, cuius imperii annis vix potest advivi? malos autem principes taceo, ipsa vox Probi clarissima indicat quid se facere potuisse speraret, qui dixit brevi necessarios milites 
23	 non futuros. ille vero conscius sui non barbaros timuit, non tyrannos. quae deinde felicitas emicuisset, si sub illo principe milites non fuissent? an- qua om. in P and by Hohl. anni P. nonam provincialis daret nullus, stipendia de largitionibus nulla erogarentur, aeternos thesauros haberet Romana res publica, nihil expenderetur a principe, nihil a possessore redderetur ; aureum profecto saeculum promittebat, nulla futura erant castra, nusquam lituus audiendus, arma non erant fabricanda. populus iste militantium, qui nunc bellis civilibus rem publicam vexat, araret, studiis incumberet, erudiretur artibus, navigaret. adde quod nullus occideretur in bello. di boni, quid tantum vos offendit Romana res publica, cui talem principem sustulistis? eant nunc, qui ad civilia bella milites parant, in germanorum necem arment dexteras fratrum, hortentur in patrum vulnera liberos et divinitatem Probo derogent, quam imperatores nostri prudenter et consecrandam vultibus et ornandam templis et celebrandam ludis circensibus iudicarunt. 
24	 Posteri Probi vel odio vel invidiae timore Romanam rem fugerunt et in Italia circa Veronam ac Benacum et Larium atque in his regionibus larem locaverunt. sane quod praeterire non potui, cum imago Probi in Veronensi sita fulmine icta esset ita et S; om. in *s . lecta P. ut eius praetexta colores mutaret, haruspices responderunt huius familiae posteros tantae in senatu claritudinis fore ut omnes summis honoribus fungerentur. sed adhuc neminem vidimus, posteri autem aeternitatem videntur habere non modum. Senatus mortem Probi gravissime accepit, aeque populus, et cum esset nuntiatum Carum imperare, virum bonum quidem sed longe a moribus Probi, Carini causa filii eius, qui semper pessime vixerat, tam senatus quam populus inhorruit, metuebant enim unusquisque tristiorem principem, sed magis improbum metue- bant heredem. Haec sunt, quae de Probo cognovimus vel quae digna memoratu aestimavimus. nunc in alio libro, et quidem brevi, de Firmo et Saturnino et Bonoso et Proculo dicemus, non enim dignum fuit ut quadrigae tyrannorum bono principi miscerentur, post deinde si vita suppetit, Carum incipiemus propagare cum liberis. Cf. Tac, xv. 1-2. 2 Cf. Car., iii. 8. 
