1.37.2.5	 Maximus barbaris terror elephanti fuere, inmanitati gentium pares. Nihil tam conspicuum in triumpho quam rex ipse Bituitus dis- sullae N: sillae B. laciniam post venientem indicavit Mommsenus: saevitum vel saeviente Aldus: venit malum vel exitium Rossbachius. eos add. Voss. Rehd. Monac. Palat. utriusque lahnius: variusque codd. testes Dukerus: testis codd. elephanti N L: elephantis B. Bituitus: vituitus B: bis visus N L. coloribus in armis argenteoque carpento, qualis pugnaverat. 
1.37.2.6	 Utriusque victoriae quod quantumque gaudium fuerit, vel hinc aestimari potest, quod et Domitius Ahenobarbus et Fabius Maximus ipsis quibus dimicaverant locis saxeas erexere turres, et desuper exornata armis hostilibus tropaea fixerunt, cum hic mos inusitatus fuerit nostris. Numquam enim populus Romanus hostibus domitis victoriam exprobravit. 
1.38.3.1	 Cimbri, Teutoni atque Tigurini ab extremis Galliae profugi, cum terras eorum inundasset Oceanus, 
1.38.3.2	 novas sedes toto orbe quaerebant, exclusique et Gallia et Hispania cum in Italiam demigrarent, misere legatos in castra Silani, inde ad senatum, petentes ut Martius populus aliquid sibi terrae daret quasi stipendium, ceterum ut vellet manibus atque armis suis uteretur. 
1.38.3.3	 Sed quas daret terras populus Romanus agrariis legibus inter se dimicaturus? Repulsi igitur, quod nequiverant precibus, 
1.38.3.4	 armis petere coeperunt. Sed nec primum impetum barbarorum Silanus, nec secundum Manilius, nec tertium Caepio sustinere potuerunt; omnes fugati, 
1.38.3.5	 exuti castris. Actum erat, nisi Marius illi saeculo contigisset. Ille quoque non ausus congredi statim militem tenuit in castris, donec invicta illa rabies coeperunt: ceperunt B: constituunt N L. et impetus, quem pro virtute barbari habent, consenesceret. 
1.38.3.6	 Recessere igitur increpantes et—tanta erat capiendae urbis fiducia—consulentes, si quid ad uxores suas mandarent. Nec segnius quam minati fuerant tripertito agmine in Alpes, id est claustra Italiae, ferebantur. 
1.38.3.7	 Marius mira statim velocitate occupatis compendiis praevenit hostem, prioresque Teutonas sub ipsis Alpium radicibus adsecutus in loco quem Aquas Sextias vocant quo—fidem numinum—proelio oppressit! Vallem fluviumque medium hostes tenebant, nostris aquarum nulla copia. 
1.38.3.8	 Consultone id egerit imperator, an errorem in consilium verterit, dubium; certe necessitate acta virtus victoriae causa fuit. 
1.38.3.9	 Nam flagitante aquam exercitu, Si viri estis, inquit en, illic habetis. Itaque tanto ardore pugnatum est, ea caedes hostium fuit, ut victor Romanus cruento flumine non plus aquae biberit quam sanguinis barbarorum. 
1.38.3.10	 Certe rex ipse Teutobodus, quaternos senosque equos transilire solitus, vix unum, cum fugeret, ascendit, proximoque in saltu conprehensus insigne spectaculum triumphi fuit, Quippe vir proceritatis eximiae super tropaea sua eminebat. 
1.38.3.11	 Sublatis funditus Teutonis in Cimbros convertitur. quo fidem Salmasius: pro fide B: qua fide L. flagitante aquam exercitu: flagitantem aquam exercitum B. Teutobodus: teuto vocatus B: teutobocus NL. Hi iam—quis crederet?—per hiemem, quae altius Alpes levat, Tridentinis iugis in Italiam provoluti veluti ruina descenderant. 
1.38.3.12	 Atesim flumen non ponte nec navibus, sed quadam stoliditate barbarica primum corporibus adgressi, postquam retinere amnem manibus et clipeis frustra temptaverant, 
1.38.3.13	 ingesta silva obrutum transiluere. Si statim infesto agmine urbem petissent, grande discrimen; sed in Venetia, quo fere tractu Italia mollissima est, ipsa soli caelique clementia robur elanguit. Ad hoc panis usu carnisque coctae et dulcedine vini mitigatos Marius in tempore adgressus est. 
1.38.3.14	 Venere ipsi—nam metus in barbaris nulla vestigia—et diem pugnae a nostro imperatore petierunt; et sic proximum dedit. In patentissimo, quem Raudium vocant, campo concurrere. Inde milia sexaginta quinque cecidere, hinc trecentis minus; per omnem diem conciditur barbarus. 
1.38.3.15	 Istic quoque imperator addiderat virtuti dolum, secutus Annibalem artemque Cannarum; primum nebulosum nanctus diem, ut hosti inopinatus occurreret, tum ventosum quoque, ut pulvis in oculos et ora ferretur, tum acie conversa in orientem, ut, quod ex captivis mox cognitum est, ex splendore galearum aere repercusso quasi ardere caelum videretur. 
1.38.3.16	 Nec minor veluti add. N. Heinsius. Atesim Salmasius: adesim B: ad hostes in N L. locus valde corruptus: est—vestigia om. B: venere— vestigia om. L: venere illi quam et in barbaris multa vestigia ceteri: venere ipsi—nam metus in barbaris nulla vestigia—et etc. Halmius. aere repercusso lahnius: aere percusso B. cum uxoribus eorum pugna quam cum ipsis fuit; cum obiectis undique plaustris atque carpentis altae desuper securibus contisque pugnarent. 
1.38.3.17	 Perinde speciosa mors earum fuit quam pugna. Nam cum missa ad Marium legatione libertatem ac sacerdotium non inpetrassent (nec fas erat), suffocatis elisisque passim infantibus suis aut mutuis concidere vulneribus aut vinculo e crinibus suis facto ab arboribus iugisque plaustrorum pependerunt. 
1.38.3.18	 Boiorix rex in prima acie dimicans inpigre nec inultus occiditur. Tertia Tigurinorum manus, quae quasi in subsidio Noricos insederat Alpium tumulos, in diversa elapsa fuga ignobili et latrociniis evanuit. 
1.38.3.19	 Hunc tam laetum tamque felicem liberatae Italiae adsertique imperii nuntium non per homines, ut solebat, populus Romanus accepit, sed per ipsos, si credere fas est, deos. 
1.38.3.20	 Quippe eodem die quo gesta res est visi pro aede Pollucis et Castoris iuvenes laureatas praetori litteras dare, frequensque in spectaculo rumor victoriae Cimbricae. 
1.38.3.21	feliciter! dixit. Quo quid admirabilius, quid insignius fieri potest? Quippe velut elata montibus suis Roma spectaculo belli interesset, quod in Boiorix: Boleris BL: bo eloris N. et NL: e B. si credere fas est: fas est si credere B. post Cimbricae lacunam statuit lahnius. gladiatorio munere fieri solet, uno eodemque momento, cum in acie Cimbri succumberent, populus in urbe plaudebat. 
1.39.4.1	 Post Macedonas, si dis placet, Thraces rebellant, illi quondam tributarii Macedonum; nec in proximas modo provincias contenti incurrere, Thessaliam atque Dalmatiam, in Adriaticum mare usque venerunt; eoque fine retenti, quasi interveniente natura. 
1.39.4.2	 contorta in ipsas aquas tela miserunt. Nihil interim per id omne tempus residuum crudelitatis fuit in captivos saevientibus: litare dis sanguine humano, bibere in ossibus capitum, cuiusque modi ludibriis foedare mortem tam igni quam fumo, partus quoque gravidarum mulierum extorquere tormentis. 
1.39.4.3	 Saevissimi omnium Thracum Scordisci fuere, sed calliditas quoque ad robur accesserat: 
1.39.4.4	 silvarum et montium situs cum ingenio consentiebant. Itaque non fusus modo ab his aut fugatus, sed—simile prodigio—omnino totus interceptus exercitus quem duxerat Cato. 
1.39.4.5	 Didius vagos et libera populatione diffusos intra suam reppulit Thraciam. Drusus ulterius egit et vetuit transire Danuvium. Minucius toto vastavit Hebro, multis quidem amissis, dum per retenti Graevius: contenti codd. per id omne: peridomne L: perdi omne N: per imperium donec B. simile Aldus: simili BL. per om. B. 
1.39.4.6	 perfidum glacie flumen equitatur. Volso Rhodopen Caucasumque penetravit. Curio Dacia tenus venit, sed tenebras saltuum expavit. Appius in Sarmatas usque pervenit, Lucullus ad terminum gentium Tanain lacumque Maeotim. 
1.39.4.7	 Nec aliter cruentissimi hostium quam suis moribus domiti. Quippe in captivos igni ferroque saevitum est; sed nihil barbaris atrocius visum est quam quod abscisis manibus relicti vivere superstites poenae suae iubebantur. 
1.40.5.1	 Ponticae gentes a septentrione in sinistrum iacent, a Pontico cognominatae mari. Harum gentium atque regionum rex antiquissimus Aeetas, post Artabazes, a septem Persis oriundus, inde Mithridates, 
1.40.5.2	 omnium longe maximus. Quippe cum quattuor Pyrrho, tredecim anni Annibali suffecerint, ille per quadraginta annos restitit, donec tribus ingentibus bellis subactus felicitate Sullae, virtute Luculli, magnitudine Pompei consumeretur. 
1.40.5.3	 Causam quidem illius belli praetenderat apud Cassium legatum, adtrectari terminos suos a Nicomede Bithyno; ceterum elatus animis ingentibus Asiae totius et, Caucasumque: cauca umque B: Haemumque Iahnius. Aeetas: aetas N: aetas B: etas L. tredecim B: quattuordecim NL. Sullae: syllae N L: sillae B. 
1.40.5.4	 si posset, Europae cupiditate flagrabat. Spem ac fiduciam dabant nostra vitia. Quippe cum civilibus bellis distringeremur, invitabat occasio, nudumque latus imperii ostendebant procul Marius, Sulla, 
1.40.5.5	 Sertorius. Inter haec rei publicae vulnera et hos tumultus repente quasi captato tempore in lassos simul atque districtos subitus turbo Pontici belli ab ultima veluti specula septentrionis erupit. 
1.40.5.6	 Primus statim impetus belli Bithyniam rapuit, Asia inde pari terrore correpta est, nec cunctanter ad regem ab urbibus nostris populisque descitum est. 
1.40.5.7	 Aderat, instabat, saevitia quasi virtute utebatur. Nam quid atrocius uno eius edicto, cum omnes qui in Asia forent Romanae civitatis homines interfici iussit? tum quidem domus, templa et arae, 
1.40.5.8	 humana omnia atque divina iura violata sunt. Sed hic terror Asiae Europam quoque regi aperiebat. Itaque missis Archelao Neoptolemoque praefectis, excepta Rhodo, quae pro nobis firmius stetit, ceterae Cyclades, Delos, Euboea et ipsum Graeciae decus Athenae tenebantur. 
1.40.5.9	 Italiam iam ipsamque urbem Romam regius terror adflabat. Itaque L. Sulla festinat, vir armis optimus, parique violentia ruentem ulterius hostem quadam quasi manu reppulit. 
1.40.5.10	 Primumque Athenas urbem,—quis crederet?—frugum parentem, obsidione ac fame ad humanos cibos conpulit; mox subrutus Piraei portus sex aut amplius muris cinctus. Postquam domuerat ingratissimos hominum, tamen, ut ipse dixit, in honorem mortuorum sacris suis famaeque donavit. 
1.40.5.11	 Mox cum Euboea atque Boeotia praesidia regis depulisset, omnis copias uno apud Chaeroniam, apud Orchomenon altero bello dissipavit, statimque in Asiam transgressus ipsum opprimit. Et debellatum foret, nisi de Mithridate triumphare cito quam vere maluisset. 
1.40.5.12	 Ac tum quidem hunc Asiae statum Sulla dederat. Ictum cum Ponticis foedus, recepit Bithyniam a rege Nicomedes, Ariobarzanes Cappadociam, Asia rursus nostra, ut coeperat, Mithridates tantum repulsus. Itaque non fregit ea res Ponticos, 
1.40.5.13	 sed incendit. Quippe rex Asia et Europa quodam modo inescatus non iam quasi alienas, sed, quia amiserat, quasi raptas belli iure repetebat. 
1.40.5.14	 Igitur ut extincta parum fideliter incendia maiore flamma revivescunt, ita ille de integro, auctis maiorem in modum copiis, tota denique regni sui mole in Asiam rursus mari terra fluminibusque veniebat. 
1.40.5.15	 Cyzicus, nobilis civitas, arce, moenibus, portu turribusque marmoreis Asiaticae plagae litora inlustrat. Hanc ille quasi alteram Romam toto invaserat depulisset: dispulisset BL. a: et B. Nicomedes, Ariobarzanes: nichomede abariobar zenae B. tantum: tantus B. alienas raptas scripsi: alienam raptam codd. Cyzicus: ei zicus B: Cyzicum NL. 
1.40.5.16	 bello. Sed fiduciam oppidanis resistendi nuntius fecit, docens adventare Lucullum, qui—horribile dictu—per medias hostium naves utre suspensus et pedibus iter gubernans, videntibus procul quasi marina pristis evaserat. 
1.40.5.17	 Mox clade conversa, cum ex mora obsidii regem fames et ex fame pestilentia urgueret, recedentem Lucullus adsequitur adeoque cecidit, ut Granicus et Aesepus amnes cruenti redderentur. 
1.40.5.18	 Rex callidus Romanaeque avaritiae peritus spargi aurum a fugientibus et pecuniam iussit, qua sequentes moraretur. Nec felicior in mari quam terra fuga. Quippe centum amplius navium classem apparatu belli gravem Pontico mari adgressa tempestas tam foeda strage laceravit, 
1.40.5.19	 ut navalis belli instar efficeret, planeque ut Lucullus quodam cum fluctibus procellisque commercio debellandum tradidisse regem ventis videretur. 
1.40.5.20	 Ad-tritae iam omnes validissimi regni vires erant, sed animus malis augebatur. 
1.40.5.21	 Itaque conversus ad proximas gentes totum paene orientem ac septentrionem ruina sua involvit. Hiberi, Caspii, Albani et utraeque sollicitantur Armeniae, per quae omnia decus et nomen et titulos gloriae Pompeio suo Fortuna quaerebat. 
1.40.5.22	 Qui ubi novis motibus ardere Asiam videt aliosque ex aliis prodire reges, nihil cecidit L: caedit B: caecidit N. Aesepus Salmasius: aesopus codd. centum om. B. Pontico: in pontico NL: pontu B. cunctandum ratus, priusquam inter se gentium robora coirent, statim ponte navibus facto omnium ante se primus transiit Euphratem regemque fugientem media nanctus Armenia—quanta felicitas viri—uno proelio confecit. 
1.40.5.23	 Nocturna ea dimicatio fuit et Luna in partibus. Quippe quasi commilitans cum dea a tergo se hostibus, a facie Romanis praebuisset, Pontici per errorem longius cadentis umbras suas quasi hostium corpora petebant. 
1.40.5.24	 Et Mithridates quidem nocte illa debellatus est. Nihil enim postea valuit, quamquam omnia expertus more anguium, qui optrito capite postremum cauda minantur. 
1.40.5.25	 Quippe cum effugisset hostem Colchis tenus, iungere Bosporon, inde per Thracen Macedoniamque et Graeciam transilire, sic Italiam nec opinatus invadere—tantum cogitavit. 
1.40.5.26	 Sed defectione civium Pharnacisque filii scelere praeventus male temptatum veneno spiritum ferro expulit. 
1.40.5.27	 Gnaeus interim Magnus rebellis Asiae reliquias sequens per diversa gentium terrarumque volitabat. Nam sub orientem secutus Armenios, captis, ipso capite gentis, Artaxatis, supplicem iussit regnare Tigranen. 
1.40.5.28	 At in septentrione Scythicum iter tamquam in mari stellis secutus Colchos cecidit, ignovit Hiberiae, pepercit Albanis. Regem horum Oroden quasi post cum add. B. valuit om. B. captis, ipso capite gentis, Artaxatis NL: captae gentis atrapens supplicem ceteris omissis B. horum Graevius: colchorum codd. Oroden: orhozen B. positis sub ipso Caucaso castris iussit in plana descendere, at Arthocen, qui Hiberis imperabat, obsides liberos dare; Oroden etiam muneravit, ultro ab Albania sua lectum aureum et alia dona mittentem. 
1.40.5.29	 Nec non in meridiem verso agmine Libanum Syriae Damascumque transgressus per nemora illa odorata, per turis et balsami silvas Romana signa circumtulit. 
1.40.5.30	 Arabes, si quid imperaret, praesto fuere. Hierosolyma defendere temptavere Iudaei; verum haec quoque et intravit et vidit illud grande inpiae gentis arcanum patens, sub aurea vite caelum. Dissidentibusque de regno fratribus arbiter factus regnare iussit Hyrcanum; Aristobolum, quia renovabat imperium, in catenas dedit. 
1.40.5.31	 Sic Pompeio duce populus Romanus totam, qua latissima est, Asiam pervagatus, quam extremam imperii habebat provinciam mediam fecit. Exceptis quippe Parthis, qui foedus maluerunt, et Indis, qui adhuc nos nec noverant, omnis Asia inter Rubrum et Caspium et Oceanum Pompeianis domita vel oppressa signis tenebatur. post imperabat add. et codd., dei. Iahnius. Oroden: horolen B. Hierosolyma: ierosolimam B: hierosolymam N. vite: vitae B. totam: tota B: totum (-am man. sec.) N. 
1.41.6.1	 Interim cum populus Romanus per diversa terrarum districtus est, Cilices invaserant maria sublatisque commerciis, rupto foedere generis humani, sic maria bello quasi tempestate praecluserant. 
1.41.6.2	 Audaciam perditis furiosisque latronibus dabat inquieta Mithridaticis proeliis Asia, dum sub alieni belli tumultu exterique regis invidia inpune grassantur. 
1.41.6.3	 Ac primum duce Isidoro contenti proximo mari Cretam inter atque Cyrenas et Achaiam sinumque Maleum, quod ab spoliis aureum ipsi vocavere, 
1.41.6.4	 latrocinabantur. Missusque in eos Publius Servilius, quamvis leves et fugaces myoparonas gravi et Martia classe turbaret, non incruenta victoria superat. 
1.41.6.5	 Sed nec mari summovisse contentus, validissimas urbes eorum et diutina praeda abundantes, Phaselim et Olympum evertit Isaurosque ipsam arcem Ciliciae, unde conscius sibi magni laboris Isaurici cognomen adamavit. 
1.41.6.6	 Non ideo tamen tot cladibus domiti terra se continere potuerunt; sed ut quaedam animalia, quibus aquam terramque incolendi gemina natura est, sub ipso hostis recessu inpatientes soli in aquas suas resiluerunt, et aliquanto latius quam prius Siciliae quoque litora et Campaniam nostram subito adventu terrere voluerunt. 
1.41.6.7	 Sic Cilix dignus victoria Pompei visus est et Mithridaticae provinciae factus accessio. Ille dispersam toto mari pestem semel et in perpetuum volens extinguere divino quodam apparatu adgressus est. 
1.41.6.8	 Quippe cum classibus et suis et socialibus Rhodiorum abundaret, pluribus legatis atque praefectis utraque Ponti et Oceani ora conplexus est. 
1.41.6.9	 Gellius Tusco mari inpositus, Plotius Siculo; Atilius Ligusticum sinum, Pomponius Gallicum obsedit, Torquatus Balearicum, Tiberius Nero Gaditanum fretum, qua primum maris nostri limen aperitur; Lentulus Marcellinus Libycum, Aegyptium, Pompei iuvenes Hadriaticum, Varro Terentius Aegaeum et Ionicum, Pamphylium Metellus, Asiaticum Caepio; 
1.41.6.10	 ipsas Propontidos fauces Porcius Cato sic obditis navibus quasi porta obseravit. 
1.41.6.11	 Sic per omnis aequoris portus, sinus, latebras, recessus, promontoria, freta, paeninsulas quidquid piratarum fuit quadam indagine inclusum est. 
1.41.6.12	 Ipse Pompeius in originem fontemque belli Ciliciam; nec hostes detractavere certamen. 
1.41.6.13	 Non ex fiducia, sed quia oppressi erant, ausi Atilius Gronovius: gratillus B: gratillius NL. Pomponius Dukerus: Pompeius codd. Marcellinus Libycum scripsi: Libycum Marcellinus codd. Ionicum Ormerodius: Ponticum et codd. porta Lipsius: portam codd. videbantur; sed nihil tamen amplius, quam ut ad primum ictum concurrerent. Mox ubi circumfusa undique rostra viderunt, abiectis statim telis remis-que plausu undique pari, quod supplicantium signum fuit, vitam petiverunt. 
1.41.6.14	 Non alia tam incruenta victoria usi umquam sumus, sed nec fidelior in posterum reperta gens ulla est; idque prospectum singulari consilio ducis, qui maritimum genus a conspectu longe removit maris et mediterraneis agris quasi obligavit, eodemque tempore et usum maris navibus recuperavit et terrae homines suos reddidit. 
1.41.6.15	 Quid prius in hac mirere victoria? velocitatem? quadragesimo die parta est. An felicitatem? ne una quidem navis amissa est. An vero perpetuitatem? amplius piratae non fuerunt. 
1.42.7.1	 Creticum bellum, si vera volumus, nos fecimus sola vincendi nobilem insulam cupiditas fecit. Favisse Mithridati videbatur; hoc placuit armis vindicare. 
1.42.7.2	 Primus invasit insulam Marcus Antonius cum ingenti quidem victoriae spe atque fiducia, adeo ut pluris catenas in navibus quam arma portaret. 
1.42.7.3	 Dedit itaque poenas vaecordiae. Nam plerasque naves intercepit hostis, captivaque corpora religantes velis ac funibus suspendere, ac sic velifi- viderunt: viderent B. reperta gens ulla est om. B. nos fecimus sed. Iahnius. cantes triumphantem in modum Cretes portibus suis adremigaverunt. 
1.42.7.4	 Metellus deinde totam insulam igni ferroque populatus intra castella et urbes redegit, Cnoson Eleuthernan et, ut Graeci dicere solent, urbium matrem Cydoneam; 
1.42.7.5	 adeoque saeve in captivos consulebatur, ut veneno se plerique conficerent, alii deditionem suam ad Pompeium absentem mitterent. 
1.42.7.6	 Et cum ille res in Asia gerens eo quoque praefectum misisset Antonium in alienam provinciam, inritus fuit, eoque infestior Metellus in hostes ius victoris exercuit, victisque Lasthene et Panare, Cydoneae ducibus, victor rediit. Nec quicquam tamen amplius de tam famosa victoria quam cognomen Creticum reportavit. 
1.43.8.1	 Quatenus Metelli Macedonici domus bellicis agno-minibus adsueverat, altero ex liberis eius Cretico facto mora non fuit quin alter quoque Balearicus vocaretur. 
1.43.8.2	 Baleares per id tempus insulae piratica rabie maria corruperant. Homines feros atque silvestres mireris ausos a scopulis suis saltem maria prospicere. 
1.43.8.3	 Ascendere etiam inconditas rates et praeternavigantes subinde inopinato impetu terruere. 
1.43.8.4	 Sed cum venientem ab alto Romanam classem pro- Eleuthernan: aetery threan B: et erythream N. consulebatur: consolebatur B: consulabatur N. alienam Mommsenus: aliam B. agnominibus: bacnominibus B: nominibus NL. spexissent, praedam putantes, ausi etiam occurrere, et primo impetu ingenti lapidum saxorumque nimbo classem operuerunt. 
1.43.8.5	 Tribus quisque fundis proeliantur. Certos esse quis miretur ictus, cum haec sola genti arma sint, id unum ab infantia studium? cibum puer a matre non accipit, nisi quem ipsa monstrante percusserit. Sed non diu lapidatione Romanos terruere. 
1.43.8.6	 Nam postquam comminus ventum est expertique rostra et pila venientia, pecudum in morem clamore sublato petiverunt fuga litora, dilapsique in proximos tumulos quaerendi fuerunt ut vincerentur. 
1.44.9.1	 Aderat fatum insularum. Igitur et Cypros recepta sine bello. Insulam veteribus divitiis abundantem et ob hoc Veneri sacram Ptolemaeus regebat. 
1.44.9.2	 
1.44.9.3	 Sed divitiarum tanta erat fama, nec falso, ut victor gentium populus et donare regna consuetus, P. Clodio tribuno plebis duce, socii vivique regis confiscationem mandaverit. 
1.44.9.4	 Et ille quidem ad rei famam veneno fata praecepit. 
1.44.9.5	 Ceterum Porcius Cato Cyprias opes Liburnis per Tiberinum ostium invexit. Quae res latius aerarium populi Romani quam ullus triumphus implevit. accipit: accepit B. 
1.45.10.1	 Asia Pompei manibus subacta reliqua, quae restabant in Europa, Fortuna in Caesarem transtulit. 
1.45.10.2	 Restabant autem inmanissimi gentium Galli atque Germani et quamvis toto orbe divisi, tamen quia vincere libuit, Britanni. Primus Galliae motus ab Helvetiis coepit, qui Rhodanum inter et Rhenum siti, non sufficientibus terris venere sedem petitum, incensis moenibus suis; 
1.45.10.3	 hoc sacramentum fuit, ne redirent. Sed petito tempore ad deliberandum, cum inter moras Caesar Rhodani ponte rescisso fugam abstulisset, statim bellicosissimam gentem sic in sedes suas, quasi greges in stabulum pastor, reduxit. 
1.45.10.4	 Sequens longe longeque cruentior pugna Belgarum, quippe pro libertate pugnantium. Hic cum multa Romanorum militum insignia, tum illud egregium ipsius ducis, quod, nutante in fugam exercitu, rapto fugientis e manu scuto in primam volitans aciem manu proelium restituit. 
1.45.10.5	 Inde cum Venetis etiam navale bellum, sed maior cum Oceano quam cum ipsis navibus rixa. Quippe illae rudes et informes et statim naufragae, cum rostra sensissent; sed haerebat in vadis pugna, fugam Rhed.: fuga cet. cum aestibus solitis in ipso certamine subductus Oceanus intercedere bello videretur. 
1.45.10.6	 Illae quoque accessere diversitates pro gentium locorumque natura. Aquitani, callidum genus, in speluncas se recipiebant: iussit includi; Morini dilabebantur in silvas: iussit incendi. Nemo tantum feroces dixerit Gallos: 
1.45.10.7	 fraudibus agunt. Indutiomarus Treveros, Ambiorix concitavit Eburones. Utrique, absente Caesare coniuratione facta, invasere legatos. 
1.45.10.8	 Sed ille fortiter a Dolabella summotus est, relatum-que regis caput; hic insidiis in valle dispositis dolo perculit. Itaque et castra direpta sunt et Aurunculeium Cottam cum Titurio Sabino legatos amisimus. Nec ulla de rege mox ultio; quippe perpetua trans Rhenum fuga latuit. 
1.45.10.9	 Nec Rhenus ergo inmunis; nec enim fas erat ut liber esset receptator hostium atque defensor. 
1.45.10.10	 Et prima contra Germanos illius pugna iustissimis quidem ex causis. Haedui de incursionibus eorum querebantur. 
1.45.10.11	 Quae Ariovisti regis superbia! cui cum legati dicerent veni ad Caesarem, et quis est Caesar? et si vult, veniat inquit, et quid ad illum, quid agat nostra Germania? num ego me interpono Romanis? 
1.45.10.12	 Itaque tantus gentis novae terror in castris, ut testamenta passim etiam in Morini dilabebantur in silvas Vinetus: morabantur in silvis B: nec mora dilabebantur in silvas A. Aurunculeium Perizonius: aurum ablatum codd. Titurio: tirio B. Ariovisti: tario bisti B: ario iusti L. principiis scriberentur. Sed illa inmania corpora quo maiora erant, eo magis gladiis ferroque patuerunt. 
1.45.10.13	 Qui calor in proeliando militum fuerit, nullo magis exprimi potest quam quod, elatis super caput scutis cum se testudine barbarus tegeret, super ipsa Romani scuta salierunt, et inde in iugulos gladiis descendebant. 
1.45.10.14	 Iterum de Germano Tencteri querebantur. Hic vero iam Caesar ultro Mosellam navali ponte transgreditur ipsumque Rhenum et Hercyniis hostem quaerit in silvis; sed in saltus ac paludes gens omnis diffugerat. Tantum pavoris incussit intra ripam subito Romanus visus. 
1.45.10.15	Nec semel Rhenus, sed iterum quoque, et quidem ponte facto penetratus est. Maior aliquanto trepidatio. Quippe cum Rhenum suum sic ponte quasi iugo captum viderent, fuga rursus in silvas et paludes, et, quod acerbissimum Caesari fuit, non fuere qui vincerentur. 
1.45.10.16	 Omnibus terra marique peragratis respexit Oceanum et, quasi hic Romanis orbis non sufficeret, alterum cogitavit. Classe igitur conparata Britanniam transit mira celeritate; quippe qui tertia vigilia cum Morinorum solvisset a portu, minus quam medio die insulam ingressus est. 
