2.9.21.7	 Inde cum consules Sulpicius et Albinovanus obiecissent catervas suas, et saxa undique a moenibus ac tela iacerentur, ipse quoque iaculatus incendia viam fecit arcemque Capitolii, quae Poenos quoque, quae Gallos etiam Senonas evaserat, quasi captivam victor insedit. 
2.9.21.8	 Tum ex consulto senatus adversariis hostibus iudicatis in praesentem tribunum aliosque diversae factionis iure saevitum est; Marium servilis fuga exemit, immo fortuna alteri bello reservavit. 
2.9.21.9	 Cornelio Cinna Gnaeo Octavio consulibus male obrutum resurrexit incendium, et quidem ab ipsorum discordia, quom de revocandis quos senatus hostes iudicaverat ad populum referretur; 
2.9.21.10	 cincta quidem gladiis contione, sed vincentibus quibus pax et quies potior, profugus patria sua Cinna confugit ad partes. Rediit ab Africa Marius clade maior; si quidem carcer catenae, fuga exilium horrificaverant dignitatem. 
2.9.21.11	 Itaque ad nomen tanti viri late concurritur, servitia—pro nefas—et ergastula armantur, et facile invenit exercitum imperator. 
2.9.21.12	 Itaque vi patriam reposcens, unde vi fuerat ex- quae add. Halmius. tum L. Voss. Palat.: cum BN. quom: quam B. pulsus, poterat videri iure agere, nisi causam suam saevitia corrumperet. Sed cum dis hominibusque infestus rediret, statim primo impetu cliens et alumna urbis Ostia nefanda strage diripitur. 
2.9.21.13	 Mox in urbem quadruplici agmine intratur. Divisere copias Cinna, Marius, Carbo, Sertorius. Hic postquam manus omnis Octavi depulsa Ianiculo est, statim ad principum caedem signo dato aliquanto saevius quam vel in Punica urbe saevitur. 
2.9.21.14	 Octavi consulis caput pro rostris exponitur, Antonii consularis in Mari ipsius mensis. Caesar et Fimbria in penatibus domuum suarum trucidantur, Crassi pater et filius in mutuo alter alterius aspectu. Baebium atque Numitorium per medium forum unci traxere carnificum. 
2.9.21.15	 Catulus se ignis haustu ludibrio hostium exemit. 
2.9.21.16	 Merula flamen Dialis in Capitolio Iovis ipsius oculos venarum cruore respersit. Ancharius ipso vidente Mario confossus est, quia fatalem illam scilicet manum non porrexerat salutanti. 
2.9.21.17	 Haec tot senatus funera intra kalendas et idus Ianuarii mensis septima illa Marii purpura dedit. Quid futurum fuit, si annum consulatus implesset? 
2.9.21.18	 Scipione Norbanoque consulibus tertius ille turbo civilis insaniae toto furore detonuit, quippe cum urbis Ostia: urbs urbis hostia B. Caesar et N L: caesare B. domuum Iahnius: domus B. hinc octo legiones, quingentae cohortes starent in armis, inde ab Asia cum victore exercitu Sulla properaret. 
2.9.21.19	Et sane cum tam ferox in Sullanos Marius fuisset, quanta saevitia opus erat, ut Sulla de Mario vindicaretur? Primum apud Capuam sub amne Vulturno signa concurrunt, et statim omnis Norbani fusus exercitus, statim Scipionis copiae ostentata spe pacis oppressae. 
2.9.21.20	Tum Marius iuvenis et Carbo consules quasi desperata victoria, ne inulti perirent, in antecessum sanguine senatus sibi parentabant, obsessaque curia sic de senatu quasi de carcere qui iugularentur educti. 
2.9.21.21	Quantum funerum in foro, in circo, in penitis templis! nam Mucius Scaevola pontifex Vestalis amplexus aras tantum non eodem igne sepelitur. 
2.9.21.22	 Lamponius atque Telesinus, Samnitum duces, atrocius Pyrrho et Annibale Campaniam Etruriamque populantur, et sub specie partium se vindicant. 
2.9.21.23	 Apud Sacriportum Collinamque portam debellatae omnes hostium copiae; ibi Marius, hic Telesinus oppressi. Nec idem tamen caedium qui belli finis fuit. Stricti enim et in pace gladii, animadversumque in eos, qui se sponte dediderant. Minus est, quod apud Sacriportum, apud Collinam septuaginta milia amplius Sulla concidit: bellum inde post legiones add. BNL, dei. Iahnius. quantum Iahnius i quantum id B: quid NL. penitis Rossbachius: penitentibus B: patentibus NL. Lamponius (cp. Appian, Bell. Civ. I. 40; Plutarch, Sulla, 29): lucius amponius B: Iamponius L. erat. Quattuor milia deditorum inermium civium in Villa Publica interfici iussit: 
2.9.21.25	 isti tot in pace non plures sunt? Quis autem illos potest conputare, quos in urbe passim quisquis voluit occidit? Donec admonente Fufidio vivere aliquos debere, ut essent quibus imperaret, proposita est ingens illa tabula, et ex ipso equestris ordinis flore ac senatu duo milia electi, qui mori iuberentur: novi generis edictum. 
2.9.21.26	 Longum post haec referre ludibrio habita fata Carbonis, fata Sorani, Plaetorios atque Venuleios, Baebium sine ferro ritu ferarum inter manus laniatum, Marium, ducis ipsius fratrem, apud Catuli sepulcrum oculis effossis, manibus cruribusque effractis servatum aliquandiu, ut per singula membra more- 
2.9.21.27	 retur. Possis singulorum hominum ferre poenas: municipia Italiae splendidissima sub hasta venie-runt, Spoletium, Interamnium, Praeneste, Florentia. 
2.9.21.28	 Nam Sulmonem, vetus oppidum socium atque amicum—facinus indignum—non expugnat aut obsidet iure belli; sed quo modo morte damnati duci iubentur, sic damnatam civitatem iussit Sulla deleri. Fufidio Dukerus: forfidio B: furfidio NL. ac—electi om. B. fata fata: facta facta B. Plaetorios atque Venuleios: plaetorius atque venuleius B. 
2.10.22.1	 BELLUM Sertorianum quid amplius quam Sullanae proscriptionis hereditas fuit? Hostile potius an civile dixerim nescio, quippe quod Lusitani Celtiberique Romano gesserint duce. 
2.10.22.2	 Exul et profugus feralis illius tabulae, vir summae quidem sed calamitosae virtutis malis suis maria terrasque permiscuit; et iam Africae, iam Balearibus insulis fortunam expertus usque in Oceanum Fortunatasque Insulas penetravit consiliis, tandem Hispaniam armavit. 
2.10.22.3	 Viro cum viris facile convenit. Nec alias magis apparuit Hispani militis vigor quam Romano duce. 
2.10.22.4	 Quamquam ille non contentus Hispania ad Mithridatem quoque Ponticosque respexit regemque classe iuvit. 
2.10.22.5	 Et quid futurum fuit satis tanto hosti, cui uno imperatore resistere res Romana non potuit? additus Metello Gnaeus Pompeius. 
2.10.22.6	 Hi copias adtrivere viri, prope tota Hispania persecuti. Diu et ancipiti semper acie pugnatum est; nec tamen prius bello quam suorum scelere et insidiis extinctus est. Prima per legatos habita certamina, cum hinc Domitius et Thorius, inde Hirtulei proluderent; 
2.10.22.7	 mox his apud Segoviam, illis apud Anam flumen oppressis, ipsi duces comminus invicem experti apud Lauronem atque Sucronem respexit: perrexit B. hi—extinctus est Iahnius et Halmius: hic copias adtri-verant viri diu et ancipiti semper acie pugnatum est. Nec tamen prius bello quam suorum scelere et insidiis extinctus est. Copias eius prope tota hispania persequuti diu et varia semper acie domaverunt B: hi copias viri diu et ancipitis (ancipiti L) semper acie adtribuere (adtrivere L) nec tamen prius bello quam suorum scelere et insidiis extinctus copias eius prope tota (totas L) hispania persecuti diu et ancipiti semper acie donaverunt NL. aequavere clades. Tum illis ad populationes agrorum, 
2.10.22.8	his ad urbium excidia conversis, misera inter Romanos duces Hispania discordiae poenas dabat; 
2.10.22.9	 donec oppresso domestica fraude Sertorio, victo deditoque Perperna, ipsae quoque in Romanam fidem venere urbes Osca, Termes, Vlia, Valentia, Auxuma et in fame nihil non experta Calagurris. Sic recepta in pacem Hispania. Victores duces externum id magis quam civile bellum videri voluerunt, ut triumpharent. 
2.11.23.1	 MARCO LEPIDO Quinto Catulo consulibus civile bellum paene citius oppressum est quam inciperet: sed quantulacumque fax illius motus ab ipso Sullae rogo exarsit. 
2.11.23.2	 Cupidus rerum novarum per insolentiam Lepidus acta tanti viri rescindere parabat; nec inmerito, si tamen posset sine magna clade rei publicae. 
2.11.23.3	 Nam cum iure belli Sulla dictator proscripsisset inimicos, qui supererant revocante Lepido quid aliud quam ad bellum vocabantur? Cumque damnatorum civium bona addicente Sulla quamvis male capta iure tamen tenerentur, repetitio eorum procul dubio labe- ad populationes agrorum: apopulatione sacrorum B: ad populationem agrorum NL. Termes, Vlia Salmasius et Iahnius: tergaest cum B: termestudia N L. tenerentur add. Dukerus. 
2.11.23.4	 factabat compositae civitatis statum. Expediebat ergo quasi aegrae sauciaeque rei publicae quiescere quomodocumque, ne volnera curatione ipsa rescinderentur. 
2.11.23.5	 Ergo cum turbidis contionibus velut classico civitatem terruisset, profectus in Etruriam arma inde et exercitum urbi admovebat. 
2.11.23.6	 Sed iam Mulvium pontem collemque Ianiculum Lutatius Catulus Gnaeusque Pompeius, Sullanae dominationis duces atque signiferi, alio exercitu insederant. 
2.11.23.7	 A quibus primo statim impetu retro pulsus hostisque a senatu iudicatus incruenta fuga Etruriam, inde Sardiniam recessit, ibique morbo et paenitentia interiit. 
2.11.23.8	 Victores quoque, quod non temere alias in civilibus bellis, pace contenti fuerunt. 
2.12.1.1	 CATILINAM luxuria primum, tum hinc conflata egestas rei familiaris, simul occasio, quod in extremis finibus mundi arma Romana peregrinabantur, in nefaria consilia opprimendae patriae suae conpulere. 
2.12.1.2	Senatum confodere, consules trucidare, distringere incendiis urbem, diripere aerarium, totam denique rem publicam funditus tollere et quidquid nec Annibal videretur optasse, quibus— ne om. B. curatione: cutio B. Lutatius: latius B. pace: pacis B. tum: cum B: tu N. conpulere: contulere B. 
2.12.1.3	 o nefas—sociis adgressus est! Ipse patricius; sed hoc minus est: Curii, Porcii, Sullae, Cethegi, Autronii, Varguntei atque Longini, quae familiae! quae senatus insignia! Lentulus quoque tum cum maxime praetor. Hos omnis inmanissimi facinoris satellites habuit. 
2.12.1.4	 Additum est pignus coniurationis sanguis humanus, quem circumlatum pateris bibere: summum nefas, ni amplius esset, 
2.12.1.5	 propter quod biberunt. Actum erat de pulcherrimo imperio, nisi illa coniuratio in Ciceronem et Antonium consules incidisset, quorum alter industria rem patefecit, alter manu oppressit. 
2.12.1.6	 Tanti sceleris indicium per Fulviam emersit, vilissimum scortum, sed patriciis innocentius. 
2.12.1.7	 Consul habito senatu in praesentem reum peroravit; sed non amplius profectum, quam ut hostis evaderet seque tum palam ac professe incendium suum restincturum ruina minaretur. 
2.12.1.8	 Et ille quidem ad praeparatum a Manlio in Etruria exercitum proficiscitur signa inlaturus urbi. Lentulus, destinatum familiae suae Sibyllinis versibus regnum sibi vaticinans, ad praestitutum a Catilina diem urbe tota viros, faces, 
2.12.1.9	 tela disponit. Nec civili conspiratione contentus legatos Allobrogum, qui tum forte aderant, in ni: ne B. tum: cum B. legatos Halmius: legatis NL: om. B. arma sollicitat. Isset ultra Alpes furor, nisi altera proditione Volturci praetoris litterae tenerentur. Statim Ciceronis imperio iniecta est barbaris manus; 
2.12.1.10	 palam praetor in senatu convincitur. De supplicio agentibus, Caesar parcendum dignitati, Cato animadvertendum pro scelere censebant. 
2.12.1.11	 Quam sententiam secutis omnibus in carcere parricidae strangulantur. Quamvis parte coniurationis oppressa, tamen ab incepto Catilina non destitit; infestis ab Etruria signis patriam petens obvio Antonii exercitu opprimitur. 
2.12.1.12	 Quam atrociter dimicatum sit, exitus docuit. Nemo hostium bello superfuit; quem quis in pugnando ceperat locum, eum amissa anima corpore tegebat. Catilina longe a suis inter hostium cadavera repertus est, pulcherrima morte, si pro patria sic concidisset. 
2.13.2.1	 IAM toto orbe paene pacato maius erat imperium Romanum, quam ut ullis exteris viribus opprimi posset. Itaque invidens fortuna principi gentium populo ipsum illum in exitium sui armavit. 
2.13.2.2	 Ac sollicitat. Isset Halmius: sollicitatis. Sed B: solli-citatiset. Isset N: sollicitatis isset L. Mariana quidem Cinnanaque rabies iam intra urbem praeluserat, quasi si experiretur. Sullana tempestas latius, intra Italiam tamen, detonuerat. 
2.13.2.3	 Caesaris furor atque Pompei urbem Italiam, gentes nationes, totum denique qua patebat imperium quodam quasi diluvio et inflammatione corripuit, adeo ut non recte tantum civile dicatur, 
2.13.2.4	 ac ne sociale quidem, sed nec externum, sed potius commune quoddam ex omnibus et plus quam bellum. 
2.13.2.5	 Quippe si duces eius inspicias, totus senatus in partibus; si exercitus, hinc undecim legiones, inde decem et octo, flos omnis et robur Italici sanguinis; si auxilia sociorum, hinc Gallici Germanique dilectus, inde Deiotarus, Ariobarzanes, Tarcondimotus, Cotys et Rhascypolis, omne Thraciae, Cappadociae, Macedoniae, Ciliciae, 
2.13.2.6	 Graeciae totiusque robur orientis; si moram belli, quattuor anni, sed pro clade rerum breves; si locum et spatium, commissum est intra Italiam, inde se in Galliam Hispaniamque deflexit re-versumque ab occasu totis viribus in Epiro Thessa-liaque consedit; hinc in Aegyptum subito transi-luit, inde respexit Asiam, Africae incubuit, postremo in Hispaniam regyravit et ibi aliquando defecit. 
2.13.2.7	 Sed non et odia partium finita cum bello. Non praeluserat Graevius: praecluserat B: precluxerat L. totum denique qua patebat: totumque potibat B: totum denique patebat L. Tarcondimotus, Cotys et Rhascypolis: tarcondi motus cotys et thascypolis B. anni, sed: annis sed B: anni et L. breves Halmius: breve B: breve tempus NL. ubi post spatium dei. Perizonius. regyravit: regiravit L: regnavit B. enim prius quieverunt, quam in ipsa urbe medio senatu eorum, qui victi erant, odia victoris se caede satiarent. 
2.13.2.8	 Causa tantae calamitatis eadem quae omnium, nimia felicitas. Si quidem Quinto Metello Lucio Afranio consulibus cum Romana maiestas toto orbe polleret recentesque victorias, Ponticos et Armenios triumphos, in Pompeianis theatris Roma cantaret, nimia Pompei potentia apud otiosos, ut solet, cives movit invidiam. 
2.13.2.9	 Metellus ob inminutum Cretae triumphum, Cato adversus potentes semper obliquus detrectare Pompeio actisque eius obstrepere. Hic dolor transversum egit et ad praesidia dignitati paranda inpulit. 
2.13.2.10	 Forte tunc Crassus genere, divitiis, dignitate florebat, ut vellet tamen auctions opes; C. Caesar eloquentia et spiritu, ecce iam et consulatu adlevabatur; Pompeius tamen inter utrumque eminebat. 
2.13.2.11	 Sic igitur Caesare dignitatem conparare, Crasso augere, Pompeio retinere cupientibus, omnibusque pariter potentiae cupidis de invadenda re publica facile convenit. 
2.13.2.12	 Ergo cum mutuis viribus in suum quisque decus niterentur, Galliam Caesar invadit, Crassus Asiam, Pompeius Hispaniam: tres maximi exercitus, et in his orbis imperium societate eadem quae Aldus: eademque codd. Afranio: Africano B. ut add. Mommsenus. 
2.13.2.13	 trium principum occupatur. Decem annos traxit ista dominatio ex fide, quia mutuo metu tenebantur. Crassi morte apud Parthos, morte Iuliae Caesaris filiae, quae nupta Pompeio generi socerique concordiam matrimonii foedere continebat, statim aemulatio erupit. 
2.13.2.14	 Iam Pompeio suspectae Caesaris opes et Caesari Pompeiana dignitas gravis. Nec ille ferebat parem, nec hic superiorem. Pro nefas! Sic de principatu laborabant, tamquam duos tanti imperii fortuna non caperet. 
2.13.2.15	 Ergo Lentulo Marcelloque consulibus rupta primum coniurationis fides. De successione Caesaris senatus, id est Pompeius, agitabat, nec ille abnuebat, si ratio sui proximis comitiis haberetur. 
2.13.2.16	 Ut daretur consulatus absenti, quem decem tribuni favente Pompeio nuper decreverant, dissimulante eodem negabatur: veniret et peteret more maiorum. 
2.13.2.17	 Ille contra flagitare decreta, ac, nisi fides permaneret, non remittere exercitum. Ergo ut in hostem decernitur. His Caesar agitatus statuit praemia armorum armis defendere. 
2.13.2.18	 Prima civilis belli harena Italia fuit, cuius arces levibus praesidiis Pompeius insederat; sed omnia primum coniurationis fides Halmius: prima coniurationis fide codd. 
2.13.2.19	 subito Caesaris impetu oppressa sunt. Prima Arimino signa cecinerunt. Tum pulsus Etruria Libo, Vmbria Thermus, Domitius Corfinio. Et peractum erat bellum sine sanguine, si Pompeium Brundisii opprimere potuisset. 
2.13.2.20	 Et ceperat; sed ille per obsessi claustra portus nocturna fuga evasit. Turpe dictu: modo princeps patrum, pacis bellique moderator, per triumphatum a se mare lacera et paene inermi nave fugiebat. 
2.13.2.21	 Nec Pompei ab Italia quam senatus ab urbe fuga turpior: quam paene vacuam, metu Caesar ingressus consulem se ipse fecit. Aerarium quoque sanctum, quod quia tardius aperiebant tribuni iussit effringi, censumque et patrimonium populi Romani ante rapuit quam imperium. 
2.13.2.22	 Pulso fugatoque Pompeio maluit prius ordinare provincias quam ipsum sequi. Siciliam et Sardiniam, 
2.13.2.23	 annonae pignera, per legatos habet. Nihil hostile erat in Gallia; pacem ipse fecerat. Sed ad Hispanienses Pompei exercitus transeunti per eam duci portas claudere ausa Massilia est. Misera dum cupit pacem, belli metu in bellum incidit; sed quia tuta muris erat, vinci eam sibi iussit absenti. fuga turpior Gruterus: fugatur prior BNL. 
2.13.2.24	 Graecula civitas non pro mollitia nominis et vallum rumpere et incendere machinas ausa, etiam congredi navibus; 
2.13.2.25	 sed Brutus, cui mandatum erat bellum, victos terra marique perdomuit. Mox dedentibus se omnia ablata praeter quam potiorem omnibus habebant libertatem. 
2.13.2.26	 Anceps variumque sed incruentum in Hispania bellum cum legatis Gnaei Pompei, Petreio et Afranio, quos Ilerdae castra habentes apud Sicorim amnem obsidere et ab oppido intercludere adgreditur. 
2.13.2.27	 Interim abundatio verni fluminis commeatibus prohibebat: sic fame castra temptata sunt, 
2.13.2.28	 obsessorque ipse quasi obsidebatur. Sed ubi pax fluminis redit, et populationibus et pugnae campos aperuit, iterum ferox instat et cedentes ad Celtiberiam consecutus aggere et vallo et per haec siti ad deditionem conpulit. 
2.13.2.29	Sic citerior Hispania recepta est, nec ulterior moram fecit. Quid enim una post quinque legiones? Itaque ultro cedente Varrone Gades, fretum, Oceanus, omnia felicitatem Caesaris sequebantur. 
2.13.2.30	 Aliquid tamen adversus absentem ducem ausa Fortuna est circa Illyricum et Africam, quasi de industria prospera eius adversis radiaret; 
2.13.2.31	quippe cum fauces Adriani maris iussi occupare Dolabella et add. Salmasius. pugnae: pugna BL. conpulit: contulit B. Illyricum: illirium B: illiricum L. moranti post Africam add. B. radiaret: radiarent B: radiarentur NL. iussi: iussit B. et Antonius, ille Illyrico, hic Curictico litore castra posuissent, iam maria late tenente Pompeio, repente legatus eius Octavius Libo ingentibus copiis classicorum utrumque circumvenit. 
2.13.2.32	 Deditionem fames extorsit Antonio. Missae quoque a Basilo in auxilium eius rates, quales inopia navium fecerat, nova Pompeianorum arte Cilicum actis sub mari funibus captae quasi per indaginem. 
2.13.2.33	 Duas tamen aestus explicuit. Una, quae Opiterginos ferebat, in vadis haesit memorandumque posteris exemplum dedit. Quippe vix mille iuvenum manus circumfusi undique exercitus per totum diem tela sustinuit, et cum exitum virtus non haberet, tandem, ne in deditionem veniret, hortante tribuno Vulteio mutuis ictibus inter se concurrit. 
2.13.2.34	 In Africa quoque par et virtus et calamitas Curionis fuit, qui ad recipiendam provinciam missus, pulso fugatoque Varo superbus, subitum Iubae regis adventum equitatumque Maurorum sustinere non potuit. Patebat victo fuga; sed pudor suasit, ut amissum sua temeritate exercitum morte sequeretur. 
2.13.2.35	 Sed iam debitum par Fortuna flagitante sedem bello Pompeius Epiron elegerat; nec Caesar morabatur. 
2.13.2.36	 Quippe ordinatis a tergo omnibus, quamvis Curictico: currictico L: syretico B. ingentibus: genibus B. a Basilo Asulanus: ablatio B: ablasio N L. fecerat: fecerant B. exemplum Freinshemius: exitum codd. tandem Iahnius: tamen codd. Varo: varro B. morte: mortis B. hiemps media prohiberet tempestate, ad bellum navigavit; 
2.13.2.37	 positisque ad Oricum castris, cum pars exercitus ob inopiam navium cum Antonio relicta Brundisii moram faceret, adeo inpatiens erat, ut ad arcessendos eos ardente ventis mari, nocte concubia, speculatorio navigio solus ire temptaverit. Extat ad trepidum tanto discrimine gubernatorem vox ipsius, Quid times? Caesarem venis. Contractis in unum undique omnibus copiis positisque comminus castris diversa erant ducum consilia. 
2.13.2.38	 Caesar pro natura ferox et conficiendae rei cupidus ostentare aciem, provocare, lacessere; 
2.13.2.39	 nunc obsidione castrorum, quae sedecim milium vallo obduxerat—sed quid iis obesset obsidio, qui patente mari omnibus copiis abundarent?—nunc expugnatione Dyrrachi inrita, quippe quam vel situs inexpugnabilem faceret; 
2.13.2.40	 ad hoc adsiduis in eruptione hostium proeliis, quo tempore egregia virtus Scaevolae centurionis emicuit, cuius in scuto centum atque viginti tela sederunt; 
2.13.2.41	 iam vero urbium direptione sociarum, cum Oricum et Gomphos et alia castella 
2.13.2.42	 Thessaliae vastaret. Pompeius adversus haec nectere moras, tergiversari, sic hostem interclusum undique quid times om. B. iis: is B. vel: vis B. in eruptione: inruptione B: ineruptionem L. castella om. B. inopia commeatuum terere, usque dum ardentissimi ducis consenesceret impetus. 
2.13.2.43	 Nec diutius profuit ducis salutare consilium. Miles otium, socii moram, principes ambitum ducis increpabant. Sic praecipitantibus fatis proelio sumpta Thessalia est, et Philippicis campis urbis, imperii, generis humani fata commissa sunt. 
2.13.2.44	 Numquam ullo loco tantum virium populi Romani, tantum dignitatis Fortuna respexit: trecenta amplius milia hinc vel illinc praeter auxilia, reges et senatum. 
2.13.2.45	 Numquam inminentis ruinae manifestiora prodigia: fuga victimarum, examina in signis, interdiu tenebrae. Dux ipse in nocturna imagine plausu theatri sui in modum planctus circumsonatus et mane cum pullo pallio—nefas—apud principia conspectus est. 
2.13.2.46	 Numquam acrior neque alacrior exercitus Caesaris fuit; inde classica prius, inde tela. Adnotatum quoque committentis aciem Crastini pilum, qui mox adacto in os gladio—sic inter cadavera repertus est— libidinem ac rabiem qua pugnaverat ipsa novitate volneris praeferebat. 
2.13.2.47	 Sed nec minus admirabilior illius exitus belli. Quippe cum Pompeius adeo equitum copia abundaret, ut facile circumventurus urbis: orbis B. plausu theatri sui in modum Mommsenus: plausum theatrisui audiens in modum B. illius: ullius B. sibi Caesarem videretur, circumventus ipse est. 
2.13.2.48	 Nam cum diu aequo Marte contenderent, iussuque Pompei fusus a cornu erupisset equitatus, repente hinc signo dato Germanorum cohortes tantum in effusos equites fecere impetum, ut illi esse pedites, 
2.13.2.49	 hi venire in equis viderentur. Hanc stragem fugientis equitatus levis armaturae ruina comitata est; tunc terrore latius dato, turbantibus invicem copiis, reliqua strages quasi una manu facta est; nec ulla res magis exitio fuit quam ipsa exercitus magnitudo. 
2.13.2.50	 Multus in eo proelio Caesar fuit mediusque inter imperatorem et militem. Voces quoque obequitantis acceptae, altera cruenta, sed docta et ad victoriam efficax miles faciem feri! altera ad iactationem conposita parce civibus! 
2.13.2.51	 cum ipse sequeretur felicem utcumque in malis Pompeium, si eadem ipsum quae exercitum eius fortuna traxisset. Superstes dignitatis suae vixit, ut cum maiore dedecore per Thessalica Tempe equo fugeret, ut una navicula Lesbon applicaret, ut Syedris in deserto Ciliciae scopulo fugam in Parthos, 
2.13.2.52	 Africam vel Aegyptum agitaret, ut denique Pelusio litore imperio vilissimi regis, consiliis spadonum et, ne quid malis desit, Septimii desertoris sui post fusus add. B. esse: essent B. hi: ulli B. ipsum quae: ipsumque BL. applicaret, ut Rossbachius: applicarentur et B. Syedris Salmasius: hedris codd. sui gladio trucidatus sub oculis uxoris suae libero-rumque moreretur. 
2.13.2.53	 Quis non peractum esse cum Pompeio crederet? Atquin acrius multo atque vehementius Thessalici incendii cineres recaluerunt. 
2.13.2.54	 Et in Aegypto qui- 
2.13.2.55	 dem adversus Caesarem sine partibus bellum. Quippe cum Ptolemaeus, rex Alexandriae, summum civilis belli scelus peregisset et foedus amicitiae cum Caesare medio Pompei capite sanxisset, ultionem clarissimi viri manibus quaerente Fortuna causa non defuit. 
2.13.2.56	 Cleopatra, regis soror, adfusa Caesaris genibus partem regni reposcebat. Aderat puellae forma, et quae duplicaretur ex illo, quod talis passa videbatur iniuriam, et odium ipsius regis, 
2.13.2.57	 qui Pompei caedem partium fato, non Caesari dederat, haud dubie idem in ipsum ausurus, si fuisset occasio. 
2.13.2.58	Quam ubi Caesar restitui iussit in regnum, statim ab isdem percussoribus Pompei obsessus in regia quamvis exigua manu ingentis exercitus molem mira virtute sustinuit. 
2.13.2.59	 Ac primum proximorum aedificiorum atque navalium incendio infestorum hostium tela summovit, mox in paenin-sulam Pharon subitus evasit; inde depulsus in maria mira felicitate ad proximam classem enatavit, relicto ultionem clarissimi viri manibus quaerente Fortuna: ultionem quaemanibus clarissimi viri omnibus quaerente fortunae B. et post forma sed. et ante odium add. dubitanter Rossbachius. Pompeii caedem: pompeium regem B: pompeio aedem N: pompeii cedem L. idem om. B. fuisset occasio: ruisset hoccasio B. atque navalium om. B. quidem in fluctibus paludamento seu fato seu consilio, ut illud ingruentibus hostium telis saxisque peteretur. 
2.13.2.60	 Tunc receptus a classicis suis, undique simul hostes adortus de inbelli ac perfida gente iusta generi manibus dedit. Quippe et Theodotus magister auctorque totius belli, et ne virilia quidem portenta, Pothinus atque Ganymedes diversa per mare et terras fuga morte consumpti. Regis ipsius corpus obrutum limo repertum est in aureae loricae honore. 
